tradeTime,openPrice,highPrice,lowPrice,lastPrice,priceChange,percentChange,volume,openInterest,raw
06/17/2025,2.3582,2.4890,2.3511,2.4711,+0.0976,+4.11%,"114,279","77,951","{'tradeTime': '2025-06-17', 'openPrice': 2.3582, 'highPrice': 2.489, 'lowPrice': 2.3511, 'lastPrice': 2.4711, 'priceChange': 0.0976, 'percentChange': 0.041120707815, 'volume': 114279, 'openInterest': 77951}"
06/16/2025,2.3778,2.4572,2.2848,2.3735,+0.0332,+1.42%,"121,511","77,270","{'tradeTime': '2025-06-16', 'openPrice': 2.3778, 'highPrice': 2.4572, 'lowPrice': 2.2848, 'lastPrice': 2.3735, 'priceChange': 0.0332, 'percentChange': 0.014186215442, 'volume': 121511, 'openInterest': 77270}"
06/13/2025,2.2003,2.3781,2.1953,2.3403,+0.1599,+7.33%,"132,211","83,161","{'tradeTime': '2025-06-13', 'openPrice': 2.2003, 'highPrice': 2.3781, 'lowPrice': 2.1953, 'lastPrice': 2.3403, 'priceChange': 0.1599, 'percentChange': 0.073335167859, 'volume': 132211, 'openInterest': 83161}"
06/12/2025,2.2050,2.2070,2.1607,2.1804,-0.0141,-0.64%,"55,459","82,260","{'tradeTime': '2025-06-12', 'openPrice': 2.205, 'highPrice': 2.207, 'lowPrice': 2.1607, 'lastPrice': 2.1804, 'priceChange': -0.0141, 'percentChange': -0.006425153794, 'volume': 55459, 'openInterest': 82260}"
06/11/2025,2.1240,2.1995,2.1134,2.1945,+0.0674,+3.17%,"51,904","79,824","{'tradeTime': '2025-06-11', 'openPrice': 2.124, 'highPrice': 2.1995, 'lowPrice': 2.1134, 'lastPrice': 2.1945, 'priceChange': 0.0674, 'percentChange': 0.031686333506, 'volume': 51904, 'openInterest': 79824}"
06/10/2025,2.1281,2.1570,2.1174,2.1271,-0.0018,-0.08%,"54,386","75,792","{'tradeTime': '2025-06-10', 'openPrice': 2.1281, 'highPrice': 2.157, 'lowPrice': 2.1174, 'lastPrice': 2.1271, 'priceChange': -0.0018, 'percentChange': -0.000845507069, 'volume': 54386, 'openInterest': 75792}"
06/09/2025,2.1162,2.1323,2.1057,2.1289,+0.0177,+0.84%,"48,274","73,058","{'tradeTime': '2025-06-09', 'openPrice': 2.1162, 'highPrice': 2.1323, 'lowPrice': 2.1057, 'lastPrice': 2.1289, 'priceChange': 0.0177, 'percentChange': 0.008383857522, 'volume': 48274, 'openInterest': 73058}"
06/06/2025,2.0843,2.1174,2.0711,2.1112,+0.0264,+1.27%,"43,588","68,875","{'tradeTime': '2025-06-06', 'openPrice': 2.0843, 'highPrice': 2.1174, 'lowPrice': 2.0711, 'lastPrice': 2.1112, 'priceChange': 0.0264, 'percentChange': 0.012663085188, 'volume': 43588, 'openInterest': 68875}"
06/05/2025,2.0626,2.0983,2.0539,2.0848,+0.0219,+1.06%,"32,204","65,774","{'tradeTime': '2025-06-05', 'openPrice': 2.0626, 'highPrice': 2.0983, 'lowPrice': 2.0539, 'lastPrice': 2.0848, 'priceChange': 0.0219, 'percentChange': 0.010616122934, 'volume': 32204, 'openInterest': 65774}"
06/04/2025,2.0910,2.0993,2.0514,2.0629,-0.0262,-1.25%,"46,016","62,691","{'tradeTime': '2025-06-04', 'openPrice': 2.091, 'highPrice': 2.0993, 'lowPrice': 2.0514, 'lastPrice': 2.0629, 'priceChange': -0.0262, 'percentChange': -0.012541285721, 'volume': 46016, 'openInterest': 62691}"
06/03/2025,2.0573,2.0959,2.0434,2.0891,+0.0507,+2.49%,"52,178","62,176","{'tradeTime': '2025-06-03', 'openPrice': 2.0573, 'highPrice': 2.0959, 'lowPrice': 2.0434, 'lastPrice': 2.0891, 'priceChange': 0.0507, 'percentChange': 0.02487244898, 'volume': 52178, 'openInterest': 62176}"
06/02/2025,1.9965,2.0784,1.9965,2.0384,+0.0413,+2.07%,"39,292","58,126","{'tradeTime': '2025-06-02', 'openPrice': 1.9965, 'highPrice': 2.0784, 'lowPrice': 1.9965, 'lastPrice': 2.0384, 'priceChange': 0.0413, 'percentChange': 0.02067998598, 'volume': 39292, 'openInterest': 58126}"
05/30/2025,2.0211,2.0403,1.9829,1.9971,-0.0287,-1.42%,"41,411","57,921","{'tradeTime': '2025-05-30', 'openPrice': 2.0211, 'highPrice': 2.0403, 'lowPrice': 1.9829, 'lastPrice': 1.9971, 'priceChange': -0.0287, 'percentChange': -0.014167242571, 'volume': 41411, 'openInterest': 57921}"
05/29/2025,2.0582,2.0911,2.0190,2.0258,-0.0367,-1.78%,"26,305","54,406","{'tradeTime': '2025-05-29', 'openPrice': 2.0582, 'highPrice': 2.0911, 'lowPrice': 2.019, 'lastPrice': 2.0258, 'priceChange': -0.0367, 'percentChange': -0.017793939394, 'volume': 26305, 'openInterest': 54406}"
05/28/2025,2.0481,2.0841,2.0413,2.0625,+0.0202,+0.99%,"30,141","56,671","{'tradeTime': '2025-05-28', 'openPrice': 2.0481, 'highPrice': 2.0841, 'lowPrice': 2.0413, 'lastPrice': 2.0625, 'priceChange': 0.0202, 'percentChange': 0.009890809382, 'volume': 30141, 'openInterest': 56671}"
05/27/2025,2.0790,2.0822,2.0356,2.0423,-0.0237,-1.15%,"34,977","54,461","{'tradeTime': '2025-05-27', 'openPrice': 2.079, 'highPrice': 2.0822, 'lowPrice': 2.0356, 'lastPrice': 2.0423, 'priceChange': -0.0237, 'percentChange': -0.011471442401, 'volume': 34977, 'openInterest': 54461}"
05/23/2025,2.0632,2.0742,2.0371,2.0660,-0.0019,-0.09%,"28,200","54,708","{'tradeTime': '2025-05-23', 'openPrice': 2.0632, 'highPrice': 2.0742, 'lowPrice': 2.0371, 'lastPrice': 2.066, 'priceChange': -0.0019, 'percentChange': -0.000918806519, 'volume': 28200, 'openInterest': 54708}"
05/22/2025,2.0783,2.0840,2.0395,2.0679,-0.0215,-1.03%,"28,298","53,160","{'tradeTime': '2025-05-22', 'openPrice': 2.0783, 'highPrice': 2.084, 'lowPrice': 2.0395, 'lastPrice': 2.0679, 'priceChange': -0.0215, 'percentChange': -0.010290035417, 'volume': 28298, 'openInterest': 53160}"
05/21/2025,2.0938,2.1299,2.0704,2.0894,+0.0080,+0.38%,"30,088","51,615","{'tradeTime': '2025-05-21', 'openPrice': 2.0938, 'highPrice': 2.1299, 'lowPrice': 2.0704, 'lastPrice': 2.0894, 'priceChange': 0.008, 'percentChange': 0.00384356683, 'volume': 30088, 'openInterest': 51615}"
05/20/2025,2.0775,2.0940,2.0627,2.0814,+0.0037,+0.18%,"25,815","49,518","{'tradeTime': '2025-05-20', 'openPrice': 2.0775, 'highPrice': 2.094, 'lowPrice': 2.0627, 'lastPrice': 2.0814, 'priceChange': 0.0037, 'percentChange': 0.001780815325, 'volume': 25815, 'openInterest': 49518}"
05/19/2025,2.0872,2.0950,2.0630,2.0777,-0.0124,-0.59%,"22,770","46,214","{'tradeTime': '2025-05-19', 'openPrice': 2.0872, 'highPrice': 2.095, 'lowPrice': 2.063, 'lastPrice': 2.0777, 'priceChange': -0.0124, 'percentChange': -0.005932730491, 'volume': 22770, 'openInterest': 46214}"
05/16/2025,2.0892,2.1021,2.0619,2.0901,-0.0025,-0.12%,"29,204","44,807","{'tradeTime': '2025-05-16', 'openPrice': 2.0892, 'highPrice': 2.1021, 'lowPrice': 2.0619, 'lastPrice': 2.0901, 'priceChange': -0.0025, 'percentChange': -0.001194686037, 'volume': 29204, 'openInterest': 44807}"
05/15/2025,2.1194,2.1220,2.0677,2.0926,-0.0423,-1.98%,"49,386","43,596","{'tradeTime': '2025-05-15', 'openPrice': 2.1194, 'highPrice': 2.122, 'lowPrice': 2.0677, 'lastPrice': 2.0926, 'priceChange': -0.0423, 'percentChange': -0.019813574406, 'volume': 49386, 'openInterest': 43596}"
05/14/2025,2.1231,2.1406,2.1053,2.1349,+0.0109,+0.51%,"46,752","42,846","{'tradeTime': '2025-05-14', 'openPrice': 2.1231, 'highPrice': 2.1406, 'lowPrice': 2.1053, 'lastPrice': 2.1349, 'priceChange': 0.0109, 'percentChange': 0.005131826742, 'volume': 46752, 'openInterest': 42846}"
05/13/2025,2.0751,2.1270,2.0670,2.1240,+0.0485,+2.34%,"29,598","42,683","{'tradeTime': '2025-05-13', 'openPrice': 2.0751, 'highPrice': 2.127, 'lowPrice': 2.067, 'lastPrice': 2.124, 'priceChange': 0.0485, 'percentChange': 0.023367863166, 'volume': 29598, 'openInterest': 42683}"
05/12/2025,2.0498,2.1020,2.0397,2.0755,+0.0373,+1.83%,"26,167","43,942","{'tradeTime': '2025-05-12', 'openPrice': 2.0498, 'highPrice': 2.102, 'lowPrice': 2.0397, 'lastPrice': 2.0755, 'priceChange': 0.0373, 'percentChange': 0.018300461191, 'volume': 26167, 'openInterest': 43942}"
05/09/2025,2.0295,2.0525,2.0194,2.0382,+0.0219,+1.09%,"27,269","42,128","{'tradeTime': '2025-05-09', 'openPrice': 2.0295, 'highPrice': 2.0525, 'lowPrice': 2.0194, 'lastPrice': 2.0382, 'priceChange': 0.0219, 'percentChange': 0.010861478947, 'volume': 27269, 'openInterest': 42128}"
05/08/2025,1.9572,2.0308,1.9572,2.0163,+0.0504,+2.56%,"27,078","41,742","{'tradeTime': '2025-05-08', 'openPrice': 1.9572, 'highPrice': 2.0308, 'lowPrice': 1.9572, 'lastPrice': 2.0163, 'priceChange': 0.0504, 'percentChange': 0.025637112773, 'volume': 27078, 'openInterest': 41742}"
05/07/2025,2.0054,2.0221,1.9600,1.9659,-0.0332,-1.66%,"21,968","39,752","{'tradeTime': '2025-05-07', 'openPrice': 2.0054, 'highPrice': 2.0221, 'lowPrice': 1.96, 'lastPrice': 1.9659, 'priceChange': -0.0332, 'percentChange': -0.016607473363, 'volume': 21968, 'openInterest': 39752}"
05/06/2025,1.9663,2.0182,1.9647,1.9991,+0.0355,+1.81%,"18,178","39,062","{'tradeTime': '2025-05-06', 'openPrice': 1.9663, 'highPrice': 2.0182, 'lowPrice': 1.9647, 'lastPrice': 1.9991, 'priceChange': 0.0355, 'percentChange': 0.018079038501, 'volume': 18178, 'openInterest': 39062}"
05/05/2025,1.9557,1.9768,1.9251,1.9636,-0.0186,-0.94%,"16,646","39,989","{'tradeTime': '2025-05-05', 'openPrice': 1.9557, 'highPrice': 1.9768, 'lowPrice': 1.9251, 'lastPrice': 1.9636, 'priceChange': -0.0186, 'percentChange': -0.009383513268, 'volume': 16646, 'openInterest': 39989}"
05/02/2025,1.9935,2.0156,1.9667,1.9822,-0.0200,-1.00%,"17,730","40,548","{'tradeTime': '2025-05-02', 'openPrice': 1.9935, 'highPrice': 2.0156, 'lowPrice': 1.9667, 'lastPrice': 1.9822, 'priceChange': -0.02, 'percentChange': -0.009989012087, 'volume': 17730, 'openInterest': 40548}"
05/01/2025,1.9844,2.0102,1.9487,2.0022,+0.0143,+0.72%,"24,970","40,792","{'tradeTime': '2025-05-01', 'openPrice': 1.9844, 'highPrice': 2.0102, 'lowPrice': 1.9487, 'lastPrice': 2.0022, 'priceChange': 0.0143, 'percentChange': 0.007193520801, 'volume': 24970, 'openInterest': 40792}"
04/30/2025,2.0394,2.0434,1.9836,1.9879,-0.0568,-2.78%,"21,032","40,740","{'tradeTime': '2025-04-30', 'openPrice': 2.0394, 'highPrice': 2.0434, 'lowPrice': 1.9836, 'lastPrice': 1.9879, 'priceChange': -0.0568, 'percentChange': -0.027779136304, 'volume': 21032, 'openInterest': 40740}"
04/29/2025,2.0837,2.0843,2.0365,2.0447,-0.0327,-1.57%,"16,994","41,613","{'tradeTime': '2025-04-29', 'openPrice': 2.0837, 'highPrice': 2.0843, 'lowPrice': 2.0365, 'lastPrice': 2.0447, 'priceChange': -0.0327, 'percentChange': -0.015740829884, 'volume': 16994, 'openInterest': 41613}"
04/28/2025,2.0952,2.1087,2.0687,2.0774,-0.0149,-0.71%,"14,488","41,312","{'tradeTime': '2025-04-28', 'openPrice': 2.0952, 'highPrice': 2.1087, 'lowPrice': 2.0687, 'lastPrice': 2.0774, 'priceChange': -0.0149, 'percentChange': -0.007121349711, 'volume': 14488, 'openInterest': 41312}"
04/25/2025,2.0875,2.1020,2.0669,2.0923,+0.0097,+0.47%,"17,090","40,754","{'tradeTime': '2025-04-25', 'openPrice': 2.0875, 'highPrice': 2.102, 'lowPrice': 2.0669, 'lastPrice': 2.0923, 'priceChange': 0.0097, 'percentChange': 0.004657639489, 'volume': 17090, 'openInterest': 40754}"
04/24/2025,2.0624,2.0866,2.0595,2.0826,+0.0178,+0.86%,"13,121","39,473","{'tradeTime': '2025-04-24', 'openPrice': 2.0624, 'highPrice': 2.0866, 'lowPrice': 2.0595, 'lastPrice': 2.0826, 'priceChange': 0.0178, 'percentChange': 0.008620689655, 'volume': 13121, 'openInterest': 39473}"
04/23/2025,2.0952,2.1174,2.0409,2.0648,-0.0216,-1.04%,"12,947","37,701","{'tradeTime': '2025-04-23', 'openPrice': 2.0952, 'highPrice': 2.1174, 'lowPrice': 2.0409, 'lastPrice': 2.0648, 'priceChange': -0.0216, 'percentChange': -0.010352760736, 'volume': 12947, 'openInterest': 37701}"
04/22/2025,2.0648,2.0991,2.0640,2.0864,+0.0324,+1.58%,"12,685","37,431","{'tradeTime': '2025-04-22', 'openPrice': 2.0648, 'highPrice': 2.0991, 'lowPrice': 2.064, 'lastPrice': 2.0864, 'priceChange': 0.0324, 'percentChange': 0.015774099318, 'volume': 12685, 'openInterest': 37431}"
04/21/2025,2.0930,2.0930,2.0438,2.0540,-0.0440,-2.10%,"7,901","36,596","{'tradeTime': '2025-04-21', 'openPrice': 2.093, 'highPrice': 2.093, 'lowPrice': 2.0438, 'lastPrice': 2.054, 'priceChange': -0.044, 'percentChange': -0.020972354623, 'volume': 7901, 'openInterest': 36596}"
04/17/2025,2.0611,2.1082,2.0562,2.0980,+0.0450,+2.19%,"12,581","36,806","{'tradeTime': '2025-04-17', 'openPrice': 2.0611, 'highPrice': 2.1082, 'lowPrice': 2.0562, 'lastPrice': 2.098, 'priceChange': 0.045, 'percentChange': 0.021919142718, 'volume': 12581, 'openInterest': 36806}"
04/16/2025,2.0333,2.0618,2.0083,2.0530,+0.0269,+1.33%,"10,308","35,603","{'tradeTime': '2025-04-16', 'openPrice': 2.0333, 'highPrice': 2.0618, 'lowPrice': 2.0083, 'lastPrice': 2.053, 'priceChange': 0.0269, 'percentChange': 0.013276738562, 'volume': 10308, 'openInterest': 35603}"
04/15/2025,2.0340,2.0502,2.0191,2.0261,-0.0094,-0.46%,"10,482","34,027","{'tradeTime': '2025-04-15', 'openPrice': 2.034, 'highPrice': 2.0502, 'lowPrice': 2.0191, 'lastPrice': 2.0261, 'priceChange': -0.0094, 'percentChange': -0.004618029968, 'volume': 10482, 'openInterest': 34027}"
04/14/2025,2.0299,2.0550,2.0151,2.0355,+0.0175,+0.87%,"10,827","32,998","{'tradeTime': '2025-04-14', 'openPrice': 2.0299, 'highPrice': 2.055, 'lowPrice': 2.0151, 'lastPrice': 2.0355, 'priceChange': 0.0175, 'percentChange': 0.008671952428, 'volume': 10827, 'openInterest': 32998}"
04/11/2025,2.0027,2.0268,1.9819,2.0180,+0.0197,+0.99%,"12,592","31,227","{'tradeTime': '2025-04-11', 'openPrice': 2.0027, 'highPrice': 2.0268, 'lowPrice': 1.9819, 'lastPrice': 2.018, 'priceChange': 0.0197, 'percentChange': 0.009858379623, 'volume': 12592, 'openInterest': 31227}"
04/10/2025,2.0694,2.0706,1.9745,1.9983,-0.0596,-2.90%,"16,835","29,287","{'tradeTime': '2025-04-10', 'openPrice': 2.0694, 'highPrice': 2.0706, 'lowPrice': 1.9745, 'lastPrice': 1.9983, 'priceChange': -0.0596, 'percentChange': -0.028961562758, 'volume': 16835, 'openInterest': 29287}"
04/09/2025,1.9627,2.0731,1.8851,2.0579,+0.0665,+3.34%,"29,079","27,671","{'tradeTime': '2025-04-09', 'openPrice': 1.9627, 'highPrice': 2.0731, 'lowPrice': 1.8851, 'lastPrice': 2.0579, 'priceChange': 0.0665, 'percentChange': 0.033393592448, 'volume': 29079, 'openInterest': 27671}"
04/08/2025,2.0292,2.0480,1.9566,1.9914,-0.0281,-1.39%,"18,084","26,143","{'tradeTime': '2025-04-08', 'openPrice': 2.0292, 'highPrice': 2.048, 'lowPrice': 1.9566, 'lastPrice': 1.9914, 'priceChange': -0.0281, 'percentChange': -0.013914335231, 'volume': 18084, 'openInterest': 26143}"
04/07/2025,2.0141,2.0912,1.9686,2.0195,-0.0156,-0.77%,"20,094","25,683","{'tradeTime': '2025-04-07', 'openPrice': 2.0141, 'highPrice': 2.0912, 'lowPrice': 1.9686, 'lastPrice': 2.0195, 'priceChange': -0.0156, 'percentChange': -0.007665470984, 'volume': 20094, 'openInterest': 25683}"
04/04/2025,2.1358,2.1447,2.0011,2.0351,-0.1133,-5.27%,"18,124","27,381","{'tradeTime': '2025-04-04', 'openPrice': 2.1358, 'highPrice': 2.1447, 'lowPrice': 2.0011, 'lastPrice': 2.0351, 'priceChange': -0.1133, 'percentChange': -0.052736920499, 'volume': 18124, 'openInterest': 27381}"
04/03/2025,2.2351,2.2352,2.1268,2.1484,-0.1331,-5.83%,"23,366","26,554","{'tradeTime': '2025-04-03', 'openPrice': 2.2351, 'highPrice': 2.2352, 'lowPrice': 2.1268, 'lastPrice': 2.1484, 'priceChange': -0.1331, 'percentChange': -0.058338812185, 'volume': 23366, 'openInterest': 26554}"
04/02/2025,2.2618,2.2936,2.2464,2.2815,+0.0242,+1.07%,"14,028","23,800","{'tradeTime': '2025-04-02', 'openPrice': 2.2618, 'highPrice': 2.2936, 'lowPrice': 2.2464, 'lastPrice': 2.2815, 'priceChange': 0.0242, 'percentChange': 0.010720772604, 'volume': 14028, 'openInterest': 23800}"
04/01/2025,2.2549,2.2674,2.2473,2.2573,+0.0030,+0.13%,"9,826","23,845","{'tradeTime': '2025-04-01', 'openPrice': 2.2549, 'highPrice': 2.2674, 'lowPrice': 2.2473, 'lastPrice': 2.2573, 'priceChange': 0.003, 'percentChange': 0.001330790046, 'volume': 9826, 'openInterest': 23845}"
03/31/2025,2.2133,2.2603,2.1972,2.2543,+0.0491,+2.23%,"8,134","23,649","{'tradeTime': '2025-03-31', 'openPrice': 2.2133, 'highPrice': 2.2603, 'lowPrice': 2.1972, 'lastPrice': 2.2543, 'priceChange': 0.0491, 'percentChange': 0.022265554145, 'volume': 8134, 'openInterest': 23649}"
03/28/2025,2.2212,2.2271,2.1974,2.2052,-0.0201,-0.90%,"6,249","23,040","{'tradeTime': '2025-03-28', 'openPrice': 2.2212, 'highPrice': 2.2271, 'lowPrice': 2.1974, 'lastPrice': 2.2052, 'priceChange': -0.0201, 'percentChange': -0.009032490001, 'volume': 6249, 'openInterest': 23040}"
03/27/2025,2.2172,2.2258,2.2032,2.2253,+0.0090,+0.41%,"5,102","22,604","{'tradeTime': '2025-03-27', 'openPrice': 2.2172, 'highPrice': 2.2258, 'lowPrice': 2.2032, 'lastPrice': 2.2253, 'priceChange': 0.009, 'percentChange': 0.004060822091, 'volume': 5102, 'openInterest': 22604}"
03/26/2025,2.2024,2.2273,2.2006,2.2163,+0.0145,+0.66%,"8,461","22,464","{'tradeTime': '2025-03-26', 'openPrice': 2.2024, 'highPrice': 2.2273, 'lowPrice': 2.2006, 'lastPrice': 2.2163, 'priceChange': 0.0145, 'percentChange': 0.006585520937, 'volume': 8461, 'openInterest': 22464}"
03/25/2025,2.1929,2.2115,2.1814,2.2018,+0.0134,+0.61%,"7,364","21,791","{'tradeTime': '2025-03-25', 'openPrice': 2.1929, 'highPrice': 2.2115, 'lowPrice': 2.1814, 'lastPrice': 2.2018, 'priceChange': 0.0134, 'percentChange': 0.006123195028, 'volume': 7364, 'openInterest': 21791}"
03/24/2025,2.1807,2.1957,2.1712,2.1884,+0.0114,+0.52%,"6,595","21,290","{'tradeTime': '2025-03-24', 'openPrice': 2.1807, 'highPrice': 2.1957, 'lowPrice': 2.1712, 'lastPrice': 2.1884, 'priceChange': 0.0114, 'percentChange': 0.005236564079, 'volume': 6595, 'openInterest': 21290}"
03/21/2025,2.1838,2.1861,2.1621,2.1770,+0.0015,+0.07%,"3,706","20,752","{'tradeTime': '2025-03-21', 'openPrice': 2.1838, 'highPrice': 2.1861, 'lowPrice': 2.1621, 'lastPrice': 2.177, 'priceChange': 0.0015, 'percentChange': 0.000689496667, 'volume': 3706, 'openInterest': 20752}"
03/20/2025,2.1563,2.1824,2.1387,2.1755,+0.0224,+1.04%,"3,054","20,498","{'tradeTime': '2025-03-20', 'openPrice': 2.1563, 'highPrice': 2.1824, 'lowPrice': 2.1387, 'lastPrice': 2.1755, 'priceChange': 0.0224, 'percentChange': 0.010403604106, 'volume': 3054, 'openInterest': 20498}"
03/19/2025,2.1355,2.1626,2.1234,2.1531,+0.0166,+0.78%,"5,579","20,706","{'tradeTime': '2025-03-19', 'openPrice': 2.1355, 'highPrice': 2.1626, 'lowPrice': 2.1234, 'lastPrice': 2.1531, 'priceChange': 0.0166, 'percentChange': 0.007769716827, 'volume': 5579, 'openInterest': 20706}"
03/18/2025,2.1407,2.1710,2.1270,2.1365,-0.0074,-0.35%,"6,871","20,058","{'tradeTime': '2025-03-18', 'openPrice': 2.1407, 'highPrice': 2.171, 'lowPrice': 2.127, 'lastPrice': 2.1365, 'priceChange': -0.0074, 'percentChange': -0.003451653529, 'volume': 6871, 'openInterest': 20058}"
03/17/2025,2.1272,2.1532,2.1269,2.1439,+0.0239,+1.13%,"7,811","20,543","{'tradeTime': '2025-03-17', 'openPrice': 2.1272, 'highPrice': 2.1532, 'lowPrice': 2.1269, 'lastPrice': 2.1439, 'priceChange': 0.0239, 'percentChange': 0.011273584906, 'volume': 7811, 'openInterest': 20543}"
03/14/2025,2.1142,2.1315,2.1045,2.1200,+0.0049,+0.23%,"9,200","21,034","{'tradeTime': '2025-03-14', 'openPrice': 2.1142, 'highPrice': 2.1315, 'lowPrice': 2.1045, 'lastPrice': 2.12, 'priceChange': 0.0049, 'percentChange': 0.002316675334, 'volume': 9200, 'openInterest': 21034}"
03/13/2025,2.1512,2.1552,2.1077,2.1151,-0.0336,-1.56%,"8,176","21,784","{'tradeTime': '2025-03-13', 'openPrice': 2.1512, 'highPrice': 2.1552, 'lowPrice': 2.1077, 'lastPrice': 2.1151, 'priceChange': -0.0336, 'percentChange': -0.015637362126, 'volume': 8176, 'openInterest': 21784}"
03/12/2025,2.1282,2.1522,2.1195,2.1487,+0.0281,+1.33%,"5,822","22,621","{'tradeTime': '2025-03-12', 'openPrice': 2.1282, 'highPrice': 2.1522, 'lowPrice': 2.1195, 'lastPrice': 2.1487, 'priceChange': 0.0281, 'percentChange': 0.013250966708, 'volume': 5822, 'openInterest': 22621}"
03/11/2025,2.1102,2.1371,2.0953,2.1206,+0.0103,+0.49%,"7,081","23,079","{'tradeTime': '2025-03-11', 'openPrice': 2.1102, 'highPrice': 2.1371, 'lowPrice': 2.0953, 'lastPrice': 2.1206, 'priceChange': 0.0103, 'percentChange': 0.004880822632, 'volume': 7081, 'openInterest': 23079}"
03/10/2025,2.1313,2.1552,2.1046,2.1103,-0.0297,-1.39%,"5,605","22,620","{'tradeTime': '2025-03-10', 'openPrice': 2.1313, 'highPrice': 2.1552, 'lowPrice': 2.1046, 'lastPrice': 2.1103, 'priceChange': -0.0297, 'percentChange': -0.013878504673, 'volume': 5605, 'openInterest': 22620}"
03/07/2025,2.1213,2.1726,2.1170,2.1400,+0.0153,+0.72%,"7,145","22,345","{'tradeTime': '2025-03-07', 'openPrice': 2.1213, 'highPrice': 2.1726, 'lowPrice': 2.117, 'lastPrice': 2.14, 'priceChange': 0.0153, 'percentChange': 0.007201016614, 'volume': 7145, 'openInterest': 22345}"
03/06/2025,2.1294,2.1437,2.1087,2.1247,-0.0054,-0.25%,"11,409","22,396","{'tradeTime': '2025-03-06', 'openPrice': 2.1294, 'highPrice': 2.1437, 'lowPrice': 2.1087, 'lastPrice': 2.1247, 'priceChange': -0.0054, 'percentChange': -0.002535092249, 'volume': 11409, 'openInterest': 22396}"
03/05/2025,2.1652,2.1664,2.0983,2.1301,-0.0399,-1.84%,"12,978","21,658","{'tradeTime': '2025-03-05', 'openPrice': 2.1652, 'highPrice': 2.1664, 'lowPrice': 2.0983, 'lastPrice': 2.1301, 'priceChange': -0.0399, 'percentChange': -0.018387096774, 'volume': 12978, 'openInterest': 21658}"
03/04/2025,2.1777,2.1807,2.1420,2.1700,-0.0042,-0.19%,"7,902","19,801","{'tradeTime': '2025-03-04', 'openPrice': 2.1777, 'highPrice': 2.1807, 'lowPrice': 2.142, 'lastPrice': 2.17, 'priceChange': -0.0042, 'percentChange': -0.00193174501, 'volume': 7902, 'openInterest': 19801}"
03/03/2025,2.2284,2.2304,2.1647,2.1742,-0.0355,-1.61%,"6,457","19,722","{'tradeTime': '2025-03-03', 'openPrice': 2.2284, 'highPrice': 2.2304, 'lowPrice': 2.1647, 'lastPrice': 2.1742, 'priceChange': -0.0355, 'percentChange': -0.016065529257, 'volume': 6457, 'openInterest': 19722}"
02/28/2025,2.2320,2.2329,2.2028,2.2097,-0.0243,-1.09%,"3,290","20,363","{'tradeTime': '2025-02-28', 'openPrice': 2.232, 'highPrice': 2.2329, 'lowPrice': 2.2028, 'lastPrice': 2.2097, 'priceChange': -0.0243, 'percentChange': -0.010877350045, 'volume': 3290, 'openInterest': 20363}"
02/27/2025,2.1956,2.2367,2.1921,2.2340,+0.0420,+1.92%,"7,158","20,257","{'tradeTime': '2025-02-27', 'openPrice': 2.1956, 'highPrice': 2.2367, 'lowPrice': 2.1921, 'lastPrice': 2.234, 'priceChange': 0.042, 'percentChange': 0.019160583942, 'volume': 7158, 'openInterest': 20257}"
02/26/2025,2.2189,2.2224,2.1786,2.1920,-0.0260,-1.17%,"6,789","19,823","{'tradeTime': '2025-02-26', 'openPrice': 2.2189, 'highPrice': 2.2224, 'lowPrice': 2.1786, 'lastPrice': 2.192, 'priceChange': -0.026, 'percentChange': -0.011722272317, 'volume': 6789, 'openInterest': 19823}"
02/25/2025,2.2758,2.2844,2.2101,2.2180,-0.0462,-2.04%,"5,026","19,581","{'tradeTime': '2025-02-25', 'openPrice': 2.2758, 'highPrice': 2.2844, 'lowPrice': 2.2101, 'lastPrice': 2.218, 'priceChange': -0.0462, 'percentChange': -0.020404557901, 'volume': 5026, 'openInterest': 19581}"
02/24/2025,2.2707,2.2759,2.2609,2.2642,-0.0052,-0.23%,"4,580","19,891","{'tradeTime': '2025-02-24', 'openPrice': 2.2707, 'highPrice': 2.2759, 'lowPrice': 2.2609, 'lastPrice': 2.2642, 'priceChange': -0.0052, 'percentChange': -0.002291354543, 'volume': 4580, 'openInterest': 19891}"
02/21/2025,2.3251,2.3296,2.2656,2.2694,-0.0536,-2.31%,"4,316","19,689","{'tradeTime': '2025-02-21', 'openPrice': 2.3251, 'highPrice': 2.3296, 'lowPrice': 2.2656, 'lastPrice': 2.2694, 'priceChange': -0.0536, 'percentChange': -0.023073611709, 'volume': 4316, 'openInterest': 19689}"
02/20/2025,2.3085,2.3363,2.3006,2.3230,+0.0151,+0.65%,"7,899","19,329","{'tradeTime': '2025-02-20', 'openPrice': 2.3085, 'highPrice': 2.3363, 'lowPrice': 2.3006, 'lastPrice': 2.323, 'priceChange': 0.0151, 'percentChange': 0.006542744486, 'volume': 7899, 'openInterest': 19329}"
02/19/2025,2.2958,2.3212,2.2945,2.3079,+0.0115,+0.50%,"5,244","17,422","{'tradeTime': '2025-02-19', 'openPrice': 2.2958, 'highPrice': 2.3212, 'lowPrice': 2.2945, 'lastPrice': 2.3079, 'priceChange': 0.0115, 'percentChange': 0.005007838356, 'volume': 5244, 'openInterest': 17422}"
02/18/2025,2.2794,2.3135,2.2745,2.2964,+0.0024,+0.10%,"6,412","16,802","{'tradeTime': '2025-02-18', 'openPrice': 2.2794, 'highPrice': 2.3135, 'lowPrice': 2.2745, 'lastPrice': 2.2964, 'priceChange': 0.0024, 'percentChange': 0.001046207498, 'volume': 6412, 'openInterest': 16802}"
02/14/2025,2.2939,2.3140,2.2804,2.2940,+0.0025,+0.11%,"4,586","16,873","{'tradeTime': '2025-02-14', 'openPrice': 2.2939, 'highPrice': 2.314, 'lowPrice': 2.2804, 'lastPrice': 2.294, 'priceChange': 0.0025, 'percentChange': 0.001090988436, 'volume': 4586, 'openInterest': 16873}"
02/13/2025,2.2917,2.2968,2.2635,2.2915,-0.0055,-0.24%,"6,324","16,472","{'tradeTime': '2025-02-13', 'openPrice': 2.2917, 'highPrice': 2.2968, 'lowPrice': 2.2635, 'lastPrice': 2.2915, 'priceChange': -0.0055, 'percentChange': -0.002394427514, 'volume': 6324, 'openInterest': 16472}"
02/12/2025,2.3520,2.3520,2.2912,2.2970,-0.0538,-2.29%,"8,632","16,796","{'tradeTime': '2025-02-12', 'openPrice': 2.352, 'highPrice': 2.352, 'lowPrice': 2.2912, 'lastPrice': 2.297, 'priceChange': -0.0538, 'percentChange': -0.022885826102, 'volume': 8632, 'openInterest': 16796}"
02/11/2025,2.3053,2.3523,2.3044,2.3508,+0.0427,+1.85%,"3,921","14,739","{'tradeTime': '2025-02-11', 'openPrice': 2.3053, 'highPrice': 2.3523, 'lowPrice': 2.3044, 'lastPrice': 2.3508, 'priceChange': 0.0427, 'percentChange': 0.018500064989, 'volume': 3921, 'openInterest': 14739}"
02/10/2025,2.2846,2.3112,2.2817,2.3081,+0.0258,+1.13%,"3,126","14,538","{'tradeTime': '2025-02-10', 'openPrice': 2.2846, 'highPrice': 2.3112, 'lowPrice': 2.2817, 'lastPrice': 2.3081, 'priceChange': 0.0258, 'percentChange': 0.011304385926, 'volume': 3126, 'openInterest': 14538}"
02/07/2025,2.2722,2.2849,2.2710,2.2823,+0.0195,+0.86%,"3,490","14,554","{'tradeTime': '2025-02-07', 'openPrice': 2.2722, 'highPrice': 2.2849, 'lowPrice': 2.271, 'lastPrice': 2.2823, 'priceChange': 0.0195, 'percentChange': 0.00861764186, 'volume': 3490, 'openInterest': 14554}"
02/06/2025,2.2627,2.2767,2.2504,2.2628,-0.0026,-0.11%,"4,262","14,772","{'tradeTime': '2025-02-06', 'openPrice': 2.2627, 'highPrice': 2.2767, 'lowPrice': 2.2504, 'lastPrice': 2.2628, 'priceChange': -0.0026, 'percentChange': -0.001147700185, 'volume': 4262, 'openInterest': 14772}"
02/05/2025,2.3065,2.3073,2.2625,2.2654,-0.0353,-1.53%,"2,443","15,017","{'tradeTime': '2025-02-05', 'openPrice': 2.3065, 'highPrice': 2.3073, 'lowPrice': 2.2625, 'lastPrice': 2.2654, 'priceChange': -0.0353, 'percentChange': -0.015343156431, 'volume': 2443, 'openInterest': 15017}"
02/04/2025,2.2879,2.3080,2.2492,2.3007,+0.0009,+0.04%,"4,235","14,876","{'tradeTime': '2025-02-04', 'openPrice': 2.2879, 'highPrice': 2.308, 'lowPrice': 2.2492, 'lastPrice': 2.3007, 'priceChange': 0.0009, 'percentChange': 0.000391338377, 'volume': 4235, 'openInterest': 14876}"
02/03/2025,2.3247,2.3326,2.2793,2.2998,+0.0180,+0.79%,"9,423","14,660","{'tradeTime': '2025-02-03', 'openPrice': 2.3247, 'highPrice': 2.3326, 'lowPrice': 2.2793, 'lastPrice': 2.2998, 'priceChange': 0.018, 'percentChange': 0.007888509072, 'volume': 9423, 'openInterest': 14660}"
01/31/2025,2.2903,2.3035,2.2691,2.2818,-0.0045,-0.20%,"3,075","14,174","{'tradeTime': '2025-01-31', 'openPrice': 2.2903, 'highPrice': 2.3035, 'lowPrice': 2.2691, 'lastPrice': 2.2818, 'priceChange': -0.0045, 'percentChange': -0.001968245637, 'volume': 3075, 'openInterest': 14174}"
01/30/2025,2.2774,2.3000,2.2589,2.2863,+0.0091,+0.40%,"2,654","14,039","{'tradeTime': '2025-01-30', 'openPrice': 2.2774, 'highPrice': 2.3, 'lowPrice': 2.2589, 'lastPrice': 2.2863, 'priceChange': 0.0091, 'percentChange': 0.003996135605, 'volume': 2654, 'openInterest': 14039}"
01/29/2025,2.2849,2.2920,2.2683,2.2772,-0.0110,-0.48%,"3,497","13,798","{'tradeTime': '2025-01-29', 'openPrice': 2.2849, 'highPrice': 2.292, 'lowPrice': 2.2683, 'lastPrice': 2.2772, 'priceChange': -0.011, 'percentChange': -0.004807272092, 'volume': 3497, 'openInterest': 13798}"
01/28/2025,2.2896,2.3020,2.2730,2.2882,-0.0008,-0.03%,"2,655","12,976","{'tradeTime': '2025-01-28', 'openPrice': 2.2896, 'highPrice': 2.302, 'lowPrice': 2.273, 'lastPrice': 2.2882, 'priceChange': -0.0008, 'percentChange': -0.000349497597, 'volume': 2655, 'openInterest': 12976}"
01/27/2025,2.3180,2.3180,2.2698,2.2890,-0.0378,-1.62%,"3,351","12,967","{'tradeTime': '2025-01-27', 'openPrice': 2.318, 'highPrice': 2.318, 'lowPrice': 2.2698, 'lastPrice': 2.289, 'priceChange': -0.0378, 'percentChange': -0.016245487365, 'volume': 3351, 'openInterest': 12967}"
01/24/2025,2.3215,2.3399,2.3157,2.3268,-0.0071,-0.30%,"3,920","12,563","{'tradeTime': '2025-01-24', 'openPrice': 2.3215, 'highPrice': 2.3399, 'lowPrice': 2.3157, 'lastPrice': 2.3268, 'priceChange': -0.0071, 'percentChange': -0.003042118343, 'volume': 3920, 'openInterest': 12563}"
01/23/2025,2.3262,2.3543,2.3204,2.3339,-0.0037,-0.16%,"4,571","12,249","{'tradeTime': '2025-01-23', 'openPrice': 2.3262, 'highPrice': 2.3543, 'lowPrice': 2.3204, 'lastPrice': 2.3339, 'priceChange': -0.0037, 'percentChange': -0.001582819986, 'volume': 4571, 'openInterest': 12249}"
01/22/2025,2.3564,2.3612,2.3287,2.3376,-0.0106,-0.45%,"6,199","12,051","{'tradeTime': '2025-01-22', 'openPrice': 2.3564, 'highPrice': 2.3612, 'lowPrice': 2.3287, 'lastPrice': 2.3376, 'priceChange': -0.0106, 'percentChange': -0.004514095903, 'volume': 6199, 'openInterest': 12051}"
01/21/2025,2.3840,2.3868,2.3344,2.3482,-0.0289,-1.22%,"7,006","11,022","{'tradeTime': '2025-01-21', 'openPrice': 2.384, 'highPrice': 2.3868, 'lowPrice': 2.3344, 'lastPrice': 2.3482, 'priceChange': -0.0289, 'percentChange': -0.012157671112, 'volume': 7006, 'openInterest': 11022}"
01/17/2025,2.3817,2.3853,2.3587,2.3771,-0.0018,-0.08%,"3,293","10,480","{'tradeTime': '2025-01-17', 'openPrice': 2.3817, 'highPrice': 2.3853, 'lowPrice': 2.3587, 'lastPrice': 2.3771, 'priceChange': -0.0018, 'percentChange': -0.000756652234, 'volume': 3293, 'openInterest': 10480}"
01/16/2025,2.4028,2.4036,2.3640,2.3789,-0.0155,-0.65%,"6,511","10,026","{'tradeTime': '2025-01-16', 'openPrice': 2.4028, 'highPrice': 2.4036, 'lowPrice': 2.364, 'lastPrice': 2.3789, 'priceChange': -0.0155, 'percentChange': -0.006473438022, 'volume': 6511, 'openInterest': 10026}"
01/15/2025,2.3588,2.4044,2.3521,2.3944,+0.0373,+1.58%,"3,996","8,629","{'tradeTime': '2025-01-15', 'openPrice': 2.3588, 'highPrice': 2.4044, 'lowPrice': 2.3521, 'lastPrice': 2.3944, 'priceChange': 0.0373, 'percentChange': 0.015824530143, 'volume': 3996, 'openInterest': 8629}"
01/14/2025,2.3581,2.3655,2.3413,2.3571,-0.0030,-0.13%,"4,252","8,254","{'tradeTime': '2025-01-14', 'openPrice': 2.3581, 'highPrice': 2.3655, 'lowPrice': 2.3413, 'lastPrice': 2.3571, 'priceChange': -0.003, 'percentChange': -0.001271132579, 'volume': 4252, 'openInterest': 8254}"
01/13/2025,2.3625,2.3700,2.3431,2.3601,+0.0135,+0.58%,"6,332","8,350","{'tradeTime': '2025-01-13', 'openPrice': 2.3625, 'highPrice': 2.37, 'lowPrice': 2.3431, 'lastPrice': 2.3601, 'priceChange': 0.0135, 'percentChange': 0.005753004347, 'volume': 6332, 'openInterest': 8350}"
01/10/2025,2.2835,2.3602,2.2789,2.3466,+0.0736,+3.24%,"7,425","8,262","{'tradeTime': '2025-01-10', 'openPrice': 2.2835, 'highPrice': 2.3602, 'lowPrice': 2.2789, 'lastPrice': 2.3466, 'priceChange': 0.0736, 'percentChange': 0.032380114386, 'volume': 7425, 'openInterest': 8262}"
01/09/2025,2.2500,2.2882,2.2473,2.2730,+0.0145,+0.64%,"3,247","6,658","{'tradeTime': '2025-01-09', 'openPrice': 2.25, 'highPrice': 2.2882, 'lowPrice': 2.2473, 'lastPrice': 2.273, 'priceChange': 0.0145, 'percentChange': 0.006420190392, 'volume': 3247, 'openInterest': 6658}"
01/08/2025,2.2807,2.2902,2.2491,2.2585,-0.0174,-0.76%,"2,346","6,446","{'tradeTime': '2025-01-08', 'openPrice': 2.2807, 'highPrice': 2.2902, 'lowPrice': 2.2491, 'lastPrice': 2.2585, 'priceChange': -0.0174, 'percentChange': -0.007645327123, 'volume': 2346, 'openInterest': 6446}"
01/07/2025,2.2584,2.2809,2.2523,2.2759,+0.0139,+0.61%,"1,121","6,569","{'tradeTime': '2025-01-07', 'openPrice': 2.2584, 'highPrice': 2.2809, 'lowPrice': 2.2523, 'lastPrice': 2.2759, 'priceChange': 0.0139, 'percentChange': 0.006145004421, 'volume': 1121, 'openInterest': 6569}"
01/06/2025,2.2688,2.2941,2.2520,2.2620,unch,unch,"1,902","6,662","{'tradeTime': '2025-01-06', 'openPrice': 2.2688, 'highPrice': 2.2941, 'lowPrice': 2.252, 'lastPrice': 2.262, 'priceChange': 0, 'percentChange': 0, 'volume': 1902, 'openInterest': 6662}"
01/03/2025,2.2690,2.2729,2.2486,2.2620,-0.0002,-0.01%,"2,169","6,479","{'tradeTime': '2025-01-03', 'openPrice': 2.269, 'highPrice': 2.2729, 'lowPrice': 2.2486, 'lastPrice': 2.262, 'priceChange': -0.0002, 'percentChange': -8.8409513e-05, 'volume': 2169, 'openInterest': 6479}"
01/02/2025,2.2409,2.2787,2.2293,2.2622,+0.0308,+1.38%,"2,331","6,574","{'tradeTime': '2025-01-02', 'openPrice': 2.2409, 'highPrice': 2.2787, 'lowPrice': 2.2293, 'lastPrice': 2.2622, 'priceChange': 0.0308, 'percentChange': 0.013802993636, 'volume': 2331, 'openInterest': 6574}"
12/31/2024,2.2272,2.2435,2.2113,2.2314,+0.0124,+0.56%,"1,582","6,782","{'tradeTime': '2024-12-31', 'openPrice': 2.2272, 'highPrice': 2.2435, 'lowPrice': 2.2113, 'lastPrice': 2.2314, 'priceChange': 0.0124, 'percentChange': 0.005588102749, 'volume': 1582, 'openInterest': 6782}"
12/30/2024,2.1969,2.2340,2.1882,2.2190,+0.0292,+1.33%,"1,775","6,884","{'tradeTime': '2024-12-30', 'openPrice': 2.1969, 'highPrice': 2.234, 'lowPrice': 2.1882, 'lastPrice': 2.219, 'priceChange': 0.0292, 'percentChange': 0.013334551101, 'volume': 1775, 'openInterest': 6884}"
12/27/2024,2.1594,2.1970,2.1563,2.1898,+0.0279,+1.29%,984,"6,678","{'tradeTime': '2024-12-27', 'openPrice': 2.1594, 'highPrice': 2.197, 'lowPrice': 2.1563, 'lastPrice': 2.1898, 'priceChange': 0.0279, 'percentChange': 0.012905314769, 'volume': 984, 'openInterest': 6678}"
12/26/2024,2.1734,2.1936,2.1533,2.1619,-0.0095,-0.44%,632,"6,560","{'tradeTime': '2024-12-26', 'openPrice': 2.1734, 'highPrice': 2.1936, 'lowPrice': 2.1533, 'lastPrice': 2.1619, 'priceChange': -0.0095, 'percentChange': -0.004375057567, 'volume': 632, 'openInterest': 6560}"
12/24/2024,2.1766,2.1915,2.1680,2.1714,+0.0061,+0.28%,707,"6,511","{'tradeTime': '2024-12-24', 'openPrice': 2.1766, 'highPrice': 2.1915, 'lowPrice': 2.168, 'lastPrice': 2.1714, 'priceChange': 0.0061, 'percentChange': 0.002817161594, 'volume': 707, 'openInterest': 6511}"
12/23/2024,2.1771,2.1918,2.1527,2.1653,-0.0100,-0.46%,"1,382","6,605","{'tradeTime': '2024-12-23', 'openPrice': 2.1771, 'highPrice': 2.1918, 'lowPrice': 2.1527, 'lastPrice': 2.1653, 'priceChange': -0.01, 'percentChange': -0.004597067071, 'volume': 1382, 'openInterest': 6605}"
12/20/2024,2.1706,2.1847,2.1524,2.1753,-0.0059,-0.27%,"1,187","6,735","{'tradeTime': '2024-12-20', 'openPrice': 2.1706, 'highPrice': 2.1847, 'lowPrice': 2.1524, 'lastPrice': 2.1753, 'priceChange': -0.0059, 'percentChange': -0.002704933064, 'volume': 1187, 'openInterest': 6735}"
12/19/2024,2.1869,2.2096,2.1737,2.1812,-0.0174,-0.79%,"1,406","6,772","{'tradeTime': '2024-12-19', 'openPrice': 2.1869, 'highPrice': 2.2096, 'lowPrice': 2.1737, 'lastPrice': 2.1812, 'priceChange': -0.0174, 'percentChange': -0.007914127172, 'volume': 1406, 'openInterest': 6772}"
12/18/2024,2.1971,2.2202,2.1857,2.1986,+0.0073,+0.33%,"1,854","6,828","{'tradeTime': '2024-12-18', 'openPrice': 2.1971, 'highPrice': 2.2202, 'lowPrice': 2.1857, 'lastPrice': 2.1986, 'priceChange': 0.0073, 'percentChange': 0.003331355816, 'volume': 1854, 'openInterest': 6828}"
12/17/2024,2.2154,2.2194,2.1745,2.1913,-0.0265,-1.19%,"1,049","7,014","{'tradeTime': '2024-12-17', 'openPrice': 2.2154, 'highPrice': 2.2194, 'lowPrice': 2.1745, 'lastPrice': 2.1913, 'priceChange': -0.0265, 'percentChange': -0.011948778068, 'volume': 1049, 'openInterest': 7014}"
12/16/2024,2.2261,2.2314,2.2103,2.2178,-0.0111,-0.50%,"1,022","7,110","{'tradeTime': '2024-12-16', 'openPrice': 2.2261, 'highPrice': 2.2314, 'lowPrice': 2.2103, 'lastPrice': 2.2178, 'priceChange': -0.0111, 'percentChange': -0.004980034995, 'volume': 1022, 'openInterest': 7110}"
12/13/2024,2.2047,2.2342,2.2038,2.2289,+0.0227,+1.03%,"1,900","7,044","{'tradeTime': '2024-12-13', 'openPrice': 2.2047, 'highPrice': 2.2342, 'lowPrice': 2.2038, 'lastPrice': 2.2289, 'priceChange': 0.0227, 'percentChange': 0.010289185024, 'volume': 1900, 'openInterest': 7044}"
12/12/2024,2.2013,2.2133,2.1782,2.2062,+0.0075,+0.34%,"1,656","6,696","{'tradeTime': '2024-12-12', 'openPrice': 2.2013, 'highPrice': 2.2133, 'lowPrice': 2.1782, 'lastPrice': 2.2062, 'priceChange': 0.0075, 'percentChange': 0.003411106563, 'volume': 1656, 'openInterest': 6696}"
12/11/2024,2.1802,2.2038,2.1648,2.1987,+0.0312,+1.44%,"2,075","6,422","{'tradeTime': '2024-12-11', 'openPrice': 2.1802, 'highPrice': 2.2038, 'lowPrice': 2.1648, 'lastPrice': 2.1987, 'priceChange': 0.0312, 'percentChange': 0.014394463668, 'volume': 2075, 'openInterest': 6422}"
12/10/2024,2.1603,2.1801,2.1542,2.1675,-0.0016,-0.07%,"1,846","6,157","{'tradeTime': '2024-12-10', 'openPrice': 2.1603, 'highPrice': 2.1801, 'lowPrice': 2.1542, 'lastPrice': 2.1675, 'priceChange': -0.0016, 'percentChange': -0.00073763312, 'volume': 1846, 'openInterest': 6157}"
12/09/2024,2.1426,2.1789,2.1405,2.1691,+0.0373,+1.75%,"2,796","6,178","{'tradeTime': '2024-12-09', 'openPrice': 2.1426, 'highPrice': 2.1789, 'lowPrice': 2.1405, 'lastPrice': 2.1691, 'priceChange': 0.0373, 'percentChange': 0.017496950933, 'volume': 2796, 'openInterest': 6178}"
12/06/2024,2.1469,2.1532,2.1217,2.1318,-0.0183,-0.85%,"2,788","6,001","{'tradeTime': '2024-12-06', 'openPrice': 2.1469, 'highPrice': 2.1532, 'lowPrice': 2.1217, 'lastPrice': 2.1318, 'priceChange': -0.0183, 'percentChange': -0.008511232036, 'volume': 2788, 'openInterest': 6001}"
12/05/2024,2.1545,2.1733,2.1407,2.1501,-0.0069,-0.32%,"2,787","6,122","{'tradeTime': '2024-12-05', 'openPrice': 2.1545, 'highPrice': 2.1733, 'lowPrice': 2.1407, 'lastPrice': 2.1501, 'priceChange': -0.0069, 'percentChange': -0.003198887344, 'volume': 2787, 'openInterest': 6122}"
12/04/2024,2.1888,2.2062,2.1554,2.1570,-0.0332,-1.52%,"2,458","6,510","{'tradeTime': '2024-12-04', 'openPrice': 2.1888, 'highPrice': 2.2062, 'lowPrice': 2.1554, 'lastPrice': 2.157, 'priceChange': -0.0332, 'percentChange': -0.01515843302, 'volume': 2458, 'openInterest': 6510}"
12/03/2024,2.1553,2.2014,2.1501,2.1902,+0.0364,+1.69%,"1,394","6,460","{'tradeTime': '2024-12-03', 'openPrice': 2.1553, 'highPrice': 2.2014, 'lowPrice': 2.1501, 'lastPrice': 2.1902, 'priceChange': 0.0364, 'percentChange': 0.016900362151, 'volume': 1394, 'openInterest': 6460}"
12/02/2024,2.1602,2.1887,2.1478,2.1538,-0.0022,-0.10%,"1,272","6,352","{'tradeTime': '2024-12-02', 'openPrice': 2.1602, 'highPrice': 2.1887, 'lowPrice': 2.1478, 'lastPrice': 2.1538, 'priceChange': -0.0022, 'percentChange': -0.001020408163, 'volume': 1272, 'openInterest': 6352}"
11/29/2024,2.1681,2.2007,2.1540,2.1560,-0.0158,-0.73%,865,"6,323","{'tradeTime': '2024-11-29', 'openPrice': 2.1681, 'highPrice': 2.2007, 'lowPrice': 2.154, 'lastPrice': 2.156, 'priceChange': -0.0158, 'percentChange': -0.007275071369, 'volume': 865, 'openInterest': 6323}"
11/27/2024,2.1902,2.2063,2.1621,2.1718,-0.0257,-1.17%,"1,197","6,253","{'tradeTime': '2024-11-27', 'openPrice': 2.1902, 'highPrice': 2.2063, 'lowPrice': 2.1621, 'lastPrice': 2.1718, 'priceChange': -0.0257, 'percentChange': -0.011695108077, 'volume': 1197, 'openInterest': 6253}"
11/26/2024,2.1970,2.2427,2.1820,2.1975,-0.0031,-0.14%,"1,183","6,208","{'tradeTime': '2024-11-26', 'openPrice': 2.197, 'highPrice': 2.2427, 'lowPrice': 2.182, 'lastPrice': 2.1975, 'priceChange': -0.0031, 'percentChange': -0.001408706716, 'volume': 1183, 'openInterest': 6208}"
11/25/2024,2.2509,2.2520,2.1884,2.2006,-0.0456,-2.03%,"1,164","6,230","{'tradeTime': '2024-11-25', 'openPrice': 2.2509, 'highPrice': 2.252, 'lowPrice': 2.1884, 'lastPrice': 2.2006, 'priceChange': -0.0456, 'percentChange': -0.02030095272, 'volume': 1164, 'openInterest': 6230}"
11/22/2024,2.2500,2.2580,2.2212,2.2462,+0.0015,+0.07%,866,"6,275","{'tradeTime': '2024-11-22', 'openPrice': 2.25, 'highPrice': 2.258, 'lowPrice': 2.2212, 'lastPrice': 2.2462, 'priceChange': 0.0015, 'percentChange': 0.000668240745, 'volume': 866, 'openInterest': 6275}"
11/21/2024,2.2177,2.2496,2.2138,2.2447,+0.0301,+1.36%,"1,410","6,222","{'tradeTime': '2024-11-21', 'openPrice': 2.2177, 'highPrice': 2.2496, 'lowPrice': 2.2138, 'lastPrice': 2.2447, 'priceChange': 0.0301, 'percentChange': 0.013591619254, 'volume': 1410, 'openInterest': 6222}"
11/20/2024,2.2263,2.2381,2.2120,2.2146,-0.0152,-0.68%,963,"6,102","{'tradeTime': '2024-11-20', 'openPrice': 2.2263, 'highPrice': 2.2381, 'lowPrice': 2.212, 'lastPrice': 2.2146, 'priceChange': -0.0152, 'percentChange': -0.006816754866, 'volume': 963, 'openInterest': 6102}"
11/19/2024,2.2403,2.2531,2.2199,2.2298,-0.0060,-0.27%,"2,503","6,081","{'tradeTime': '2024-11-19', 'openPrice': 2.2403, 'highPrice': 2.2531, 'lowPrice': 2.2199, 'lastPrice': 2.2298, 'priceChange': -0.006, 'percentChange': -0.002683603185, 'volume': 2503, 'openInterest': 6081}"
11/18/2024,2.1730,2.2415,2.1646,2.2358,+0.0679,+3.13%,"1,138","6,600","{'tradeTime': '2024-11-18', 'openPrice': 2.173, 'highPrice': 2.2415, 'lowPrice': 2.1646, 'lastPrice': 2.2358, 'priceChange': 0.0679, 'percentChange': 0.031320632871, 'volume': 1138, 'openInterest': 6600}"
11/15/2024,2.1973,2.2078,2.1659,2.1679,-0.0344,-1.56%,"1,188","6,287","{'tradeTime': '2024-11-15', 'openPrice': 2.1973, 'highPrice': 2.2078, 'lowPrice': 2.1659, 'lastPrice': 2.1679, 'priceChange': -0.0344, 'percentChange': -0.015620033601, 'volume': 1188, 'openInterest': 6287}"
11/14/2024,2.2058,2.2281,2.1907,2.2023,-0.0055,-0.25%,"1,987","6,091","{'tradeTime': '2024-11-14', 'openPrice': 2.2058, 'highPrice': 2.2281, 'lowPrice': 2.1907, 'lastPrice': 2.2023, 'priceChange': -0.0055, 'percentChange': -0.002491167678, 'volume': 1987, 'openInterest': 6091}"
11/13/2024,2.2031,2.2251,2.1702,2.2078,+0.0031,+0.14%,"1,677","5,912","{'tradeTime': '2024-11-13', 'openPrice': 2.2031, 'highPrice': 2.2251, 'lowPrice': 2.1702, 'lastPrice': 2.2078, 'priceChange': 0.0031, 'percentChange': 0.001406086996, 'volume': 1677, 'openInterest': 5912}"
11/12/2024,2.2035,2.2282,2.1913,2.2047,+0.0047,+0.21%,"1,683","5,655","{'tradeTime': '2024-11-12', 'openPrice': 2.2035, 'highPrice': 2.2282, 'lowPrice': 2.1913, 'lastPrice': 2.2047, 'priceChange': 0.0047, 'percentChange': 0.002136363636, 'volume': 1683, 'openInterest': 5655}"
11/11/2024,2.2387,2.2495,2.1929,2.2000,-0.0440,-1.96%,"1,022","5,221","{'tradeTime': '2024-11-11', 'openPrice': 2.2387, 'highPrice': 2.2495, 'lowPrice': 2.1929, 'lastPrice': 2.2, 'priceChange': -0.044, 'percentChange': -0.019607843137, 'volume': 1022, 'openInterest': 5221}"
11/08/2024,2.2761,2.2775,2.2299,2.2440,-0.0397,-1.74%,560,"5,240","{'tradeTime': '2024-11-08', 'openPrice': 2.2761, 'highPrice': 2.2775, 'lowPrice': 2.2299, 'lastPrice': 2.244, 'priceChange': -0.0397, 'percentChange': -0.017384069711, 'volume': 560, 'openInterest': 5240}"
11/07/2024,2.2646,2.2906,2.2423,2.2837,+0.0169,+0.75%,748,"5,148","{'tradeTime': '2024-11-07', 'openPrice': 2.2646, 'highPrice': 2.2906, 'lowPrice': 2.2423, 'lastPrice': 2.2837, 'priceChange': 0.0169, 'percentChange': 0.007455443797, 'volume': 748, 'openInterest': 5148}"
11/06/2024,2.2784,2.2995,2.2345,2.2668,-0.0227,-0.99%,733,"5,059","{'tradeTime': '2024-11-06', 'openPrice': 2.2784, 'highPrice': 2.2995, 'lowPrice': 2.2345, 'lastPrice': 2.2668, 'priceChange': -0.0227, 'percentChange': -0.009914828565, 'volume': 733, 'openInterest': 5059}"
11/05/2024,2.2684,2.3039,2.2671,2.2895,+0.0154,+0.68%,767,"5,110","{'tradeTime': '2024-11-05', 'openPrice': 2.2684, 'highPrice': 2.3039, 'lowPrice': 2.2671, 'lastPrice': 2.2895, 'priceChange': 0.0154, 'percentChange': 0.006771909767, 'volume': 767, 'openInterest': 5110}"
11/04/2024,2.2550,2.2852,2.2505,2.2741,+0.0450,+2.02%,948,"5,056","{'tradeTime': '2024-11-04', 'openPrice': 2.255, 'highPrice': 2.2852, 'lowPrice': 2.2505, 'lastPrice': 2.2741, 'priceChange': 0.045, 'percentChange': 0.020187519627, 'volume': 948, 'openInterest': 5056}"
11/01/2024,2.2512,2.2752,2.2221,2.2291,+0.0038,+0.17%,"1,087","4,991","{'tradeTime': '2024-11-01', 'openPrice': 2.2512, 'highPrice': 2.2752, 'lowPrice': 2.2221, 'lastPrice': 2.2291, 'priceChange': 0.0038, 'percentChange': 0.001707634926, 'volume': 1087, 'openInterest': 4991}"
10/31/2024,2.2103,2.2574,2.1962,2.2253,+0.0261,+1.19%,"1,409","4,982","{'tradeTime': '2024-10-31', 'openPrice': 2.2103, 'highPrice': 2.2574, 'lowPrice': 2.1962, 'lastPrice': 2.2253, 'priceChange': 0.0261, 'percentChange': 0.011867951983, 'volume': 1409, 'openInterest': 4982}"
10/30/2024,2.1650,2.2146,2.1592,2.1992,+0.0451,+2.09%,733,"4,846","{'tradeTime': '2024-10-30', 'openPrice': 2.165, 'highPrice': 2.2146, 'lowPrice': 2.1592, 'lastPrice': 2.1992, 'priceChange': 0.0451, 'percentChange': 0.020936818161, 'volume': 733, 'openInterest': 4846}"
10/29/2024,2.1500,2.1728,2.1337,2.1541,+0.0009,+0.04%,779,"4,830","{'tradeTime': '2024-10-29', 'openPrice': 2.15, 'highPrice': 2.1728, 'lowPrice': 2.1337, 'lastPrice': 2.1541, 'priceChange': 0.0009, 'percentChange': 0.000417982538, 'volume': 779, 'openInterest': 4830}"
10/28/2024,2.2250,2.2250,2.1511,2.1532,-0.0983,-4.37%,"1,429","4,697","{'tradeTime': '2024-10-28', 'openPrice': 2.225, 'highPrice': 2.225, 'lowPrice': 2.1511, 'lastPrice': 2.1532, 'priceChange': -0.0983, 'percentChange': -0.043659782367, 'volume': 1429, 'openInterest': 4697}"
10/25/2024,2.2253,2.2629,2.2159,2.2515,+0.0304,+1.37%,"2,678","4,575","{'tradeTime': '2024-10-25', 'openPrice': 2.2253, 'highPrice': 2.2629, 'lowPrice': 2.2159, 'lastPrice': 2.2515, 'priceChange': 0.0304, 'percentChange': 0.013686911891, 'volume': 2678, 'openInterest': 4575}"
10/24/2024,2.2414,2.2696,2.2150,2.2211,-0.0166,-0.74%,"1,113","3,969","{'tradeTime': '2024-10-24', 'openPrice': 2.2414, 'highPrice': 2.2696, 'lowPrice': 2.215, 'lastPrice': 2.2211, 'priceChange': -0.0166, 'percentChange': -0.007418331322, 'volume': 1113, 'openInterest': 3969}"
10/23/2024,2.2433,2.2561,2.2238,2.2377,-0.0175,-0.78%,"1,075","3,715","{'tradeTime': '2024-10-23', 'openPrice': 2.2433, 'highPrice': 2.2561, 'lowPrice': 2.2238, 'lastPrice': 2.2377, 'priceChange': -0.0175, 'percentChange': -0.007759843916, 'volume': 1075, 'openInterest': 3715}"
10/22/2024,2.2302,2.2605,2.1983,2.2552,+0.0446,+2.02%,830,"3,597","{'tradeTime': '2024-10-22', 'openPrice': 2.2302, 'highPrice': 2.2605, 'lowPrice': 2.1983, 'lastPrice': 2.2552, 'priceChange': 0.0446, 'percentChange': 0.020175517959, 'volume': 830, 'openInterest': 3597}"
10/21/2024,2.2032,2.2176,2.1785,2.2106,+0.0301,+1.38%,465,"3,540","{'tradeTime': '2024-10-21', 'openPrice': 2.2032, 'highPrice': 2.2176, 'lowPrice': 2.1785, 'lastPrice': 2.2106, 'priceChange': 0.0301, 'percentChange': 0.013804173355, 'volume': 465, 'openInterest': 3540}"
10/18/2024,2.2113,2.2270,2.1744,2.1805,-0.0360,-1.62%,755,"3,599","{'tradeTime': '2024-10-18', 'openPrice': 2.2113, 'highPrice': 2.227, 'lowPrice': 2.1744, 'lastPrice': 2.1805, 'priceChange': -0.036, 'percentChange': -0.016241822693, 'volume': 755, 'openInterest': 3599}"
10/17/2024,2.2060,2.2198,2.1874,2.2165,+0.0114,+0.52%,635,"3,568","{'tradeTime': '2024-10-17', 'openPrice': 2.206, 'highPrice': 2.2198, 'lowPrice': 2.1874, 'lastPrice': 2.2165, 'priceChange': 0.0114, 'percentChange': 0.005169833568, 'volume': 635, 'openInterest': 3568}"
10/16/2024,2.1994,2.2242,2.1887,2.2051,-0.0095,-0.43%,"1,029","3,478","{'tradeTime': '2024-10-16', 'openPrice': 2.1994, 'highPrice': 2.2242, 'lowPrice': 2.1887, 'lastPrice': 2.2051, 'priceChange': -0.0095, 'percentChange': -0.004289713718, 'volume': 1029, 'openInterest': 3478}"
10/15/2024,2.2145,2.2272,2.2016,2.2146,-0.0789,-3.44%,740,"3,638","{'tradeTime': '2024-10-15', 'openPrice': 2.2145, 'highPrice': 2.2272, 'lowPrice': 2.2016, 'lastPrice': 2.2146, 'priceChange': -0.0789, 'percentChange': -0.034401569653, 'volume': 740, 'openInterest': 3638}"
10/14/2024,2.3068,2.3173,2.2520,2.2935,-0.0497,-2.12%,806,"3,573","{'tradeTime': '2024-10-14', 'openPrice': 2.3068, 'highPrice': 2.3173, 'lowPrice': 2.252, 'lastPrice': 2.2935, 'priceChange': -0.0497, 'percentChange': -0.021210310686, 'volume': 806, 'openInterest': 3573}"
10/11/2024,2.3376,2.3552,2.3218,2.3432,-0.0056,-0.24%,546,"3,581","{'tradeTime': '2024-10-11', 'openPrice': 2.3376, 'highPrice': 2.3552, 'lowPrice': 2.3218, 'lastPrice': 2.3432, 'priceChange': -0.0056, 'percentChange': -0.002384196185, 'volume': 546, 'openInterest': 3581}"
10/10/2024,2.2933,2.3528,2.2933,2.3488,+0.0615,+2.69%,454,"3,618","{'tradeTime': '2024-10-10', 'openPrice': 2.2933, 'highPrice': 2.3528, 'lowPrice': 2.2933, 'lastPrice': 2.3488, 'priceChange': 0.0615, 'percentChange': 0.02688759673, 'volume': 454, 'openInterest': 3618}"
10/09/2024,2.2888,2.3264,2.2608,2.2873,-0.0230,-1.00%,598,"3,636","{'tradeTime': '2024-10-09', 'openPrice': 2.2888, 'highPrice': 2.3264, 'lowPrice': 2.2608, 'lastPrice': 2.2873, 'priceChange': -0.023, 'percentChange': -0.009955417045, 'volume': 598, 'openInterest': 3636}"
10/08/2024,2.3565,2.3912,2.2875,2.3103,-0.0807,-3.38%,"1,675","3,637","{'tradeTime': '2024-10-08', 'openPrice': 2.3565, 'highPrice': 2.3912, 'lowPrice': 2.2875, 'lastPrice': 2.3103, 'priceChange': -0.0807, 'percentChange': -0.033751568381, 'volume': 1675, 'openInterest': 3637}"
10/07/2024,2.3407,2.3939,2.3188,2.3910,+0.0689,+2.97%,"1,530","3,683","{'tradeTime': '2024-10-07', 'openPrice': 2.3407, 'highPrice': 2.3939, 'lowPrice': 2.3188, 'lastPrice': 2.391, 'priceChange': 0.0689, 'percentChange': 0.029671418113, 'volume': 1530, 'openInterest': 3683}"
10/04/2024,2.3208,2.3427,2.3071,2.3221,+0.0163,+0.71%,"3,359","3,769","{'tradeTime': '2024-10-04', 'openPrice': 2.3208, 'highPrice': 2.3427, 'lowPrice': 2.3071, 'lastPrice': 2.3221, 'priceChange': 0.0163, 'percentChange': 0.00706913002, 'volume': 3359, 'openInterest': 3769}"
10/03/2024,2.2599,2.3058,2.2599,2.3058,+0.0871,+3.93%,"1,871","3,390","{'tradeTime': '2024-10-03', 'openPrice': 2.2599, 'highPrice': 2.3058, 'lowPrice': 2.2599, 'lastPrice': 2.3058, 'priceChange': 0.0871, 'percentChange': 0.039257222698, 'volume': 1871, 'openInterest': 3390}"
10/02/2024,2.2596,2.2698,2.2187,2.2187,+0.0064,+0.29%,"1,181","3,315","{'tradeTime': '2024-10-02', 'openPrice': 2.2596, 'highPrice': 2.2698, 'lowPrice': 2.2187, 'lastPrice': 2.2187, 'priceChange': 0.0064, 'percentChange': 0.002892916874, 'volume': 1181, 'openInterest': 3315}"
10/01/2024,2.1625,2.2472,2.1421,2.2123,+0.0278,+1.27%,"1,539","3,183","{'tradeTime': '2024-10-01', 'openPrice': 2.1625, 'highPrice': 2.2472, 'lowPrice': 2.1421, 'lastPrice': 2.2123, 'priceChange': 0.0278, 'percentChange': 0.012726024262, 'volume': 1539, 'openInterest': 3183}"
09/30/2024,2.1774,2.2058,2.1699,2.1845,+0.0069,+0.32%,415,"3,206","{'tradeTime': '2024-09-30', 'openPrice': 2.1774, 'highPrice': 2.2058, 'lowPrice': 2.1699, 'lastPrice': 2.1845, 'priceChange': 0.0069, 'percentChange': 0.00316862601, 'volume': 415, 'openInterest': 3206}"
09/27/2024,2.1749,2.1947,2.1541,2.1776,-0.0046,-0.21%,660,"3,184","{'tradeTime': '2024-09-27', 'openPrice': 2.1749, 'highPrice': 2.1947, 'lowPrice': 2.1541, 'lastPrice': 2.1776, 'priceChange': -0.0046, 'percentChange': -0.00210796444, 'volume': 660, 'openInterest': 3184}"
09/26/2024,2.1773,2.2189,2.1596,2.1822,-0.0252,-1.14%,323,"3,140","{'tradeTime': '2024-09-26', 'openPrice': 2.1773, 'highPrice': 2.2189, 'lowPrice': 2.1596, 'lastPrice': 2.1822, 'priceChange': -0.0252, 'percentChange': -0.011416145692, 'volume': 323, 'openInterest': 3140}"
09/25/2024,2.2281,2.2324,2.1987,2.2074,-0.0221,-0.99%,436,"3,136","{'tradeTime': '2024-09-25', 'openPrice': 2.2281, 'highPrice': 2.2324, 'lowPrice': 2.1987, 'lastPrice': 2.2074, 'priceChange': -0.0221, 'percentChange': -0.009912536443, 'volume': 436, 'openInterest': 3136}"
09/24/2024,2.2345,2.2393,2.2201,2.2295,+0.0343,+1.56%,455,"3,068","{'tradeTime': '2024-09-24', 'openPrice': 2.2345, 'highPrice': 2.2393, 'lowPrice': 2.2201, 'lastPrice': 2.2295, 'priceChange': 0.0343, 'percentChange': 0.015625, 'volume': 455, 'openInterest': 3068}"
09/23/2024,2.2052,2.2236,2.1719,2.1952,-0.0073,-0.33%,256,"3,027","{'tradeTime': '2024-09-23', 'openPrice': 2.2052, 'highPrice': 2.2236, 'lowPrice': 2.1719, 'lastPrice': 2.1952, 'priceChange': -0.0073, 'percentChange': -0.003314415437, 'volume': 256, 'openInterest': 3027}"
09/20/2024,2.1992,2.2111,2.1902,2.2025,+0.0001,unch,298,"3,013","{'tradeTime': '2024-09-20', 'openPrice': 2.1992, 'highPrice': 2.2111, 'lowPrice': 2.1902, 'lastPrice': 2.2025, 'priceChange': 0.0001, 'percentChange': 4.5405013e-05, 'volume': 298, 'openInterest': 3013}"
09/19/2024,2.1870,2.2107,2.1706,2.2024,+0.0185,+0.85%,374,"2,930","{'tradeTime': '2024-09-19', 'openPrice': 2.187, 'highPrice': 2.2107, 'lowPrice': 2.1706, 'lastPrice': 2.2024, 'priceChange': 0.0185, 'percentChange': 0.008471083841, 'volume': 374, 'openInterest': 2930}"
09/18/2024,2.1620,2.1919,2.1575,2.1839,-0.0008,-0.04%,315,"2,909","{'tradeTime': '2024-09-18', 'openPrice': 2.162, 'highPrice': 2.1919, 'lowPrice': 2.1575, 'lastPrice': 2.1839, 'priceChange': -0.0008, 'percentChange': -0.000366183, 'volume': 315, 'openInterest': 2909}"
09/17/2024,2.1512,2.1947,2.1455,2.1847,+0.0282,+1.31%,"1,041","2,939","{'tradeTime': '2024-09-17', 'openPrice': 2.1512, 'highPrice': 2.1947, 'lowPrice': 2.1455, 'lastPrice': 2.1847, 'priceChange': 0.0282, 'percentChange': 0.013076744725, 'volume': 1041, 'openInterest': 2939}"
09/16/2024,2.1365,2.1689,2.1339,2.1565,+0.0152,+0.71%,742,"3,131","{'tradeTime': '2024-09-16', 'openPrice': 2.1365, 'highPrice': 2.1689, 'lowPrice': 2.1339, 'lastPrice': 2.1565, 'priceChange': 0.0152, 'percentChange': 0.007098491571, 'volume': 742, 'openInterest': 3131}"
09/13/2024,2.1706,2.1793,2.1400,2.1413,-0.0246,-1.14%,674,"3,114","{'tradeTime': '2024-09-13', 'openPrice': 2.1706, 'highPrice': 2.1793, 'lowPrice': 2.14, 'lastPrice': 2.1413, 'priceChange': -0.0246, 'percentChange': -0.011357865091, 'volume': 674, 'openInterest': 3114}"
09/12/2024,2.1566,2.1811,2.1343,2.1659,+0.0272,+1.27%,951,"2,910","{'tradeTime': '2024-09-12', 'openPrice': 2.1566, 'highPrice': 2.1811, 'lowPrice': 2.1343, 'lastPrice': 2.1659, 'priceChange': 0.0272, 'percentChange': 0.012718006265, 'volume': 951, 'openInterest': 2910}"
09/11/2024,2.1149,2.1431,2.0991,2.1387,+0.0302,+1.43%,360,"2,984","{'tradeTime': '2024-09-11', 'openPrice': 2.1149, 'highPrice': 2.1431, 'lowPrice': 2.0991, 'lastPrice': 2.1387, 'priceChange': 0.0302, 'percentChange': 0.014322978421, 'volume': 360, 'openInterest': 2984}"
09/10/2024,2.1745,2.1819,2.1041,2.1085,-0.0639,-2.94%,"1,065","2,951","{'tradeTime': '2024-09-10', 'openPrice': 2.1745, 'highPrice': 2.1819, 'lowPrice': 2.1041, 'lastPrice': 2.1085, 'priceChange': -0.0639, 'percentChange': -0.029414472473, 'volume': 1065, 'openInterest': 2951}"
09/09/2024,2.1887,2.1935,2.1485,2.1724,+0.0115,+0.53%,401,"2,743","{'tradeTime': '2024-09-09', 'openPrice': 2.1887, 'highPrice': 2.1935, 'lowPrice': 2.1485, 'lastPrice': 2.1724, 'priceChange': 0.0115, 'percentChange': 0.005321856634, 'volume': 401, 'openInterest': 2743}"
09/06/2024,2.2057,2.2158,2.1513,2.1609,-0.0387,-1.76%,694,"2,642","{'tradeTime': '2024-09-06', 'openPrice': 2.2057, 'highPrice': 2.2158, 'lowPrice': 2.1513, 'lastPrice': 2.1609, 'priceChange': -0.0387, 'percentChange': -0.01759410802, 'volume': 694, 'openInterest': 2642}"
09/05/2024,2.2043,2.2255,2.1882,2.1996,+0.0087,+0.40%,848,"2,610","{'tradeTime': '2024-09-05', 'openPrice': 2.2043, 'highPrice': 2.2255, 'lowPrice': 2.1882, 'lastPrice': 2.1996, 'priceChange': 0.0087, 'percentChange': 0.003970970834, 'volume': 848, 'openInterest': 2610}"
09/04/2024,2.2105,2.2294,2.1826,2.1909,-0.0245,-1.11%,"1,431","2,469","{'tradeTime': '2024-09-04', 'openPrice': 2.2105, 'highPrice': 2.2294, 'lowPrice': 2.1826, 'lastPrice': 2.1909, 'priceChange': -0.0245, 'percentChange': -0.01105895098, 'volume': 1431, 'openInterest': 2469}"
09/03/2024,2.2525,2.2854,2.2095,2.2154,-0.0630,-2.77%,"1,012","2,307","{'tradeTime': '2024-09-03', 'openPrice': 2.2525, 'highPrice': 2.2854, 'lowPrice': 2.2095, 'lastPrice': 2.2154, 'priceChange': -0.063, 'percentChange': -0.027650983146, 'volume': 1012, 'openInterest': 2307}"
08/30/2024,2.3197,2.3304,2.2752,2.2784,-0.0360,-1.56%,334,"2,051","{'tradeTime': '2024-08-30', 'openPrice': 2.3197, 'highPrice': 2.3304, 'lowPrice': 2.2752, 'lastPrice': 2.2784, 'priceChange': -0.036, 'percentChange': -0.015554787418, 'volume': 334, 'openInterest': 2051}"
08/29/2024,2.2845,2.3178,2.2598,2.3144,+0.0421,+1.85%,654,"1,967","{'tradeTime': '2024-08-29', 'openPrice': 2.2845, 'highPrice': 2.3178, 'lowPrice': 2.2598, 'lastPrice': 2.3144, 'priceChange': 0.0421, 'percentChange': 0.018527483167, 'volume': 654, 'openInterest': 1967}"
08/28/2024,2.2917,2.3208,2.2693,2.2723,-0.0426,-1.84%,427,"1,787","{'tradeTime': '2024-08-28', 'openPrice': 2.2917, 'highPrice': 2.3208, 'lowPrice': 2.2693, 'lastPrice': 2.2723, 'priceChange': -0.0426, 'percentChange': -0.018402522787, 'volume': 427, 'openInterest': 1787}"
08/27/2024,2.3387,2.3590,2.3126,2.3149,-0.0371,-1.58%,447,"1,824","{'tradeTime': '2024-08-27', 'openPrice': 2.3387, 'highPrice': 2.359, 'lowPrice': 2.3126, 'lastPrice': 2.3149, 'priceChange': -0.0371, 'percentChange': -0.015773809524, 'volume': 447, 'openInterest': 1824}"
08/26/2024,2.3465,2.3625,2.3465,2.3520,+0.0440,+1.91%,281,"1,870","{'tradeTime': '2024-08-26', 'openPrice': 2.3465, 'highPrice': 2.3625, 'lowPrice': 2.3465, 'lastPrice': 2.352, 'priceChange': 0.044, 'percentChange': 0.019064124783, 'volume': 281, 'openInterest': 1870}"
08/23/2024,2.2959,2.3167,2.2958,2.3080,+0.0372,+1.64%,294,"1,860","{'tradeTime': '2024-08-23', 'openPrice': 2.2959, 'highPrice': 2.3167, 'lowPrice': 2.2958, 'lastPrice': 2.308, 'priceChange': 0.0372, 'percentChange': 0.016381891844, 'volume': 294, 'openInterest': 1860}"
08/22/2024,2.2589,2.2829,2.2487,2.2708,+0.0129,+0.57%,548,"1,853","{'tradeTime': '2024-08-22', 'openPrice': 2.2589, 'highPrice': 2.2829, 'lowPrice': 2.2487, 'lastPrice': 2.2708, 'priceChange': 0.0129, 'percentChange': 0.005713273396, 'volume': 548, 'openInterest': 1853}"
08/21/2024,2.2866,2.3043,2.2524,2.2579,-0.0176,-0.77%,731,"1,993","{'tradeTime': '2024-08-21', 'openPrice': 2.2866, 'highPrice': 2.3043, 'lowPrice': 2.2524, 'lastPrice': 2.2579, 'priceChange': -0.0176, 'percentChange': -0.007734563832, 'volume': 731, 'openInterest': 1993}"
08/20/2024,2.2800,2.2991,2.2677,2.2755,-0.0126,-0.55%,616,"1,891","{'tradeTime': '2024-08-20', 'openPrice': 2.28, 'highPrice': 2.2991, 'lowPrice': 2.2677, 'lastPrice': 2.2755, 'priceChange': -0.0126, 'percentChange': -0.005506752327, 'volume': 616, 'openInterest': 1891}"
08/19/2024,2.3289,2.3338,2.2870,2.2881,-0.0431,-1.85%,"1,066","1,896","{'tradeTime': '2024-08-19', 'openPrice': 2.3289, 'highPrice': 2.3338, 'lowPrice': 2.287, 'lastPrice': 2.2881, 'priceChange': -0.0431, 'percentChange': -0.018488332189, 'volume': 1066, 'openInterest': 1896}"
08/16/2024,2.3334,2.3410,2.3268,2.3312,-0.0363,-1.53%,262,"1,852","{'tradeTime': '2024-08-16', 'openPrice': 2.3334, 'highPrice': 2.341, 'lowPrice': 2.3268, 'lastPrice': 2.3312, 'priceChange': -0.0363, 'percentChange': -0.015332629356, 'volume': 262, 'openInterest': 1852}"
08/15/2024,2.3662,2.3774,2.3662,2.3675,+0.0110,+0.47%,287,"1,896","{'tradeTime': '2024-08-15', 'openPrice': 2.3662, 'highPrice': 2.3774, 'lowPrice': 2.3662, 'lastPrice': 2.3675, 'priceChange': 0.011, 'percentChange': 0.004667939741, 'volume': 287, 'openInterest': 1896}"
08/14/2024,2.3679,2.3792,2.3565,2.3565,-0.0166,-0.70%,226,"1,831","{'tradeTime': '2024-08-14', 'openPrice': 2.3679, 'highPrice': 2.3792, 'lowPrice': 2.3565, 'lastPrice': 2.3565, 'priceChange': -0.0166, 'percentChange': -0.00699506974, 'volume': 226, 'openInterest': 1831}"
08/13/2024,2.3867,2.3952,2.3702,2.3731,-0.0203,-0.85%,91,"1,787","{'tradeTime': '2024-08-13', 'openPrice': 2.3867, 'highPrice': 2.3952, 'lowPrice': 2.3702, 'lastPrice': 2.3731, 'priceChange': -0.0203, 'percentChange': -0.008481657893, 'volume': 91, 'openInterest': 1787}"
08/12/2024,2.3627,2.3941,2.3361,2.3934,+0.0557,+2.38%,168,"1,781","{'tradeTime': '2024-08-12', 'openPrice': 2.3627, 'highPrice': 2.3941, 'lowPrice': 2.3361, 'lastPrice': 2.3934, 'priceChange': 0.0557, 'percentChange': 0.023826838345, 'volume': 168, 'openInterest': 1781}"
08/09/2024,2.3477,2.3535,2.3345,2.3377,-0.0068,-0.29%,328,"1,840","{'tradeTime': '2024-08-09', 'openPrice': 2.3477, 'highPrice': 2.3535, 'lowPrice': 2.3345, 'lastPrice': 2.3377, 'priceChange': -0.0068, 'percentChange': -0.002900405204, 'volume': 328, 'openInterest': 1840}"
08/08/2024,2.3225,2.3463,2.3159,2.3445,+0.0128,+0.55%,199,"1,830","{'tradeTime': '2024-08-08', 'openPrice': 2.3225, 'highPrice': 2.3463, 'lowPrice': 2.3159, 'lastPrice': 2.3445, 'priceChange': 0.0128, 'percentChange': 0.005489556976, 'volume': 199, 'openInterest': 1830}"
08/07/2024,2.3174,2.3376,2.2780,2.3317,+0.0457,+2.00%,285,"1,779","{'tradeTime': '2024-08-07', 'openPrice': 2.3174, 'highPrice': 2.3376, 'lowPrice': 2.278, 'lastPrice': 2.3317, 'priceChange': 0.0457, 'percentChange': 0.019991251094, 'volume': 285, 'openInterest': 1779}"
08/06/2024,2.2817,2.3247,2.2802,2.2860,-0.0063,-0.27%,471,"1,779","{'tradeTime': '2024-08-06', 'openPrice': 2.2817, 'highPrice': 2.3247, 'lowPrice': 2.2802, 'lastPrice': 2.286, 'priceChange': -0.0063, 'percentChange': -0.00274833137, 'volume': 471, 'openInterest': 1779}"
08/05/2024,2.2747,2.3173,2.2671,2.2923,-0.0069,-0.30%,542,"1,753","{'tradeTime': '2024-08-05', 'openPrice': 2.2747, 'highPrice': 2.3173, 'lowPrice': 2.2671, 'lastPrice': 2.2923, 'priceChange': -0.0069, 'percentChange': -0.003001043841, 'volume': 542, 'openInterest': 1753}"
08/02/2024,2.3615,2.3615,2.2992,2.2992,-0.0733,-3.09%,598,"1,677","{'tradeTime': '2024-08-02', 'openPrice': 2.3615, 'highPrice': 2.3615, 'lowPrice': 2.2992, 'lastPrice': 2.2992, 'priceChange': -0.0733, 'percentChange': -0.030895679663, 'volume': 598, 'openInterest': 1677}"
08/01/2024,2.3725,2.3725,2.3725,2.3725,-0.0286,-1.19%,187,"1,641","{'tradeTime': '2024-08-01', 'openPrice': 2.3725, 'highPrice': 2.3725, 'lowPrice': 2.3725, 'lastPrice': 2.3725, 'priceChange': -0.0286, 'percentChange': -0.011911207363, 'volume': 187, 'openInterest': 1641}"
07/31/2024,2.4011,2.4011,2.4011,2.4011,+0.0594,+2.54%,375,"1,624","{'tradeTime': '2024-07-31', 'openPrice': 2.4011, 'highPrice': 2.4011, 'lowPrice': 2.4011, 'lastPrice': 2.4011, 'priceChange': 0.0594, 'percentChange': 0.025366186958, 'volume': 375, 'openInterest': 1624}"
07/30/2024,2.3428,2.3575,2.3404,2.3417,-0.0214,-0.91%,386,"1,614","{'tradeTime': '2024-07-30', 'openPrice': 2.3428, 'highPrice': 2.3575, 'lowPrice': 2.3404, 'lastPrice': 2.3417, 'priceChange': -0.0214, 'percentChange': -0.009055901147, 'volume': 386, 'openInterest': 1614}"
07/29/2024,2.3725,2.3725,2.3631,2.3631,-0.0308,-1.29%,390,"1,546","{'tradeTime': '2024-07-29', 'openPrice': 2.3725, 'highPrice': 2.3725, 'lowPrice': 2.3631, 'lastPrice': 2.3631, 'priceChange': -0.0308, 'percentChange': -0.012866034504, 'volume': 390, 'openInterest': 1546}"
07/26/2024,2.3935,2.4000,2.3934,2.3939,-0.0319,-1.32%,298,"1,428","{'tradeTime': '2024-07-26', 'openPrice': 2.3935, 'highPrice': 2.4, 'lowPrice': 2.3934, 'lastPrice': 2.3939, 'priceChange': -0.0319, 'percentChange': -0.013150300932, 'volume': 298, 'openInterest': 1428}"
07/25/2024,2.4115,2.4258,2.4030,2.4258,+0.0143,+0.59%,385,"1,406","{'tradeTime': '2024-07-25', 'openPrice': 2.4115, 'highPrice': 2.4258, 'lowPrice': 2.403, 'lastPrice': 2.4258, 'priceChange': 0.0143, 'percentChange': 0.005929919137, 'volume': 385, 'openInterest': 1406}"
07/24/2024,2.4035,2.4186,2.4035,2.4115,+0.0280,+1.17%,185,"1,360","{'tradeTime': '2024-07-24', 'openPrice': 2.4035, 'highPrice': 2.4186, 'lowPrice': 2.4035, 'lastPrice': 2.4115, 'priceChange': 0.028, 'percentChange': 0.01174743025, 'volume': 185, 'openInterest': 1360}"
07/23/2024,2.3900,2.3900,2.3799,2.3835,-0.0260,-1.08%,297,"1,341","{'tradeTime': '2024-07-23', 'openPrice': 2.39, 'highPrice': 2.39, 'lowPrice': 2.3799, 'lastPrice': 2.3835, 'priceChange': -0.026, 'percentChange': -0.010790620461, 'volume': 297, 'openInterest': 1341}"
07/22/2024,2.4043,2.4113,2.4042,2.4095,+0.0107,+0.45%,136,"1,325","{'tradeTime': '2024-07-22', 'openPrice': 2.4043, 'highPrice': 2.4113, 'lowPrice': 2.4042, 'lastPrice': 2.4095, 'priceChange': 0.0107, 'percentChange': 0.004460563615, 'volume': 136, 'openInterest': 1325}"
07/19/2024,2.4000,2.4000,2.3988,2.3988,-0.0552,-2.25%,135,"1,276","{'tradeTime': '2024-07-19', 'openPrice': 2.4, 'highPrice': 2.4, 'lowPrice': 2.3988, 'lastPrice': 2.3988, 'priceChange': -0.0552, 'percentChange': -0.022493887531, 'volume': 135, 'openInterest': 1276}"
07/18/2024,2.4565,2.4565,2.4540,2.4540,-0.0057,-0.23%,188,"1,247","{'tradeTime': '2024-07-18', 'openPrice': 2.4565, 'highPrice': 2.4565, 'lowPrice': 2.454, 'lastPrice': 2.454, 'priceChange': -0.0057, 'percentChange': -0.002317355775, 'volume': 188, 'openInterest': 1247}"
07/17/2024,2.4597,2.4597,2.4597,2.4597,+0.0205,+0.84%,186,"1,214","{'tradeTime': '2024-07-17', 'openPrice': 2.4597, 'highPrice': 2.4597, 'lowPrice': 2.4597, 'lastPrice': 2.4597, 'priceChange': 0.0205, 'percentChange': 0.008404394884, 'volume': 186, 'openInterest': 1214}"
07/16/2024,2.4450,2.4450,2.4392,2.4392,-0.0291,-1.18%,161,"1,237","{'tradeTime': '2024-07-16', 'openPrice': 2.445, 'highPrice': 2.445, 'lowPrice': 2.4392, 'lastPrice': 2.4392, 'priceChange': -0.0291, 'percentChange': -0.011789490743, 'volume': 161, 'openInterest': 1237}"
07/15/2024,2.4600,2.4728,2.4600,2.4683,-0.0022,-0.09%,243,"1,240","{'tradeTime': '2024-07-15', 'openPrice': 2.46, 'highPrice': 2.4728, 'lowPrice': 2.46, 'lastPrice': 2.4683, 'priceChange': -0.0022, 'percentChange': -0.000890507994, 'volume': 243, 'openInterest': 1240}"
07/12/2024,2.4751,2.4840,2.4705,2.4705,-0.0058,-0.23%,107,"1,191","{'tradeTime': '2024-07-12', 'openPrice': 2.4751, 'highPrice': 2.484, 'lowPrice': 2.4705, 'lastPrice': 2.4705, 'priceChange': -0.0058, 'percentChange': -0.002342204095, 'volume': 107, 'openInterest': 1191}"
07/11/2024,2.4763,2.4763,2.4763,2.4763,+0.0021,+0.08%,39,"1,161","{'tradeTime': '2024-07-11', 'openPrice': 2.4763, 'highPrice': 2.4763, 'lowPrice': 2.4763, 'lastPrice': 2.4763, 'priceChange': 0.0021, 'percentChange': 0.000848759195, 'volume': 39, 'openInterest': 1161}"
07/10/2024,2.4807,2.4807,2.4742,2.4742,-0.0089,-0.36%,158,"1,163","{'tradeTime': '2024-07-10', 'openPrice': 2.4807, 'highPrice': 2.4807, 'lowPrice': 2.4742, 'lastPrice': 2.4742, 'priceChange': -0.0089, 'percentChange': -0.003584229391, 'volume': 158, 'openInterest': 1163}"
07/09/2024,2.4831,2.4831,2.4831,2.4831,-0.0362,-1.44%,254,"1,135","{'tradeTime': '2024-07-09', 'openPrice': 2.4831, 'highPrice': 2.4831, 'lowPrice': 2.4831, 'lastPrice': 2.4831, 'priceChange': -0.0362, 'percentChange': -0.014369070774, 'volume': 254, 'openInterest': 1135}"
07/08/2024,2.5250,2.5250,2.5193,2.5193,-0.0070,-0.28%,140,"1,120","{'tradeTime': '2024-07-08', 'openPrice': 2.525, 'highPrice': 2.525, 'lowPrice': 2.5193, 'lastPrice': 2.5193, 'priceChange': -0.007, 'percentChange': -0.002770850651, 'volume': 140, 'openInterest': 1120}"
07/05/2024,2.5263,2.5263,2.5263,2.5263,-0.0306,-1.20%,127,"1,094","{'tradeTime': '2024-07-05', 'openPrice': 2.5263, 'highPrice': 2.5263, 'lowPrice': 2.5263, 'lastPrice': 2.5263, 'priceChange': -0.0306, 'percentChange': -0.011967617036, 'volume': 127, 'openInterest': 1094}"
07/03/2024,2.5569,2.5569,2.5569,2.5569,+0.0146,+0.57%,55,"1,091","{'tradeTime': '2024-07-03', 'openPrice': 2.5569, 'highPrice': 2.5569, 'lowPrice': 2.5569, 'lastPrice': 2.5569, 'priceChange': 0.0146, 'percentChange': 0.005742831294, 'volume': 55, 'openInterest': 1091}"
07/02/2024,2.5423,2.5460,2.5423,2.5423,+0.0114,+0.45%,201,"1,087","{'tradeTime': '2024-07-02', 'openPrice': 2.5423, 'highPrice': 2.546, 'lowPrice': 2.5423, 'lastPrice': 2.5423, 'priceChange': 0.0114, 'percentChange': 0.004504326524, 'volume': 201, 'openInterest': 1087}"
07/01/2024,2.5309,2.5309,2.5309,2.5309,+0.0510,+2.06%,130,"1,080","{'tradeTime': '2024-07-01', 'openPrice': 2.5309, 'highPrice': 2.5309, 'lowPrice': 2.5309, 'lastPrice': 2.5309, 'priceChange': 0.051, 'percentChange': 0.020565345377, 'volume': 130, 'openInterest': 1080}"
06/28/2024,2.4799,2.4923,2.4799,2.4799,-0.0117,-0.47%,89,"1,056","{'tradeTime': '2024-06-28', 'openPrice': 2.4799, 'highPrice': 2.4923, 'lowPrice': 2.4799, 'lastPrice': 2.4799, 'priceChange': -0.0117, 'percentChange': -0.004695777813, 'volume': 89, 'openInterest': 1056}"
06/27/2024,2.4850,2.4916,2.4831,2.4916,+0.0028,+0.11%,71,"1,040","{'tradeTime': '2024-06-27', 'openPrice': 2.485, 'highPrice': 2.4916, 'lowPrice': 2.4831, 'lastPrice': 2.4916, 'priceChange': 0.0028, 'percentChange': 0.00112504018, 'volume': 71, 'openInterest': 1040}"
06/26/2024,2.5025,2.5025,2.4888,2.4888,+0.0172,+0.70%,188,"1,030","{'tradeTime': '2024-06-26', 'openPrice': 2.5025, 'highPrice': 2.5025, 'lowPrice': 2.4888, 'lastPrice': 2.4888, 'priceChange': 0.0172, 'percentChange': 0.006959054863, 'volume': 188, 'openInterest': 1030}"
06/25/2024,2.4811,2.4811,2.4716,2.4716,-0.0095,-0.38%,245,"1,011","{'tradeTime': '2024-06-25', 'openPrice': 2.4811, 'highPrice': 2.4811, 'lowPrice': 2.4716, 'lastPrice': 2.4716, 'priceChange': -0.0095, 'percentChange': -0.003828946838, 'volume': 245, 'openInterest': 1011}"
06/24/2024,2.4811,2.4811,2.4811,2.4811,+0.0232,+0.94%,86,978,"{'tradeTime': '2024-06-24', 'openPrice': 2.4811, 'highPrice': 2.4811, 'lowPrice': 2.4811, 'lastPrice': 2.4811, 'priceChange': 0.0232, 'percentChange': 0.009438951951, 'volume': 86, 'openInterest': 978}"
06/21/2024,2.4579,2.4579,2.4579,2.4579,-0.0173,-0.70%,110,"1,005","{'tradeTime': '2024-06-21', 'openPrice': 2.4579, 'highPrice': 2.4579, 'lowPrice': 2.4579, 'lastPrice': 2.4579, 'priceChange': -0.0173, 'percentChange': -0.006989334195, 'volume': 110, 'openInterest': 1005}"
06/20/2024,2.4752,2.4752,2.4752,2.4752,+0.0025,+0.10%,100,974,"{'tradeTime': '2024-06-20', 'openPrice': 2.4752, 'highPrice': 2.4752, 'lowPrice': 2.4752, 'lastPrice': 2.4752, 'priceChange': 0.0025, 'percentChange': 0.001011040563, 'volume': 100, 'openInterest': 974}"
06/18/2024,2.4475,2.4727,2.4475,2.4727,+0.0323,+1.32%,169,972,"{'tradeTime': '2024-06-18', 'openPrice': 2.4475, 'highPrice': 2.4727, 'lowPrice': 2.4475, 'lastPrice': 2.4727, 'priceChange': 0.0323, 'percentChange': 0.013235535158, 'volume': 169, 'openInterest': 972}"
06/17/2024,2.4404,2.4404,2.4404,2.4404,+0.0087,+0.36%,80,947,"{'tradeTime': '2024-06-17', 'openPrice': 2.4404, 'highPrice': 2.4404, 'lowPrice': 2.4404, 'lastPrice': 2.4404, 'priceChange': 0.0087, 'percentChange': 0.003577743965, 'volume': 80, 'openInterest': 947}"
06/14/2024,2.4317,2.4490,2.4317,2.4317,-0.0147,-0.60%,40,947,"{'tradeTime': '2024-06-14', 'openPrice': 2.4317, 'highPrice': 2.449, 'lowPrice': 2.4317, 'lastPrice': 2.4317, 'priceChange': -0.0147, 'percentChange': -0.0060088293, 'volume': 40, 'openInterest': 947}"
06/13/2024,2.4464,2.4464,2.4464,2.4464,+0.0224,+0.92%,54,958,"{'tradeTime': '2024-06-13', 'openPrice': 2.4464, 'highPrice': 2.4464, 'lowPrice': 2.4464, 'lastPrice': 2.4464, 'priceChange': 0.0224, 'percentChange': 0.009240924092, 'volume': 54, 'openInterest': 958}"
06/12/2024,2.4500,2.4500,2.4240,2.4240,+0.0108,+0.45%,50,964,"{'tradeTime': '2024-06-12', 'openPrice': 2.45, 'highPrice': 2.45, 'lowPrice': 2.424, 'lastPrice': 2.424, 'priceChange': 0.0108, 'percentChange': 0.00447538538, 'volume': 50, 'openInterest': 964}"
06/11/2024,2.4153,2.4153,2.4132,2.4132,+0.0029,+0.12%,40,943,"{'tradeTime': '2024-06-11', 'openPrice': 2.4153, 'highPrice': 2.4153, 'lowPrice': 2.4132, 'lastPrice': 2.4132, 'priceChange': 0.0029, 'percentChange': 0.00120316973, 'volume': 40, 'openInterest': 943}"
06/10/2024,2.4103,2.4103,2.4103,2.4103,+0.0458,+1.94%,111,935,"{'tradeTime': '2024-06-10', 'openPrice': 2.4103, 'highPrice': 2.4103, 'lowPrice': 2.4103, 'lastPrice': 2.4103, 'priceChange': 0.0458, 'percentChange': 0.019369845633, 'volume': 111, 'openInterest': 935}"
06/07/2024,2.3645,2.3645,2.3645,2.3645,-0.0036,-0.15%,76,911,"{'tradeTime': '2024-06-07', 'openPrice': 2.3645, 'highPrice': 2.3645, 'lowPrice': 2.3645, 'lastPrice': 2.3645, 'priceChange': -0.0036, 'percentChange': -0.001520206072, 'volume': 76, 'openInterest': 911}"
06/06/2024,2.3590,2.3690,2.3568,2.3681,+0.0339,+1.45%,97,884,"{'tradeTime': '2024-06-06', 'openPrice': 2.359, 'highPrice': 2.369, 'lowPrice': 2.3568, 'lastPrice': 2.3681, 'priceChange': 0.0339, 'percentChange': 0.014523177106, 'volume': 97, 'openInterest': 884}"
06/05/2024,2.3342,2.3342,2.3342,2.3342,+0.0040,+0.17%,57,877,"{'tradeTime': '2024-06-05', 'openPrice': 2.3342, 'highPrice': 2.3342, 'lowPrice': 2.3342, 'lastPrice': 2.3342, 'priceChange': 0.004, 'percentChange': 0.001716590851, 'volume': 57, 'openInterest': 877}"
06/04/2024,2.3475,2.3475,2.3302,2.3302,-0.0230,-0.98%,321,865,"{'tradeTime': '2024-06-04', 'openPrice': 2.3475, 'highPrice': 2.3475, 'lowPrice': 2.3302, 'lastPrice': 2.3302, 'priceChange': -0.023, 'percentChange': -0.009773924868, 'volume': 321, 'openInterest': 865}"
06/03/2024,2.3800,2.3800,2.3509,2.3532,-0.0475,-1.98%,318,814,"{'tradeTime': '2024-06-03', 'openPrice': 2.38, 'highPrice': 2.38, 'lowPrice': 2.3509, 'lastPrice': 2.3532, 'priceChange': -0.0475, 'percentChange': -0.01978589578, 'volume': 318, 'openInterest': 814}"
05/31/2024,2.4007,2.4007,2.4007,2.4007,-0.0105,-0.44%,182,736,"{'tradeTime': '2024-05-31', 'openPrice': 2.4007, 'highPrice': 2.4007, 'lowPrice': 2.4007, 'lastPrice': 2.4007, 'priceChange': -0.0105, 'percentChange': -0.004354678169, 'volume': 182, 'openInterest': 736}"
05/30/2024,2.4112,2.4112,2.4112,2.4112,-0.0338,-1.38%,39,756,"{'tradeTime': '2024-05-30', 'openPrice': 2.4112, 'highPrice': 2.4112, 'lowPrice': 2.4112, 'lastPrice': 2.4112, 'priceChange': -0.0338, 'percentChange': -0.013824130879, 'volume': 39, 'openInterest': 756}"
05/29/2024,2.4450,2.4450,2.4450,2.4450,-0.0090,-0.37%,62,747,"{'tradeTime': '2024-05-29', 'openPrice': 2.445, 'highPrice': 2.445, 'lowPrice': 2.445, 'lastPrice': 2.445, 'priceChange': -0.009, 'percentChange': -0.003667481663, 'volume': 62, 'openInterest': 747}"
05/28/2024,2.4394,2.4540,2.4394,2.4540,+0.0450,+1.87%,275,744,"{'tradeTime': '2024-05-28', 'openPrice': 2.4394, 'highPrice': 2.454, 'lowPrice': 2.4394, 'lastPrice': 2.454, 'priceChange': 0.045, 'percentChange': 0.018679950187, 'volume': 275, 'openInterest': 744}"
05/24/2024,2.3900,2.4090,2.3900,2.4090,+0.0080,+0.33%,81,656,"{'tradeTime': '2024-05-24', 'openPrice': 2.39, 'highPrice': 2.409, 'lowPrice': 2.39, 'lastPrice': 2.409, 'priceChange': 0.008, 'percentChange': 0.003331945023, 'volume': 81, 'openInterest': 656}"
05/23/2024,2.3970,2.4091,2.3970,2.4010,-0.0173,-0.72%,176,665,"{'tradeTime': '2024-05-23', 'openPrice': 2.397, 'highPrice': 2.4091, 'lowPrice': 2.397, 'lastPrice': 2.401, 'priceChange': -0.0173, 'percentChange': -0.007153785717, 'volume': 176, 'openInterest': 665}"
05/22/2024,2.4354,2.4354,2.4183,2.4183,-0.0222,-0.91%,206,670,"{'tradeTime': '2024-05-22', 'openPrice': 2.4354, 'highPrice': 2.4354, 'lowPrice': 2.4183, 'lastPrice': 2.4183, 'priceChange': -0.0222, 'percentChange': -0.00909649662, 'volume': 206, 'openInterest': 670}"
05/21/2024,2.4405,2.4405,2.4405,2.4405,-0.0138,-0.56%,158,647,"{'tradeTime': '2024-05-21', 'openPrice': 2.4405, 'highPrice': 2.4405, 'lowPrice': 2.4405, 'lastPrice': 2.4405, 'priceChange': -0.0138, 'percentChange': -0.005622784501, 'volume': 158, 'openInterest': 647}"
05/20/2024,2.4543,2.4543,2.4543,2.4543,+0.0022,+0.09%,80,650,"{'tradeTime': '2024-05-20', 'openPrice': 2.4543, 'highPrice': 2.4543, 'lowPrice': 2.4543, 'lastPrice': 2.4543, 'priceChange': 0.0022, 'percentChange': 0.000897190164, 'volume': 80, 'openInterest': 650}"
05/17/2024,2.4394,2.4555,2.4394,2.4521,+0.0285,+1.18%,150,596,"{'tradeTime': '2024-05-17', 'openPrice': 2.4394, 'highPrice': 2.4555, 'lowPrice': 2.4394, 'lastPrice': 2.4521, 'priceChange': 0.0285, 'percentChange': 0.011759366232, 'volume': 150, 'openInterest': 596}"
05/16/2024,2.4236,2.4236,2.4236,2.4236,+0.0095,+0.39%,112,611,"{'tradeTime': '2024-05-16', 'openPrice': 2.4236, 'highPrice': 2.4236, 'lowPrice': 2.4236, 'lastPrice': 2.4236, 'priceChange': 0.0095, 'percentChange': 0.003935213951, 'volume': 112, 'openInterest': 611}"
05/15/2024,2.3900,2.4267,2.3900,2.4141,+0.0054,+0.22%,213,624,"{'tradeTime': '2024-05-15', 'openPrice': 2.39, 'highPrice': 2.4267, 'lowPrice': 2.39, 'lastPrice': 2.4141, 'priceChange': 0.0054, 'percentChange': 0.00224187321, 'volume': 213, 'openInterest': 624}"
05/14/2024,2.4000,2.4125,2.4000,2.4087,-0.0162,-0.67%,158,626,"{'tradeTime': '2024-05-14', 'openPrice': 2.4, 'highPrice': 2.4125, 'lowPrice': 2.4, 'lastPrice': 2.4087, 'priceChange': -0.0162, 'percentChange': -0.006680687863, 'volume': 158, 'openInterest': 626}"
05/13/2024,2.4274,2.4302,2.4249,2.4249,+0.0132,+0.55%,23,630,"{'tradeTime': '2024-05-13', 'openPrice': 2.4274, 'highPrice': 2.4302, 'lowPrice': 2.4249, 'lastPrice': 2.4249, 'priceChange': 0.0132, 'percentChange': 0.005473317577, 'volume': 23, 'openInterest': 630}"
05/10/2024,2.4117,2.4117,2.4117,2.4117,-0.0216,-0.89%,83,639,"{'tradeTime': '2024-05-10', 'openPrice': 2.4117, 'highPrice': 2.4117, 'lowPrice': 2.4117, 'lastPrice': 2.4117, 'priceChange': -0.0216, 'percentChange': -0.008876833929, 'volume': 83, 'openInterest': 639}"
05/09/2024,2.4430,2.4507,2.4333,2.4333,-0.0044,-0.18%,59,665,"{'tradeTime': '2024-05-09', 'openPrice': 2.443, 'highPrice': 2.4507, 'lowPrice': 2.4333, 'lastPrice': 2.4333, 'priceChange': -0.0044, 'percentChange': -0.001804980104, 'volume': 59, 'openInterest': 665}"
05/08/2024,2.4138,2.4377,2.4138,2.4377,+0.0004,+0.02%,128,681,"{'tradeTime': '2024-05-08', 'openPrice': 2.4138, 'highPrice': 2.4377, 'lowPrice': 2.4138, 'lastPrice': 2.4377, 'priceChange': 0.0004, 'percentChange': 0.00016411603, 'volume': 128, 'openInterest': 681}"
05/07/2024,2.4350,2.4373,2.4280,2.4373,-0.0030,-0.12%,161,638,"{'tradeTime': '2024-05-07', 'openPrice': 2.435, 'highPrice': 2.4373, 'lowPrice': 2.428, 'lastPrice': 2.4373, 'priceChange': -0.003, 'percentChange': -0.001229357046, 'volume': 161, 'openInterest': 638}"
05/06/2024,2.4340,2.4403,2.4316,2.4403,+0.0192,+0.79%,287,578,"{'tradeTime': '2024-05-06', 'openPrice': 2.434, 'highPrice': 2.4403, 'lowPrice': 2.4316, 'lastPrice': 2.4403, 'priceChange': 0.0192, 'percentChange': 0.007930279625, 'volume': 287, 'openInterest': 578}"
05/03/2024,2.4254,2.4254,2.4211,2.4211,+0.0040,+0.17%,239,515,"{'tradeTime': '2024-05-03', 'openPrice': 2.4254, 'highPrice': 2.4254, 'lowPrice': 2.4211, 'lastPrice': 2.4211, 'priceChange': 0.004, 'percentChange': 0.001654875677, 'volume': 239, 'openInterest': 515}"
05/02/2024,2.4165,2.4171,2.4110,2.4171,+0.0089,+0.37%,169,468,"{'tradeTime': '2024-05-02', 'openPrice': 2.4165, 'highPrice': 2.4171, 'lowPrice': 2.411, 'lastPrice': 2.4171, 'priceChange': 0.0089, 'percentChange': 0.003695706337, 'volume': 169, 'openInterest': 468}"
05/01/2024,2.4300,2.4300,2.4079,2.4082,-0.0563,-2.28%,352,478,"{'tradeTime': '2024-05-01', 'openPrice': 2.43, 'highPrice': 2.43, 'lowPrice': 2.4079, 'lastPrice': 2.4082, 'priceChange': -0.0563, 'percentChange': -0.022844390343, 'volume': 352, 'openInterest': 478}"
04/30/2024,2.4645,2.4645,2.4553,2.4645,-0.0066,-0.27%,82,391,"{'tradeTime': '2024-04-30', 'openPrice': 2.4645, 'highPrice': 2.4645, 'lowPrice': 2.4553, 'lastPrice': 2.4645, 'priceChange': -0.0066, 'percentChange': -0.002670875319, 'volume': 82, 'openInterest': 391}"
04/29/2024,2.4711,2.4711,2.4711,2.4711,-0.0137,-0.55%,8,405,"{'tradeTime': '2024-04-29', 'openPrice': 2.4711, 'highPrice': 2.4711, 'lowPrice': 2.4711, 'lastPrice': 2.4711, 'priceChange': -0.0137, 'percentChange': -0.005513522215, 'volume': 8, 'openInterest': 405}"
04/26/2024,2.4848,2.4848,2.4848,2.4848,+0.0076,+0.31%,49,411,"{'tradeTime': '2024-04-26', 'openPrice': 2.4848, 'highPrice': 2.4848, 'lowPrice': 2.4848, 'lastPrice': 2.4848, 'priceChange': 0.0076, 'percentChange': 0.003067979977, 'volume': 49, 'openInterest': 411}"
04/25/2024,2.4875,2.4875,2.4772,2.4772,+0.0086,+0.35%,87,411,"{'tradeTime': '2024-04-25', 'openPrice': 2.4875, 'highPrice': 2.4875, 'lowPrice': 2.4772, 'lastPrice': 2.4772, 'priceChange': 0.0086, 'percentChange': 0.003483755975, 'volume': 87, 'openInterest': 411}"
04/24/2024,2.4685,2.4700,2.4685,2.4686,-0.0091,-0.37%,53,434,"{'tradeTime': '2024-04-24', 'openPrice': 2.4685, 'highPrice': 2.47, 'lowPrice': 2.4685, 'lastPrice': 2.4686, 'priceChange': -0.0091, 'percentChange': -0.003672761028, 'volume': 53, 'openInterest': 434}"
04/23/2024,2.4590,2.4777,2.4590,2.4777,+0.0191,+0.78%,41,416,"{'tradeTime': '2024-04-23', 'openPrice': 2.459, 'highPrice': 2.4777, 'lowPrice': 2.459, 'lastPrice': 2.4777, 'priceChange': 0.0191, 'percentChange': 0.007768648825, 'volume': 41, 'openInterest': 416}"
04/22/2024,2.4310,2.4586,2.4310,2.4586,+0.0034,+0.14%,114,413,"{'tradeTime': '2024-04-22', 'openPrice': 2.431, 'highPrice': 2.4586, 'lowPrice': 2.431, 'lastPrice': 2.4586, 'priceChange': 0.0034, 'percentChange': 0.001384815901, 'volume': 114, 'openInterest': 413}"
04/19/2024,2.4410,2.5004,2.4410,2.4552,-0.0051,-0.21%,57,398,"{'tradeTime': '2024-04-19', 'openPrice': 2.441, 'highPrice': 2.5004, 'lowPrice': 2.441, 'lastPrice': 2.4552, 'priceChange': -0.0051, 'percentChange': -0.002072917937, 'volume': 57, 'openInterest': 398}"
04/18/2024,2.4603,2.4603,2.4603,2.4603,-0.0176,-0.71%,73,410,"{'tradeTime': '2024-04-18', 'openPrice': 2.4603, 'highPrice': 2.4603, 'lowPrice': 2.4603, 'lastPrice': 2.4603, 'priceChange': -0.0176, 'percentChange': -0.007102788652, 'volume': 73, 'openInterest': 410}"
04/17/2024,2.4779,2.4779,2.4779,2.4779,-0.0601,-2.37%,64,409,"{'tradeTime': '2024-04-17', 'openPrice': 2.4779, 'highPrice': 2.4779, 'lowPrice': 2.4779, 'lastPrice': 2.4779, 'priceChange': -0.0601, 'percentChange': -0.023680063042, 'volume': 64, 'openInterest': 409}"
04/16/2024,2.5380,2.5380,2.5380,2.5380,+0.0011,+0.04%,12,432,"{'tradeTime': '2024-04-16', 'openPrice': 2.538, 'highPrice': 2.538, 'lowPrice': 2.538, 'lastPrice': 2.538, 'priceChange': 0.0011, 'percentChange': 0.000433600063, 'volume': 12, 'openInterest': 432}"
04/15/2024,2.5369,2.5369,2.5369,2.5369,-0.0090,-0.35%,21,437,"{'tradeTime': '2024-04-15', 'openPrice': 2.5369, 'highPrice': 2.5369, 'lowPrice': 2.5369, 'lastPrice': 2.5369, 'priceChange': -0.009, 'percentChange': -0.003535095644, 'volume': 21, 'openInterest': 437}"
04/12/2024,2.5459,2.5478,2.5459,2.5459,+0.0194,+0.77%,31,441,"{'tradeTime': '2024-04-12', 'openPrice': 2.5459, 'highPrice': 2.5478, 'lowPrice': 2.5459, 'lastPrice': 2.5459, 'priceChange': 0.0194, 'percentChange': 0.007678606768, 'volume': 31, 'openInterest': 441}"
04/11/2024,2.5320,2.5320,2.5250,2.5265,-0.0126,-0.50%,131,445,"{'tradeTime': '2024-04-11', 'openPrice': 2.532, 'highPrice': 2.532, 'lowPrice': 2.525, 'lastPrice': 2.5265, 'priceChange': -0.0126, 'percentChange': -0.004962388248, 'volume': 131, 'openInterest': 445}"
04/10/2024,2.5391,2.5391,2.5391,2.5391,+0.0237,+0.94%,119,413,"{'tradeTime': '2024-04-10', 'openPrice': 2.5391, 'highPrice': 2.5391, 'lowPrice': 2.5391, 'lastPrice': 2.5391, 'priceChange': 0.0237, 'percentChange': 0.009421960722, 'volume': 119, 'openInterest': 413}"
04/09/2024,2.5154,2.5154,2.5154,2.5154,-0.0244,-0.96%,52,386,"{'tradeTime': '2024-04-09', 'openPrice': 2.5154, 'highPrice': 2.5154, 'lowPrice': 2.5154, 'lastPrice': 2.5154, 'priceChange': -0.0244, 'percentChange': -0.009607055674, 'volume': 52, 'openInterest': 386}"
04/08/2024,2.5275,2.5428,2.5275,2.5398,-0.0112,-0.44%,74,398,"{'tradeTime': '2024-04-08', 'openPrice': 2.5275, 'highPrice': 2.5428, 'lowPrice': 2.5275, 'lastPrice': 2.5398, 'priceChange': -0.0112, 'percentChange': -0.004390435123, 'volume': 74, 'openInterest': 398}"
04/05/2024,2.5510,2.5510,2.5510,2.5510,+0.0029,+0.11%,16,394,"{'tradeTime': '2024-04-05', 'openPrice': 2.551, 'highPrice': 2.551, 'lowPrice': 2.551, 'lastPrice': 2.551, 'priceChange': 0.0029, 'percentChange': 0.0011381029, 'volume': 16, 'openInterest': 394}"
04/04/2024,2.5481,2.5481,2.5481,2.5481,+0.0072,+0.28%,75,391,"{'tradeTime': '2024-04-04', 'openPrice': 2.5481, 'highPrice': 2.5481, 'lowPrice': 2.5481, 'lastPrice': 2.5481, 'priceChange': 0.0072, 'percentChange': 0.002833641623, 'volume': 75, 'openInterest': 391}"
04/03/2024,2.5409,2.5409,2.5409,2.5409,+0.0135,+0.53%,40,385,"{'tradeTime': '2024-04-03', 'openPrice': 2.5409, 'highPrice': 2.5409, 'lowPrice': 2.5409, 'lastPrice': 2.5409, 'priceChange': 0.0135, 'percentChange': 0.005341457624, 'volume': 40, 'openInterest': 385}"
04/02/2024,2.5274,2.5274,2.5274,2.5274,+0.0393,+1.58%,48,378,"{'tradeTime': '2024-04-02', 'openPrice': 2.5274, 'highPrice': 2.5274, 'lowPrice': 2.5274, 'lastPrice': 2.5274, 'priceChange': 0.0393, 'percentChange': 0.015795185081, 'volume': 48, 'openInterest': 378}"
04/01/2024,2.4881,2.4881,2.4881,2.4881,+0.0076,+0.31%,48,375,"{'tradeTime': '2024-04-01', 'openPrice': 2.4881, 'highPrice': 2.4881, 'lowPrice': 2.4881, 'lastPrice': 2.4881, 'priceChange': 0.0076, 'percentChange': 0.003063898408, 'volume': 48, 'openInterest': 375}"
03/28/2024,2.4805,2.4805,2.4805,2.4805,+0.0213,+0.87%,4,371,"{'tradeTime': '2024-03-28', 'openPrice': 2.4805, 'highPrice': 2.4805, 'lowPrice': 2.4805, 'lastPrice': 2.4805, 'priceChange': 0.0213, 'percentChange': 0.008661353286, 'volume': 4, 'openInterest': 371}"
03/27/2024,2.4592,2.4592,2.4592,2.4592,+0.0071,+0.29%,22,371,"{'tradeTime': '2024-03-27', 'openPrice': 2.4592, 'highPrice': 2.4592, 'lowPrice': 2.4592, 'lastPrice': 2.4592, 'priceChange': 0.0071, 'percentChange': 0.002895477346, 'volume': 22, 'openInterest': 371}"
03/26/2024,2.4521,2.4521,2.4521,2.4521,-0.0204,-0.83%,200,357,"{'tradeTime': '2024-03-26', 'openPrice': 2.4521, 'highPrice': 2.4521, 'lowPrice': 2.4521, 'lastPrice': 2.4521, 'priceChange': -0.0204, 'percentChange': -0.008250758342, 'volume': 200, 'openInterest': 357}"
03/25/2024,2.4763,2.4763,2.4641,2.4725,+0.0255,+1.04%,12,315,"{'tradeTime': '2024-03-25', 'openPrice': 2.4763, 'highPrice': 2.4763, 'lowPrice': 2.4641, 'lastPrice': 2.4725, 'priceChange': 0.0255, 'percentChange': 0.01042092358, 'volume': 12, 'openInterest': 315}"
03/22/2024,2.4470,2.4470,2.4470,2.4470,-0.0196,-0.79%,7,313,"{'tradeTime': '2024-03-22', 'openPrice': 2.447, 'highPrice': 2.447, 'lowPrice': 2.447, 'lastPrice': 2.447, 'priceChange': -0.0196, 'percentChange': -0.007946160707, 'volume': 7, 'openInterest': 313}"
03/21/2024,2.4666,2.4666,2.4666,2.4666,-0.0069,-0.28%,3,313,"{'tradeTime': '2024-03-21', 'openPrice': 2.4666, 'highPrice': 2.4666, 'lowPrice': 2.4666, 'lastPrice': 2.4666, 'priceChange': -0.0069, 'percentChange': -0.002789569436, 'volume': 3, 'openInterest': 313}"
03/20/2024,2.4800,2.4800,2.4668,2.4735,-0.0226,-0.91%,34,313,"{'tradeTime': '2024-03-20', 'openPrice': 2.48, 'highPrice': 2.48, 'lowPrice': 2.4668, 'lastPrice': 2.4735, 'priceChange': -0.0226, 'percentChange': -0.009054124434, 'volume': 34, 'openInterest': 313}"
03/19/2024,2.5075,2.5075,2.4961,2.4961,-0.0079,-0.32%,23,296,"{'tradeTime': '2024-03-19', 'openPrice': 2.5075, 'highPrice': 2.5075, 'lowPrice': 2.4961, 'lastPrice': 2.4961, 'priceChange': -0.0079, 'percentChange': -0.003154952077, 'volume': 23, 'openInterest': 296}"
03/18/2024,2.5040,2.5040,2.5040,2.5040,+0.0278,+1.12%,30,297,"{'tradeTime': '2024-03-18', 'openPrice': 2.504, 'highPrice': 2.504, 'lowPrice': 2.504, 'lastPrice': 2.504, 'priceChange': 0.0278, 'percentChange': 0.011226879897, 'volume': 30, 'openInterest': 297}"
03/15/2024,2.4762,2.4762,2.4762,2.4762,+0.0048,+0.19%,8,301,"{'tradeTime': '2024-03-15', 'openPrice': 2.4762, 'highPrice': 2.4762, 'lowPrice': 2.4762, 'lastPrice': 2.4762, 'priceChange': 0.0048, 'percentChange': 0.001942218985, 'volume': 8, 'openInterest': 301}"
03/14/2024,2.4714,2.4714,2.4714,2.4714,+0.0302,+1.24%,29,304,"{'tradeTime': '2024-03-14', 'openPrice': 2.4714, 'highPrice': 2.4714, 'lowPrice': 2.4714, 'lastPrice': 2.4714, 'priceChange': 0.0302, 'percentChange': 0.012370965099, 'volume': 29, 'openInterest': 304}"
03/13/2024,2.4412,2.4412,2.4412,2.4412,+0.0478,+2.00%,195,304,"{'tradeTime': '2024-03-13', 'openPrice': 2.4412, 'highPrice': 2.4412, 'lowPrice': 2.4412, 'lastPrice': 2.4412, 'priceChange': 0.0478, 'percentChange': 0.019971588535, 'volume': 195, 'openInterest': 304}"
03/12/2024,2.3934,2.3934,2.3934,2.3934,-0.0114,-0.47%,3,261,"{'tradeTime': '2024-03-12', 'openPrice': 2.3934, 'highPrice': 2.3934, 'lowPrice': 2.3934, 'lastPrice': 2.3934, 'priceChange': -0.0114, 'percentChange': -0.004740518962, 'volume': 3, 'openInterest': 261}"
03/11/2024,2.4048,2.4048,2.4048,2.4048,+0.0216,+0.91%,7,261,"{'tradeTime': '2024-03-11', 'openPrice': 2.4048, 'highPrice': 2.4048, 'lowPrice': 2.4048, 'lastPrice': 2.4048, 'priceChange': 0.0216, 'percentChange': 0.009063444109, 'volume': 7, 'openInterest': 261}"
03/08/2024,2.3800,2.3832,2.3800,2.3832,-0.0193,-0.80%,6,256,"{'tradeTime': '2024-03-08', 'openPrice': 2.38, 'highPrice': 2.3832, 'lowPrice': 2.38, 'lastPrice': 2.3832, 'priceChange': -0.0193, 'percentChange': -0.008033298647, 'volume': 6, 'openInterest': 256}"
03/07/2024,2.4025,2.4025,2.4025,2.4025,+0.0067,+0.28%,22,255,"{'tradeTime': '2024-03-07', 'openPrice': 2.4025, 'highPrice': 2.4025, 'lowPrice': 2.4025, 'lastPrice': 2.4025, 'priceChange': 0.0067, 'percentChange': 0.002796560648, 'volume': 22, 'openInterest': 255}"
03/06/2024,2.3910,2.3958,2.3909,2.3958,+0.0268,+1.13%,32,261,"{'tradeTime': '2024-03-06', 'openPrice': 2.391, 'highPrice': 2.3958, 'lowPrice': 2.3909, 'lastPrice': 2.3958, 'priceChange': 0.0268, 'percentChange': 0.011312790207, 'volume': 32, 'openInterest': 261}"
03/05/2024,2.3690,2.3690,2.3690,2.3690,-0.0191,-0.80%,1,262,"{'tradeTime': '2024-03-05', 'openPrice': 2.369, 'highPrice': 2.369, 'lowPrice': 2.369, 'lastPrice': 2.369, 'priceChange': -0.0191, 'percentChange': -0.007997990034, 'volume': 1, 'openInterest': 262}"
03/04/2024,2.3881,2.3881,2.3881,2.3881,-0.0183,-0.76%,24,262,"{'tradeTime': '2024-03-04', 'openPrice': 2.3881, 'highPrice': 2.3881, 'lowPrice': 2.3881, 'lastPrice': 2.3881, 'priceChange': -0.0183, 'percentChange': -0.007604720745, 'volume': 24, 'openInterest': 262}"
03/01/2024,2.4064,2.4064,2.4064,2.4064,+0.0199,+0.83%,3,263,"{'tradeTime': '2024-03-01', 'openPrice': 2.4064, 'highPrice': 2.4064, 'lowPrice': 2.4064, 'lastPrice': 2.4064, 'priceChange': 0.0199, 'percentChange': 0.008338571129, 'volume': 3, 'openInterest': 263}"
02/29/2024,2.3865,2.3865,2.3865,2.3865,+0.0062,+0.26%,18,261,"{'tradeTime': '2024-02-29', 'openPrice': 2.3865, 'highPrice': 2.3865, 'lowPrice': 2.3865, 'lastPrice': 2.3865, 'priceChange': 0.0062, 'percentChange': 0.002604713692, 'volume': 18, 'openInterest': 261}"
02/28/2024,2.3803,2.3803,2.3803,2.3803,-0.0174,-0.73%,8,261,"{'tradeTime': '2024-02-28', 'openPrice': 2.3803, 'highPrice': 2.3803, 'lowPrice': 2.3803, 'lastPrice': 2.3803, 'priceChange': -0.0174, 'percentChange': -0.007256954581, 'volume': 8, 'openInterest': 261}"
02/27/2024,2.3977,2.3977,2.3977,2.3977,+0.0046,+0.19%,12,258,"{'tradeTime': '2024-02-27', 'openPrice': 2.3977, 'highPrice': 2.3977, 'lowPrice': 2.3977, 'lastPrice': 2.3977, 'priceChange': 0.0046, 'percentChange': 0.001922192971, 'volume': 12, 'openInterest': 258}"
02/26/2024,2.3931,2.3931,2.3931,2.3931,+0.0323,+1.37%,14,254,"{'tradeTime': '2024-02-26', 'openPrice': 2.3931, 'highPrice': 2.3931, 'lowPrice': 2.3931, 'lastPrice': 2.3931, 'priceChange': 0.0323, 'percentChange': 0.013681802779, 'volume': 14, 'openInterest': 254}"
02/23/2024,2.3670,2.3670,2.3578,2.3608,-0.0300,-1.25%,33,252,"{'tradeTime': '2024-02-23', 'openPrice': 2.367, 'highPrice': 2.367, 'lowPrice': 2.3578, 'lastPrice': 2.3608, 'priceChange': -0.03, 'percentChange': -0.012548101054, 'volume': 33, 'openInterest': 252}"
02/22/2024,2.3900,2.3908,2.3847,2.3908,+0.0150,+0.63%,13,257,"{'tradeTime': '2024-02-22', 'openPrice': 2.39, 'highPrice': 2.3908, 'lowPrice': 2.3847, 'lastPrice': 2.3908, 'priceChange': 0.015, 'percentChange': 0.006313662766, 'volume': 13, 'openInterest': 257}"
02/21/2024,2.3758,2.3758,2.3758,2.3758,+0.0052,+0.22%,3,253,"{'tradeTime': '2024-02-21', 'openPrice': 2.3758, 'highPrice': 2.3758, 'lowPrice': 2.3758, 'lastPrice': 2.3758, 'priceChange': 0.0052, 'percentChange': 0.002193537501, 'volume': 3, 'openInterest': 253}"
02/20/2024,2.3925,2.3925,2.3706,2.3706,-0.0350,-1.45%,17,252,"{'tradeTime': '2024-02-20', 'openPrice': 2.3925, 'highPrice': 2.3925, 'lowPrice': 2.3706, 'lastPrice': 2.3706, 'priceChange': -0.035, 'percentChange': -0.014549384769, 'volume': 17, 'openInterest': 252}"
02/16/2024,2.3950,2.4056,2.3950,2.4056,+0.0130,+0.54%,10,236,"{'tradeTime': '2024-02-16', 'openPrice': 2.395, 'highPrice': 2.4056, 'lowPrice': 2.395, 'lastPrice': 2.4056, 'priceChange': 0.013, 'percentChange': 0.005433419711, 'volume': 10, 'openInterest': 236}"
02/15/2024,2.3926,2.3926,2.3926,2.3926,+0.0142,+0.60%,4,232,"{'tradeTime': '2024-02-15', 'openPrice': 2.3926, 'highPrice': 2.3926, 'lowPrice': 2.3926, 'lastPrice': 2.3926, 'priceChange': 0.0142, 'percentChange': 0.005970400269, 'volume': 4, 'openInterest': 232}"
02/14/2024,2.3930,2.3930,2.3784,2.3784,-0.0290,-1.20%,23,232,"{'tradeTime': '2024-02-14', 'openPrice': 2.393, 'highPrice': 2.393, 'lowPrice': 2.3784, 'lastPrice': 2.3784, 'priceChange': -0.029, 'percentChange': -0.012046190911, 'volume': 23, 'openInterest': 232}"
02/13/2024,2.4074,2.4074,2.4074,2.4074,+0.0026,+0.11%,1,225,"{'tradeTime': '2024-02-13', 'openPrice': 2.4074, 'highPrice': 2.4074, 'lowPrice': 2.4074, 'lastPrice': 2.4074, 'priceChange': 0.0026, 'percentChange': 0.001081170991, 'volume': 1, 'openInterest': 225}"
02/12/2024,2.4048,2.4048,2.4021,2.4048,-0.0142,-0.59%,74,225,"{'tradeTime': '2024-02-12', 'openPrice': 2.4048, 'highPrice': 2.4048, 'lowPrice': 2.4021, 'lastPrice': 2.4048, 'priceChange': -0.0142, 'percentChange': -0.005870194295, 'volume': 74, 'openInterest': 225}"
02/09/2024,2.4143,2.4190,2.4143,2.4190,+0.0197,+0.82%,8,204,"{'tradeTime': '2024-02-09', 'openPrice': 2.4143, 'highPrice': 2.419, 'lowPrice': 2.4143, 'lastPrice': 2.419, 'priceChange': 0.0197, 'percentChange': 0.008210728129, 'volume': 8, 'openInterest': 204}"
02/08/2024,2.3993,2.3993,2.3993,2.3993,+0.0227,+0.96%,62,203,"{'tradeTime': '2024-02-08', 'openPrice': 2.3993, 'highPrice': 2.3993, 'lowPrice': 2.3993, 'lastPrice': 2.3993, 'priceChange': 0.0227, 'percentChange': 0.009551460069, 'volume': 62, 'openInterest': 203}"
02/07/2024,2.3766,2.3766,2.3766,2.3766,+0.0152,+0.64%,11,178,"{'tradeTime': '2024-02-07', 'openPrice': 2.3766, 'highPrice': 2.3766, 'lowPrice': 2.3766, 'lastPrice': 2.3766, 'priceChange': 0.0152, 'percentChange': 0.00643685949, 'volume': 11, 'openInterest': 178}"
02/06/2024,2.3614,2.3614,2.3614,2.3614,+0.0002,+0.01%,70,173,"{'tradeTime': '2024-02-06', 'openPrice': 2.3614, 'highPrice': 2.3614, 'lowPrice': 2.3614, 'lastPrice': 2.3614, 'priceChange': 0.0002, 'percentChange': 8.4702694e-05, 'volume': 70, 'openInterest': 173}"
02/05/2024,2.3612,2.3612,2.3612,2.3612,+0.0321,+1.38%,0,130,"{'tradeTime': '2024-02-05', 'openPrice': 2.3612, 'highPrice': 2.3612, 'lowPrice': 2.3612, 'lastPrice': 2.3612, 'priceChange': 0.0321, 'percentChange': 0.013782147611, 'volume': 0, 'openInterest': 130}"
02/02/2024,2.3291,2.3291,2.3291,2.3291,-0.0307,-1.30%,0,130,"{'tradeTime': '2024-02-02', 'openPrice': 2.3291, 'highPrice': 2.3291, 'lowPrice': 2.3291, 'lastPrice': 2.3291, 'priceChange': -0.0307, 'percentChange': -0.013009577083, 'volume': 0, 'openInterest': 130}"
02/01/2024,2.3598,2.3598,2.3598,2.3598,-0.0391,-1.63%,0,130,"{'tradeTime': '2024-02-01', 'openPrice': 2.3598, 'highPrice': 2.3598, 'lowPrice': 2.3598, 'lastPrice': 2.3598, 'priceChange': -0.0391, 'percentChange': -0.016299137105, 'volume': 0, 'openInterest': 130}"
01/31/2024,2.3989,2.3989,2.3989,2.3989,-0.0222,-0.92%,8,130,"{'tradeTime': '2024-01-31', 'openPrice': 2.3989, 'highPrice': 2.3989, 'lowPrice': 2.3989, 'lastPrice': 2.3989, 'priceChange': -0.0222, 'percentChange': -0.009169385816, 'volume': 8, 'openInterest': 130}"
01/30/2024,2.4350,2.4350,2.4211,2.4211,+0.0129,+0.54%,3,129,"{'tradeTime': '2024-01-30', 'openPrice': 2.435, 'highPrice': 2.435, 'lowPrice': 2.4211, 'lastPrice': 2.4211, 'priceChange': 0.0129, 'percentChange': 0.005356697949, 'volume': 3, 'openInterest': 129}"
01/29/2024,2.4157,2.4157,2.3957,2.4082,-0.0255,-1.05%,7,128,"{'tradeTime': '2024-01-29', 'openPrice': 2.4157, 'highPrice': 2.4157, 'lowPrice': 2.3957, 'lastPrice': 2.4082, 'priceChange': -0.0255, 'percentChange': -0.010477873197, 'volume': 7, 'openInterest': 128}"
01/26/2024,2.4337,2.4337,2.4337,2.4337,+0.0166,+0.69%,3,129,"{'tradeTime': '2024-01-26', 'openPrice': 2.4337, 'highPrice': 2.4337, 'lowPrice': 2.4337, 'lastPrice': 2.4337, 'priceChange': 0.0166, 'percentChange': 0.006867734061, 'volume': 3, 'openInterest': 129}"
01/25/2024,2.4075,2.4171,2.4075,2.4171,+0.0339,+1.42%,20,132,"{'tradeTime': '2024-01-25', 'openPrice': 2.4075, 'highPrice': 2.4171, 'lowPrice': 2.4075, 'lastPrice': 2.4171, 'priceChange': 0.0339, 'percentChange': 0.014224572004, 'volume': 20, 'openInterest': 132}"
01/24/2024,2.3832,2.3832,2.3832,2.3832,-0.0001,unch,1,133,"{'tradeTime': '2024-01-24', 'openPrice': 2.3832, 'highPrice': 2.3832, 'lowPrice': 2.3832, 'lastPrice': 2.3832, 'priceChange': -0.0001, 'percentChange': -4.1958629e-05, 'volume': 1, 'openInterest': 133}"
01/23/2024,2.3833,2.3833,2.3833,2.3833,-0.0055,-0.23%,11,132,"{'tradeTime': '2024-01-23', 'openPrice': 2.3833, 'highPrice': 2.3833, 'lowPrice': 2.3833, 'lastPrice': 2.3833, 'priceChange': -0.0055, 'percentChange': -0.002302411253, 'volume': 11, 'openInterest': 132}"
01/22/2024,2.3888,2.3888,2.3888,2.3888,+0.0317,+1.34%,0,121,"{'tradeTime': '2024-01-22', 'openPrice': 2.3888, 'highPrice': 2.3888, 'lowPrice': 2.3888, 'lastPrice': 2.3888, 'priceChange': 0.0317, 'percentChange': 0.013448729371, 'volume': 0, 'openInterest': 121}"
01/19/2024,2.3571,2.3571,2.3571,2.3571,-0.0202,-0.85%,0,121,"{'tradeTime': '2024-01-19', 'openPrice': 2.3571, 'highPrice': 2.3571, 'lowPrice': 2.3571, 'lastPrice': 2.3571, 'priceChange': -0.0202, 'percentChange': -0.008497034451, 'volume': 0, 'openInterest': 121}"
01/18/2024,2.3773,2.3773,2.3773,2.3773,+0.0241,+1.02%,0,121,"{'tradeTime': '2024-01-18', 'openPrice': 2.3773, 'highPrice': 2.3773, 'lowPrice': 2.3773, 'lastPrice': 2.3773, 'priceChange': 0.0241, 'percentChange': 0.010241373449, 'volume': 0, 'openInterest': 121}"
01/17/2024,2.3532,2.3532,2.3532,2.3532,+0.0034,+0.14%,4,121,"{'tradeTime': '2024-01-17', 'openPrice': 2.3532, 'highPrice': 2.3532, 'lowPrice': 2.3532, 'lastPrice': 2.3532, 'priceChange': 0.0034, 'percentChange': 0.001446931654, 'volume': 4, 'openInterest': 121}"
01/16/2024,2.3498,2.3498,2.3498,2.3498,-0.0173,-0.73%,0,122,"{'tradeTime': '2024-01-16', 'openPrice': 2.3498, 'highPrice': 2.3498, 'lowPrice': 2.3498, 'lastPrice': 2.3498, 'priceChange': -0.0173, 'percentChange': -0.007308520975, 'volume': 0, 'openInterest': 122}"
01/12/2024,2.3671,2.3827,2.3671,2.3671,+0.0196,+0.83%,0,122,"{'tradeTime': '2024-01-12', 'openPrice': 2.3671, 'highPrice': 2.3827, 'lowPrice': 2.3671, 'lastPrice': 2.3671, 'priceChange': 0.0196, 'percentChange': 0.008349307774, 'volume': 0, 'openInterest': 122}"
01/11/2024,2.3475,2.3475,2.3475,2.3475,+0.0252,+1.09%,0,122,"{'tradeTime': '2024-01-11', 'openPrice': 2.3475, 'highPrice': 2.3475, 'lowPrice': 2.3475, 'lastPrice': 2.3475, 'priceChange': 0.0252, 'percentChange': 0.0108513112, 'volume': 0, 'openInterest': 122}"
01/10/2024,2.3223,2.3223,2.3223,2.3223,-0.0231,-0.98%,0,122,"{'tradeTime': '2024-01-10', 'openPrice': 2.3223, 'highPrice': 2.3223, 'lowPrice': 2.3223, 'lastPrice': 2.3223, 'priceChange': -0.0231, 'percentChange': -0.009849066257, 'volume': 0, 'openInterest': 122}"
01/09/2024,2.3650,2.3650,2.3454,2.3454,+0.0210,+0.90%,5,122,"{'tradeTime': '2024-01-09', 'openPrice': 2.365, 'highPrice': 2.365, 'lowPrice': 2.3454, 'lastPrice': 2.3454, 'priceChange': 0.021, 'percentChange': 0.009034589572, 'volume': 5, 'openInterest': 122}"
01/08/2024,2.3144,2.3360,2.3144,2.3244,-0.0344,-1.46%,22,120,"{'tradeTime': '2024-01-08', 'openPrice': 2.3144, 'highPrice': 2.336, 'lowPrice': 2.3144, 'lastPrice': 2.3244, 'priceChange': -0.0344, 'percentChange': -0.01458368662, 'volume': 22, 'openInterest': 120}"
01/05/2024,2.3588,2.3588,2.3588,2.3588,+0.0159,+0.68%,26,117,"{'tradeTime': '2024-01-05', 'openPrice': 2.3588, 'highPrice': 2.3588, 'lowPrice': 2.3588, 'lastPrice': 2.3588, 'priceChange': 0.0159, 'percentChange': 0.006786461223, 'volume': 26, 'openInterest': 117}"
01/04/2024,2.3429,2.3429,2.3429,2.3429,-0.0184,-0.78%,0,117,"{'tradeTime': '2024-01-04', 'openPrice': 2.3429, 'highPrice': 2.3429, 'lowPrice': 2.3429, 'lastPrice': 2.3429, 'priceChange': -0.0184, 'percentChange': -0.007792317791, 'volume': 0, 'openInterest': 117}"
01/03/2024,2.3613,2.3613,2.3613,2.3613,+0.0502,+2.17%,0,117,"{'tradeTime': '2024-01-03', 'openPrice': 2.3613, 'highPrice': 2.3613, 'lowPrice': 2.3613, 'lastPrice': 2.3613, 'priceChange': 0.0502, 'percentChange': 0.021721258275, 'volume': 0, 'openInterest': 117}"
