tradeTime,openPrice,highPrice,lowPrice,lastPrice,priceChange,percentChange,volume,openInterest,raw
07/08/2025,2.3068,2.3491,2.2967,2.3390,+0.0237,+1.02%,"11,492","26,970","{'tradeTime': '2025-07-08', 'openPrice': 2.3068, 'highPrice': 2.3491, 'lowPrice': 2.2967, 'lastPrice': 2.339, 'priceChange': 0.0237, 'percentChange': 0.010236254481, 'volume': 11492, 'openInterest': 26970}"
07/07/2025,2.2879,2.3241,2.2778,2.3153,+0.0306,+1.34%,"15,041","26,137","{'tradeTime': '2025-07-07', 'openPrice': 2.2879, 'highPrice': 2.3241, 'lowPrice': 2.2778, 'lastPrice': 2.3153, 'priceChange': 0.0306, 'percentChange': 0.01339344334, 'volume': 15041, 'openInterest': 26137}"
07/03/2025,2.3090,2.3135,2.2820,2.2847,-0.0227,-0.98%,"13,252","25,767","{'tradeTime': '2025-07-03', 'openPrice': 2.309, 'highPrice': 2.3135, 'lowPrice': 2.282, 'lastPrice': 2.2847, 'priceChange': -0.0227, 'percentChange': -0.009837912802, 'volume': 13252, 'openInterest': 25767}"
07/02/2025,2.2514,2.3122,2.2408,2.3074,+0.0598,+2.66%,"15,993","24,912","{'tradeTime': '2025-07-02', 'openPrice': 2.2514, 'highPrice': 2.3122, 'lowPrice': 2.2408, 'lastPrice': 2.3074, 'priceChange': 0.0598, 'percentChange': 0.026606157679, 'volume': 15993, 'openInterest': 24912}"
07/01/2025,2.2136,2.2544,2.1999,2.2476,+0.0280,+1.26%,"17,577","24,145","{'tradeTime': '2025-07-01', 'openPrice': 2.2136, 'highPrice': 2.2544, 'lowPrice': 2.1999, 'lastPrice': 2.2476, 'priceChange': 0.028, 'percentChange': 0.012614885565, 'volume': 17577, 'openInterest': 24145}"
06/30/2025,2.1837,2.2249,2.1772,2.2196,+0.0212,+0.96%,"11,028","23,156","{'tradeTime': '2025-06-30', 'openPrice': 2.1837, 'highPrice': 2.2249, 'lowPrice': 2.1772, 'lastPrice': 2.2196, 'priceChange': 0.0212, 'percentChange': 0.009643377001, 'volume': 11028, 'openInterest': 23156}"
06/27/2025,2.2338,2.2406,2.1821,2.1984,-0.0337,-1.51%,"3,488","21,774","{'tradeTime': '2025-06-27', 'openPrice': 2.2338, 'highPrice': 2.2406, 'lowPrice': 2.1821, 'lastPrice': 2.1984, 'priceChange': -0.0337, 'percentChange': -0.015097889879, 'volume': 3488, 'openInterest': 21774}"
06/26/2025,2.2179,2.2598,2.2077,2.2321,+0.0222,+1.00%,"11,144","21,220","{'tradeTime': '2025-06-26', 'openPrice': 2.2179, 'highPrice': 2.2598, 'lowPrice': 2.2077, 'lastPrice': 2.2321, 'priceChange': 0.0222, 'percentChange': 0.010045703425, 'volume': 11144, 'openInterest': 21220}"
06/25/2025,2.2394,2.2494,2.2086,2.2099,-0.0009,-0.04%,"12,619","19,895","{'tradeTime': '2025-06-25', 'openPrice': 2.2394, 'highPrice': 2.2494, 'lowPrice': 2.2086, 'lastPrice': 2.2099, 'priceChange': -0.0009, 'percentChange': -0.000407092455, 'volume': 12619, 'openInterest': 19895}"
06/24/2025,2.2195,2.2556,2.1868,2.2108,-0.0966,-4.19%,"14,699","20,219","{'tradeTime': '2025-06-24', 'openPrice': 2.2195, 'highPrice': 2.2556, 'lowPrice': 2.1868, 'lastPrice': 2.2108, 'priceChange': -0.0966, 'percentChange': -0.041865302938, 'volume': 14699, 'openInterest': 20219}"
06/23/2025,2.5589,2.5839,2.2590,2.3074,-0.1468,-5.98%,"23,800","20,810","{'tradeTime': '2025-06-23', 'openPrice': 2.5589, 'highPrice': 2.5839, 'lowPrice': 2.259, 'lastPrice': 2.3074, 'priceChange': -0.1468, 'percentChange': -0.059815825931, 'volume': 23800, 'openInterest': 20810}"
06/20/2025,2.4453,2.5565,2.4328,2.4542,+0.0085,+0.35%,"32,005","17,858","{'tradeTime': '2025-06-20', 'openPrice': 2.4453, 'highPrice': 2.5565, 'lowPrice': 2.4328, 'lastPrice': 2.4542, 'priceChange': 0.0085, 'percentChange': 0.00347548759, 'volume': 32005, 'openInterest': 17858}"
06/18/2025,2.4295,2.4629,2.3834,2.4457,+0.0211,+0.87%,"18,746","19,006","{'tradeTime': '2025-06-18', 'openPrice': 2.4295, 'highPrice': 2.4629, 'lowPrice': 2.3834, 'lastPrice': 2.4457, 'priceChange': 0.0211, 'percentChange': 0.008702466386, 'volume': 18746, 'openInterest': 19006}"
06/17/2025,2.3217,2.4366,2.3206,2.4246,+0.0854,+3.65%,"16,898","20,210","{'tradeTime': '2025-06-17', 'openPrice': 2.3217, 'highPrice': 2.4366, 'lowPrice': 2.3206, 'lastPrice': 2.4246, 'priceChange': 0.0854, 'percentChange': 0.036508207934, 'volume': 16898, 'openInterest': 20210}"
06/16/2025,2.3985,2.4120,2.2637,2.3392,+0.0238,+1.03%,"13,874","19,660","{'tradeTime': '2025-06-16', 'openPrice': 2.3985, 'highPrice': 2.412, 'lowPrice': 2.2637, 'lastPrice': 2.3392, 'priceChange': 0.0238, 'percentChange': 0.010279001468, 'volume': 13874, 'openInterest': 19660}"
06/13/2025,2.1945,2.3416,2.1897,2.3154,+0.1401,+6.44%,"22,796","18,742","{'tradeTime': '2025-06-13', 'openPrice': 2.1945, 'highPrice': 2.3416, 'lowPrice': 2.1897, 'lastPrice': 2.3154, 'priceChange': 0.1401, 'percentChange': 0.064404909668, 'volume': 22796, 'openInterest': 18742}"
06/12/2025,2.1934,2.1984,2.1596,2.1753,-0.0150,-0.68%,"11,878","19,831","{'tradeTime': '2025-06-12', 'openPrice': 2.1934, 'highPrice': 2.1984, 'lowPrice': 2.1596, 'lastPrice': 2.1753, 'priceChange': -0.015, 'percentChange': -0.006848376935, 'volume': 11878, 'openInterest': 19831}"
06/11/2025,2.1209,2.1952,2.1151,2.1903,+0.0621,+2.92%,"6,645","17,611","{'tradeTime': '2025-06-11', 'openPrice': 2.1209, 'highPrice': 2.1952, 'lowPrice': 2.1151, 'lastPrice': 2.1903, 'priceChange': 0.0621, 'percentChange': 0.029179588385, 'volume': 6645, 'openInterest': 17611}"
06/10/2025,2.1276,2.1531,2.1191,2.1282,unch,unch,"7,112","17,167","{'tradeTime': '2025-06-10', 'openPrice': 2.1276, 'highPrice': 2.1531, 'lowPrice': 2.1191, 'lastPrice': 2.1282, 'priceChange': 0, 'percentChange': 0, 'volume': 7112, 'openInterest': 17167}"
06/09/2025,2.1140,2.1304,2.1060,2.1282,+0.0158,+0.75%,"4,742","16,436","{'tradeTime': '2025-06-09', 'openPrice': 2.114, 'highPrice': 2.1304, 'lowPrice': 2.106, 'lastPrice': 2.1282, 'priceChange': 0.0158, 'percentChange': 0.007479644007, 'volume': 4742, 'openInterest': 16436}"
06/06/2025,2.0858,2.1175,2.0766,2.1124,+0.0240,+1.15%,"4,065","16,539","{'tradeTime': '2025-06-06', 'openPrice': 2.0858, 'highPrice': 2.1175, 'lowPrice': 2.0766, 'lastPrice': 2.1124, 'priceChange': 0.024, 'percentChange': 0.011492051331, 'volume': 4065, 'openInterest': 16539}"
06/05/2025,2.0669,2.1012,2.0623,2.0884,+0.0192,+0.93%,"3,939","16,272","{'tradeTime': '2025-06-05', 'openPrice': 2.0669, 'highPrice': 2.1012, 'lowPrice': 2.0623, 'lastPrice': 2.0884, 'priceChange': 0.0192, 'percentChange': 0.009278948386, 'volume': 3939, 'openInterest': 16272}"
06/04/2025,2.0883,2.0997,2.0591,2.0692,-0.0255,-1.22%,"6,488","16,122","{'tradeTime': '2025-06-04', 'openPrice': 2.0883, 'highPrice': 2.0997, 'lowPrice': 2.0591, 'lastPrice': 2.0692, 'priceChange': -0.0255, 'percentChange': -0.012173580942, 'volume': 6488, 'openInterest': 16122}"
06/03/2025,2.0712,2.1021,2.0579,2.0947,+0.0404,+1.97%,"5,881","16,112","{'tradeTime': '2025-06-03', 'openPrice': 2.0712, 'highPrice': 2.1021, 'lowPrice': 2.0579, 'lastPrice': 2.0947, 'priceChange': 0.0404, 'percentChange': 0.0196660663, 'volume': 5881, 'openInterest': 16112}"
06/02/2025,2.0511,2.0898,2.0502,2.0543,+0.0389,+1.93%,"3,172","16,082","{'tradeTime': '2025-06-02', 'openPrice': 2.0511, 'highPrice': 2.0898, 'lowPrice': 2.0502, 'lastPrice': 2.0543, 'priceChange': 0.0389, 'percentChange': 0.019301379379, 'volume': 3172, 'openInterest': 16082}"
05/30/2025,2.0363,2.0548,2.0008,2.0154,-0.0270,-1.32%,"4,311","16,194","{'tradeTime': '2025-05-30', 'openPrice': 2.0363, 'highPrice': 2.0548, 'lowPrice': 2.0008, 'lastPrice': 2.0154, 'priceChange': -0.027, 'percentChange': -0.013219741481, 'volume': 4311, 'openInterest': 16194}"
05/29/2025,2.0813,2.1049,2.0365,2.0424,-0.0366,-1.76%,"4,178","15,972","{'tradeTime': '2025-05-29', 'openPrice': 2.0813, 'highPrice': 2.1049, 'lowPrice': 2.0365, 'lastPrice': 2.0424, 'priceChange': -0.0366, 'percentChange': -0.017604617605, 'volume': 4178, 'openInterest': 15972}"
05/28/2025,2.0691,2.0978,2.0591,2.0790,+0.0205,+1.00%,"3,326","15,544","{'tradeTime': '2025-05-28', 'openPrice': 2.0691, 'highPrice': 2.0978, 'lowPrice': 2.0591, 'lastPrice': 2.079, 'priceChange': 0.0205, 'percentChange': 0.009958707797, 'volume': 3326, 'openInterest': 15544}"
05/27/2025,2.0879,2.0943,2.0501,2.0585,-0.0216,-1.04%,"5,077","15,756","{'tradeTime': '2025-05-27', 'openPrice': 2.0879, 'highPrice': 2.0943, 'lowPrice': 2.0501, 'lastPrice': 2.0585, 'priceChange': -0.0216, 'percentChange': -0.010384116148, 'volume': 5077, 'openInterest': 15756}"
05/23/2025,2.0739,2.0855,2.0505,2.0801,-0.0009,-0.04%,"3,249","15,761","{'tradeTime': '2025-05-23', 'openPrice': 2.0739, 'highPrice': 2.0855, 'lowPrice': 2.0505, 'lastPrice': 2.0801, 'priceChange': -0.0009, 'percentChange': -0.000432484383, 'volume': 3249, 'openInterest': 15761}"
05/22/2025,2.0857,2.0918,2.0526,2.0810,-0.0172,-0.82%,"4,652","15,495","{'tradeTime': '2025-05-22', 'openPrice': 2.0857, 'highPrice': 2.0918, 'lowPrice': 2.0526, 'lastPrice': 2.081, 'priceChange': -0.0172, 'percentChange': -0.008197502621, 'volume': 4652, 'openInterest': 15495}"
05/21/2025,2.1309,2.1390,2.0828,2.0982,+0.0051,+0.24%,"3,882","15,136","{'tradeTime': '2025-05-21', 'openPrice': 2.1309, 'highPrice': 2.139, 'lowPrice': 2.0828, 'lastPrice': 2.0982, 'priceChange': 0.0051, 'percentChange': 0.002436577325, 'volume': 3882, 'openInterest': 15136}"
05/20/2025,2.0855,2.1030,2.0758,2.0931,+0.0044,+0.21%,"2,830","14,773","{'tradeTime': '2025-05-20', 'openPrice': 2.0855, 'highPrice': 2.103, 'lowPrice': 2.0758, 'lastPrice': 2.0931, 'priceChange': 0.0044, 'percentChange': 0.002106573467, 'volume': 2830, 'openInterest': 14773}"
05/19/2025,2.0816,2.1039,2.0750,2.0887,-0.0114,-0.54%,"4,152","14,761","{'tradeTime': '2025-05-19', 'openPrice': 2.0816, 'highPrice': 2.1039, 'lowPrice': 2.075, 'lastPrice': 2.0887, 'priceChange': -0.0114, 'percentChange': -0.005428312937, 'volume': 4152, 'openInterest': 14761}"
05/16/2025,2.0998,2.1075,2.0722,2.1001,-0.0003,-0.01%,"6,250","14,264","{'tradeTime': '2025-05-16', 'openPrice': 2.0998, 'highPrice': 2.1075, 'lowPrice': 2.0722, 'lastPrice': 2.1001, 'priceChange': -0.0003, 'percentChange': -0.000142829937, 'volume': 6250, 'openInterest': 14264}"
05/15/2025,2.1119,2.1135,2.0788,2.1004,-0.0426,-1.99%,"6,747","13,883","{'tradeTime': '2025-05-15', 'openPrice': 2.1119, 'highPrice': 2.1135, 'lowPrice': 2.0788, 'lastPrice': 2.1004, 'priceChange': -0.0426, 'percentChange': -0.019878674755, 'volume': 6747, 'openInterest': 13883}"
05/14/2025,2.1326,2.1475,2.1184,2.1430,+0.0040,+0.19%,"8,910","13,824","{'tradeTime': '2025-05-14', 'openPrice': 2.1326, 'highPrice': 2.1475, 'lowPrice': 2.1184, 'lastPrice': 2.143, 'priceChange': 0.004, 'percentChange': 0.001870032726, 'volume': 8910, 'openInterest': 13824}"
05/13/2025,2.0901,2.1408,2.0865,2.1390,+0.0448,+2.14%,"4,275","14,031","{'tradeTime': '2025-05-13', 'openPrice': 2.0901, 'highPrice': 2.1408, 'lowPrice': 2.0865, 'lastPrice': 2.139, 'priceChange': 0.0448, 'percentChange': 0.021392417152, 'volume': 4275, 'openInterest': 14031}"
05/12/2025,2.0684,2.1190,2.0612,2.0942,+0.0347,+1.68%,"3,554","13,672","{'tradeTime': '2025-05-12', 'openPrice': 2.0684, 'highPrice': 2.119, 'lowPrice': 2.0612, 'lastPrice': 2.0942, 'priceChange': 0.0347, 'percentChange': 0.016848749697, 'volume': 3554, 'openInterest': 13672}"
05/09/2025,2.0403,2.0698,2.0388,2.0595,+0.0218,+1.07%,"3,794","13,560","{'tradeTime': '2025-05-09', 'openPrice': 2.0403, 'highPrice': 2.0698, 'lowPrice': 2.0388, 'lastPrice': 2.0595, 'priceChange': 0.0218, 'percentChange': 0.01069833636, 'volume': 3794, 'openInterest': 13560}"
05/08/2025,1.9883,2.0483,1.9874,2.0377,+0.0445,+2.23%,"6,052","13,165","{'tradeTime': '2025-05-08', 'openPrice': 1.9883, 'highPrice': 2.0483, 'lowPrice': 1.9874, 'lastPrice': 2.0377, 'priceChange': 0.0445, 'percentChange': 0.022325908087, 'volume': 6052, 'openInterest': 13165}"
05/07/2025,2.0284,2.0448,1.9873,1.9932,-0.0325,-1.60%,"4,083","13,030","{'tradeTime': '2025-05-07', 'openPrice': 2.0284, 'highPrice': 2.0448, 'lowPrice': 1.9873, 'lastPrice': 1.9932, 'priceChange': -0.0325, 'percentChange': -0.016043836698, 'volume': 4083, 'openInterest': 13030}"
05/06/2025,1.9925,2.0422,1.9912,2.0257,+0.0359,+1.80%,"3,687","12,915","{'tradeTime': '2025-05-06', 'openPrice': 1.9925, 'highPrice': 2.0422, 'lowPrice': 1.9912, 'lastPrice': 2.0257, 'priceChange': 0.0359, 'percentChange': 0.018042014273, 'volume': 3687, 'openInterest': 12915}"
05/05/2025,1.9518,2.0024,1.9518,1.9898,-0.0180,-0.90%,"5,504","12,870","{'tradeTime': '2025-05-05', 'openPrice': 1.9518, 'highPrice': 2.0024, 'lowPrice': 1.9518, 'lastPrice': 1.9898, 'priceChange': -0.018, 'percentChange': -0.008965036358, 'volume': 5504, 'openInterest': 12870}"
05/02/2025,2.0285,2.0372,1.9917,2.0078,-0.0184,-0.91%,"4,414","12,514","{'tradeTime': '2025-05-02', 'openPrice': 2.0285, 'highPrice': 2.0372, 'lowPrice': 1.9917, 'lastPrice': 2.0078, 'priceChange': -0.0184, 'percentChange': -0.009081038397, 'volume': 4414, 'openInterest': 12514}"
05/01/2025,2.0154,2.0327,1.9754,2.0262,+0.0136,+0.68%,"4,204","12,106","{'tradeTime': '2025-05-01', 'openPrice': 2.0154, 'highPrice': 2.0327, 'lowPrice': 1.9754, 'lastPrice': 2.0262, 'priceChange': 0.0136, 'percentChange': 0.006757428202, 'volume': 4204, 'openInterest': 12106}"
04/30/2025,2.0638,2.0657,2.0088,2.0126,-0.0546,-2.64%,"3,202","11,727","{'tradeTime': '2025-04-30', 'openPrice': 2.0638, 'highPrice': 2.0657, 'lowPrice': 2.0088, 'lastPrice': 2.0126, 'priceChange': -0.0546, 'percentChange': -0.0264125387, 'volume': 3202, 'openInterest': 11727}"
04/29/2025,2.0941,2.0995,2.0598,2.0672,-0.0282,-1.35%,"2,874","11,763","{'tradeTime': '2025-04-29', 'openPrice': 2.0941, 'highPrice': 2.0995, 'lowPrice': 2.0598, 'lastPrice': 2.0672, 'priceChange': -0.0282, 'percentChange': -0.013458050969, 'volume': 2874, 'openInterest': 11763}"
04/28/2025,2.1234,2.1241,2.0868,2.0954,-0.0149,-0.71%,"2,230","11,674","{'tradeTime': '2025-04-28', 'openPrice': 2.1234, 'highPrice': 2.1241, 'lowPrice': 2.0868, 'lastPrice': 2.0954, 'priceChange': -0.0149, 'percentChange': -0.007060607497, 'volume': 2230, 'openInterest': 11674}"
04/25/2025,2.1050,2.1199,2.0867,2.1103,+0.0090,+0.43%,"2,912","11,495","{'tradeTime': '2025-04-25', 'openPrice': 2.105, 'highPrice': 2.1199, 'lowPrice': 2.0867, 'lastPrice': 2.1103, 'priceChange': 0.009, 'percentChange': 0.004283062866, 'volume': 2912, 'openInterest': 11495}"
04/24/2025,2.0807,2.1043,2.0789,2.1013,+0.0194,+0.93%,"1,706","11,527","{'tradeTime': '2025-04-24', 'openPrice': 2.0807, 'highPrice': 2.1043, 'lowPrice': 2.0789, 'lastPrice': 2.1013, 'priceChange': 0.0194, 'percentChange': 0.009318411067, 'volume': 1706, 'openInterest': 11527}"
04/23/2025,2.1175,2.1310,2.0593,2.0819,-0.0202,-0.96%,"3,141","11,440","{'tradeTime': '2025-04-23', 'openPrice': 2.1175, 'highPrice': 2.131, 'lowPrice': 2.0593, 'lastPrice': 2.0819, 'priceChange': -0.0202, 'percentChange': -0.009609438181, 'volume': 3141, 'openInterest': 11440}"
04/22/2025,2.0819,2.1137,2.0819,2.1021,+0.0317,+1.53%,"1,578","11,196","{'tradeTime': '2025-04-22', 'openPrice': 2.0819, 'highPrice': 2.1137, 'lowPrice': 2.0819, 'lastPrice': 2.1021, 'priceChange': 0.0317, 'percentChange': 0.015311051005, 'volume': 1578, 'openInterest': 11196}"
04/21/2025,2.0995,2.0995,2.0607,2.0704,-0.0425,-2.01%,"1,033","10,901","{'tradeTime': '2025-04-21', 'openPrice': 2.0995, 'highPrice': 2.0995, 'lowPrice': 2.0607, 'lastPrice': 2.0704, 'priceChange': -0.0425, 'percentChange': -0.020114534526, 'volume': 1033, 'openInterest': 10901}"
04/17/2025,2.0764,2.1226,2.0724,2.1129,+0.0445,+2.15%,"2,379","10,765","{'tradeTime': '2025-04-17', 'openPrice': 2.0764, 'highPrice': 2.1226, 'lowPrice': 2.0724, 'lastPrice': 2.1129, 'priceChange': 0.0445, 'percentChange': 0.021514213885, 'volume': 2379, 'openInterest': 10765}"
04/16/2025,2.0470,2.0764,2.0270,2.0684,+0.0252,+1.23%,"2,215","10,198","{'tradeTime': '2025-04-16', 'openPrice': 2.047, 'highPrice': 2.0764, 'lowPrice': 2.027, 'lastPrice': 2.0684, 'priceChange': 0.0252, 'percentChange': 0.012333594362, 'volume': 2215, 'openInterest': 10198}"
04/15/2025,2.0516,2.0653,2.0373,2.0432,-0.0092,-0.45%,"2,722","9,992","{'tradeTime': '2025-04-15', 'openPrice': 2.0516, 'highPrice': 2.0653, 'lowPrice': 2.0373, 'lastPrice': 2.0432, 'priceChange': -0.0092, 'percentChange': -0.004482557006, 'volume': 2722, 'openInterest': 9992}"
04/14/2025,2.0492,2.0699,2.0342,2.0524,+0.0162,+0.80%,"2,346","10,221","{'tradeTime': '2025-04-14', 'openPrice': 2.0492, 'highPrice': 2.0699, 'lowPrice': 2.0342, 'lastPrice': 2.0524, 'priceChange': 0.0162, 'percentChange': 0.007955996464, 'volume': 2346, 'openInterest': 10221}"
04/11/2025,2.0212,2.0452,2.0054,2.0362,+0.0169,+0.84%,"3,957","10,163","{'tradeTime': '2025-04-11', 'openPrice': 2.0212, 'highPrice': 2.0452, 'lowPrice': 2.0054, 'lastPrice': 2.0362, 'priceChange': 0.0169, 'percentChange': 0.008369236864, 'volume': 3957, 'openInterest': 10163}"
04/10/2025,2.0828,2.0865,1.9969,2.0193,-0.0566,-2.73%,"4,448","9,903","{'tradeTime': '2025-04-10', 'openPrice': 2.0828, 'highPrice': 2.0865, 'lowPrice': 1.9969, 'lastPrice': 2.0193, 'priceChange': -0.0566, 'percentChange': -0.027265282528, 'volume': 4448, 'openInterest': 9903}"
04/09/2025,1.9843,2.0895,1.9100,2.0759,+0.0655,+3.26%,"6,938","9,316","{'tradeTime': '2025-04-09', 'openPrice': 1.9843, 'highPrice': 2.0895, 'lowPrice': 1.91, 'lastPrice': 2.0759, 'priceChange': 0.0655, 'percentChange': 0.032580580979, 'volume': 6938, 'openInterest': 9316}"
04/08/2025,2.0543,2.0674,1.9792,2.0104,-0.0302,-1.48%,"3,926","9,149","{'tradeTime': '2025-04-08', 'openPrice': 2.0543, 'highPrice': 2.0674, 'lowPrice': 1.9792, 'lastPrice': 2.0104, 'priceChange': -0.0302, 'percentChange': -0.014799568754, 'volume': 3926, 'openInterest': 9149}"
04/07/2025,2.0365,2.1072,1.9951,2.0406,-0.0155,-0.75%,"3,570","9,015","{'tradeTime': '2025-04-07', 'openPrice': 2.0365, 'highPrice': 2.1072, 'lowPrice': 1.9951, 'lastPrice': 2.0406, 'priceChange': -0.0155, 'percentChange': -0.007538543845, 'volume': 3570, 'openInterest': 9015}"
04/04/2025,2.1554,2.1554,2.0240,2.0561,-0.1093,-5.05%,"4,968","9,200","{'tradeTime': '2025-04-04', 'openPrice': 2.1554, 'highPrice': 2.1554, 'lowPrice': 2.024, 'lastPrice': 2.0561, 'priceChange': -0.1093, 'percentChange': -0.050475662695, 'volume': 4968, 'openInterest': 9200}"
04/03/2025,2.2464,2.2464,2.1442,2.1654,-0.1239,-5.41%,"3,815","9,104","{'tradeTime': '2025-04-03', 'openPrice': 2.2464, 'highPrice': 2.2464, 'lowPrice': 2.1442, 'lastPrice': 2.1654, 'priceChange': -0.1239, 'percentChange': -0.054121347137, 'volume': 3815, 'openInterest': 9104}"
04/02/2025,2.2707,2.2998,2.2563,2.2893,+0.0229,+1.01%,"3,573","8,875","{'tradeTime': '2025-04-02', 'openPrice': 2.2707, 'highPrice': 2.2998, 'lowPrice': 2.2563, 'lastPrice': 2.2893, 'priceChange': 0.0229, 'percentChange': 0.010104129898, 'volume': 3573, 'openInterest': 8875}"
04/01/2025,2.2623,2.2751,2.2583,2.2664,+0.0038,+0.17%,"3,197","8,733","{'tradeTime': '2025-04-01', 'openPrice': 2.2623, 'highPrice': 2.2751, 'lowPrice': 2.2583, 'lastPrice': 2.2664, 'priceChange': 0.0038, 'percentChange': 0.00167948378, 'volume': 3197, 'openInterest': 8733}"
03/31/2025,2.2287,2.2670,2.2080,2.2626,+0.0481,+2.17%,"1,196","8,593","{'tradeTime': '2025-03-31', 'openPrice': 2.2287, 'highPrice': 2.267, 'lowPrice': 2.208, 'lastPrice': 2.2626, 'priceChange': 0.0481, 'percentChange': 0.021720478663, 'volume': 1196, 'openInterest': 8593}"
03/28/2025,2.2324,2.2359,2.2063,2.2145,-0.0196,-0.88%,"1,080","8,596","{'tradeTime': '2025-03-28', 'openPrice': 2.2324, 'highPrice': 2.2359, 'lowPrice': 2.2063, 'lastPrice': 2.2145, 'priceChange': -0.0196, 'percentChange': -0.008773107739, 'volume': 1080, 'openInterest': 8596}"
03/27/2025,2.2257,2.2344,2.2125,2.2341,+0.0098,+0.44%,"1,353","8,557","{'tradeTime': '2025-03-27', 'openPrice': 2.2257, 'highPrice': 2.2344, 'lowPrice': 2.2125, 'lastPrice': 2.2341, 'priceChange': 0.0098, 'percentChange': 0.004405880502, 'volume': 1353, 'openInterest': 8557}"
03/26/2025,2.2172,2.2349,2.2112,2.2243,+0.0127,+0.57%,"2,561","8,428","{'tradeTime': '2025-03-26', 'openPrice': 2.2172, 'highPrice': 2.2349, 'lowPrice': 2.2112, 'lastPrice': 2.2243, 'priceChange': 0.0127, 'percentChange': 0.005742448906, 'volume': 2561, 'openInterest': 8428}"
03/25/2025,2.2050,2.2220,2.1960,2.2116,+0.0087,+0.39%,"2,572","8,412","{'tradeTime': '2025-03-25', 'openPrice': 2.205, 'highPrice': 2.222, 'lowPrice': 2.196, 'lastPrice': 2.2116, 'priceChange': 0.0087, 'percentChange': 0.003949339507, 'volume': 2572, 'openInterest': 8412}"
03/24/2025,2.1946,2.2112,2.1899,2.2029,+0.0086,+0.39%,"1,529","8,127","{'tradeTime': '2025-03-24', 'openPrice': 2.1946, 'highPrice': 2.2112, 'lowPrice': 2.1899, 'lastPrice': 2.2029, 'priceChange': 0.0086, 'percentChange': 0.003919245317, 'volume': 1529, 'openInterest': 8127}"
03/21/2025,2.2027,2.2041,2.1826,2.1943,+0.0001,unch,962,"8,053","{'tradeTime': '2025-03-21', 'openPrice': 2.2027, 'highPrice': 2.2041, 'lowPrice': 2.1826, 'lastPrice': 2.1943, 'priceChange': 0.0001, 'percentChange': 4.5574697e-05, 'volume': 962, 'openInterest': 8053}"
03/20/2025,2.1796,2.2032,2.1612,2.1942,+0.0218,+1.00%,724,"8,130","{'tradeTime': '2025-03-20', 'openPrice': 2.1796, 'highPrice': 2.2032, 'lowPrice': 2.1612, 'lastPrice': 2.1942, 'priceChange': 0.0218, 'percentChange': 0.010034984349, 'volume': 724, 'openInterest': 8130}"
03/19/2025,2.1580,2.1825,2.1456,2.1724,+0.0138,+0.64%,"1,541","8,163","{'tradeTime': '2025-03-19', 'openPrice': 2.158, 'highPrice': 2.1825, 'lowPrice': 2.1456, 'lastPrice': 2.1724, 'priceChange': 0.0138, 'percentChange': 0.006393032521, 'volume': 1541, 'openInterest': 8163}"
03/18/2025,2.1678,2.1903,2.1498,2.1586,-0.0077,-0.36%,926,"8,044","{'tradeTime': '2025-03-18', 'openPrice': 2.1678, 'highPrice': 2.1903, 'lowPrice': 2.1498, 'lastPrice': 2.1586, 'priceChange': -0.0077, 'percentChange': -0.003554447676, 'volume': 926, 'openInterest': 8044}"
03/17/2025,2.1399,2.1735,2.1397,2.1663,+0.0242,+1.13%,"1,199","8,051","{'tradeTime': '2025-03-17', 'openPrice': 2.1399, 'highPrice': 2.1735, 'lowPrice': 2.1397, 'lastPrice': 2.1663, 'priceChange': 0.0242, 'percentChange': 0.011297325055, 'volume': 1199, 'openInterest': 8051}"
03/14/2025,2.1411,2.1517,2.1288,2.1421,+0.0056,+0.26%,"1,856","7,922","{'tradeTime': '2025-03-14', 'openPrice': 2.1411, 'highPrice': 2.1517, 'lowPrice': 2.1288, 'lastPrice': 2.1421, 'priceChange': 0.0056, 'percentChange': 0.002621109291, 'volume': 1856, 'openInterest': 7922}"
03/13/2025,2.1666,2.1729,2.1305,2.1365,-0.0309,-1.43%,"2,126","7,503","{'tradeTime': '2025-03-13', 'openPrice': 2.1666, 'highPrice': 2.1729, 'lowPrice': 2.1305, 'lastPrice': 2.1365, 'priceChange': -0.0309, 'percentChange': -0.014256713112, 'volume': 2126, 'openInterest': 7503}"
03/12/2025,2.1513,2.1700,2.1416,2.1674,+0.0265,+1.24%,"1,679","7,406","{'tradeTime': '2025-03-12', 'openPrice': 2.1513, 'highPrice': 2.17, 'lowPrice': 2.1416, 'lastPrice': 2.1674, 'priceChange': 0.0265, 'percentChange': 0.012377971881, 'volume': 1679, 'openInterest': 7406}"
03/11/2025,2.1276,2.1567,2.1198,2.1409,+0.0083,+0.39%,"2,204","7,380","{'tradeTime': '2025-03-11', 'openPrice': 2.1276, 'highPrice': 2.1567, 'lowPrice': 2.1198, 'lastPrice': 2.1409, 'priceChange': 0.0083, 'percentChange': 0.003891962862, 'volume': 2204, 'openInterest': 7380}"
03/10/2025,2.1521,2.1747,2.1278,2.1326,-0.0310,-1.43%,"1,243","7,383","{'tradeTime': '2025-03-10', 'openPrice': 2.1521, 'highPrice': 2.1747, 'lowPrice': 2.1278, 'lastPrice': 2.1326, 'priceChange': -0.031, 'percentChange': -0.014327971899, 'volume': 1243, 'openInterest': 7383}"
03/07/2025,2.1483,2.1957,2.1438,2.1636,+0.0131,+0.61%,"1,877","7,492","{'tradeTime': '2025-03-07', 'openPrice': 2.1483, 'highPrice': 2.1957, 'lowPrice': 2.1438, 'lastPrice': 2.1636, 'priceChange': 0.0131, 'percentChange': 0.006091606603, 'volume': 1877, 'openInterest': 7492}"
03/06/2025,2.1574,2.1661,2.1339,2.1505,-0.0055,-0.26%,"2,064","7,418","{'tradeTime': '2025-03-06', 'openPrice': 2.1574, 'highPrice': 2.1661, 'lowPrice': 2.1339, 'lastPrice': 2.1505, 'priceChange': -0.0055, 'percentChange': -0.002551020408, 'volume': 2064, 'openInterest': 7418}"
03/05/2025,2.1860,2.1860,2.1244,2.1560,-0.0359,-1.64%,"2,941","7,500","{'tradeTime': '2025-03-05', 'openPrice': 2.186, 'highPrice': 2.186, 'lowPrice': 2.1244, 'lastPrice': 2.156, 'priceChange': -0.0359, 'percentChange': -0.01637848442, 'volume': 2941, 'openInterest': 7500}"
03/04/2025,2.1914,2.1967,2.1645,2.1919,-0.0009,-0.04%,"1,807","7,097","{'tradeTime': '2025-03-04', 'openPrice': 2.1914, 'highPrice': 2.1967, 'lowPrice': 2.1645, 'lastPrice': 2.1919, 'priceChange': -0.0009, 'percentChange': -0.000410434148, 'volume': 1807, 'openInterest': 7097}"
03/03/2025,2.2409,2.2418,2.1843,2.1928,-0.0296,-1.33%,"1,476","6,708","{'tradeTime': '2025-03-03', 'openPrice': 2.2409, 'highPrice': 2.2418, 'lowPrice': 2.1843, 'lastPrice': 2.1928, 'priceChange': -0.0296, 'percentChange': -0.013318934485, 'volume': 1476, 'openInterest': 6708}"
02/28/2025,2.2430,2.2430,2.2177,2.2224,-0.0241,-1.07%,"1,250","6,606","{'tradeTime': '2025-02-28', 'openPrice': 2.243, 'highPrice': 2.243, 'lowPrice': 2.2177, 'lastPrice': 2.2224, 'priceChange': -0.0241, 'percentChange': -0.010727798798, 'volume': 1250, 'openInterest': 6606}"
02/27/2025,2.2173,2.2477,2.2173,2.2465,+0.0413,+1.87%,"1,084","6,549","{'tradeTime': '2025-02-27', 'openPrice': 2.2173, 'highPrice': 2.2477, 'lowPrice': 2.2173, 'lastPrice': 2.2465, 'priceChange': 0.0413, 'percentChange': 0.018728460004, 'volume': 1084, 'openInterest': 6549}"
02/26/2025,2.2305,2.2305,2.1965,2.2052,-0.0250,-1.12%,"1,450","6,512","{'tradeTime': '2025-02-26', 'openPrice': 2.2305, 'highPrice': 2.2305, 'lowPrice': 2.1965, 'lastPrice': 2.2052, 'priceChange': -0.025, 'percentChange': -0.011209756972, 'volume': 1450, 'openInterest': 6512}"
02/25/2025,2.2767,2.2852,2.2270,2.2302,-0.0441,-1.94%,"1,121","6,443","{'tradeTime': '2025-02-25', 'openPrice': 2.2767, 'highPrice': 2.2852, 'lowPrice': 2.227, 'lastPrice': 2.2302, 'priceChange': -0.0441, 'percentChange': -0.019390581717, 'volume': 1121, 'openInterest': 6443}"
02/24/2025,2.2760,2.2818,2.2713,2.2743,-0.0034,-0.15%,804,"6,206","{'tradeTime': '2025-02-24', 'openPrice': 2.276, 'highPrice': 2.2818, 'lowPrice': 2.2713, 'lastPrice': 2.2743, 'priceChange': -0.0034, 'percentChange': -0.001492733898, 'volume': 804, 'openInterest': 6206}"
02/21/2025,2.3236,2.3237,2.2754,2.2777,-0.0509,-2.19%,857,"6,103","{'tradeTime': '2025-02-21', 'openPrice': 2.3236, 'highPrice': 2.3237, 'lowPrice': 2.2754, 'lastPrice': 2.2777, 'priceChange': -0.0509, 'percentChange': -0.021858627502, 'volume': 857, 'openInterest': 6103}"
02/20/2025,2.3298,2.3379,2.3250,2.3286,+0.0145,+0.63%,"1,648","6,058","{'tradeTime': '2025-02-20', 'openPrice': 2.3298, 'highPrice': 2.3379, 'lowPrice': 2.325, 'lastPrice': 2.3286, 'priceChange': 0.0145, 'percentChange': 0.006265934921, 'volume': 1648, 'openInterest': 6058}"
02/19/2025,2.3021,2.3230,2.3021,2.3141,+0.0120,+0.52%,907,"5,999","{'tradeTime': '2025-02-19', 'openPrice': 2.3021, 'highPrice': 2.323, 'lowPrice': 2.3021, 'lastPrice': 2.3141, 'priceChange': 0.012, 'percentChange': 0.005212631945, 'volume': 907, 'openInterest': 5999}"
02/18/2025,2.2952,2.3164,2.2908,2.3021,+0.0046,+0.20%,"2,225","5,929","{'tradeTime': '2025-02-18', 'openPrice': 2.2952, 'highPrice': 2.3164, 'lowPrice': 2.2908, 'lastPrice': 2.3021, 'priceChange': 0.0046, 'percentChange': 0.002002176279, 'volume': 2225, 'openInterest': 5929}"
02/14/2025,2.3050,2.3115,2.2908,2.2975,+0.0055,+0.24%,"1,177","6,181","{'tradeTime': '2025-02-14', 'openPrice': 2.305, 'highPrice': 2.3115, 'lowPrice': 2.2908, 'lastPrice': 2.2975, 'priceChange': 0.0055, 'percentChange': 0.00239965096, 'volume': 1177, 'openInterest': 6181}"
02/13/2025,2.2667,2.2971,2.2667,2.2920,-0.0049,-0.21%,"1,484","6,124","{'tradeTime': '2025-02-13', 'openPrice': 2.2667, 'highPrice': 2.2971, 'lowPrice': 2.2667, 'lastPrice': 2.292, 'priceChange': -0.0049, 'percentChange': -0.002133310114, 'volume': 1484, 'openInterest': 6124}"
02/12/2025,2.3337,2.3365,2.2952,2.2969,-0.0506,-2.16%,"1,767","6,056","{'tradeTime': '2025-02-12', 'openPrice': 2.3337, 'highPrice': 2.3365, 'lowPrice': 2.2952, 'lastPrice': 2.2969, 'priceChange': -0.0506, 'percentChange': -0.02155484558, 'volume': 1767, 'openInterest': 6056}"
02/11/2025,2.3308,2.3479,2.3278,2.3475,+0.0408,+1.77%,"1,021","5,617","{'tradeTime': '2025-02-11', 'openPrice': 2.3308, 'highPrice': 2.3479, 'lowPrice': 2.3278, 'lastPrice': 2.3475, 'priceChange': 0.0408, 'percentChange': 0.01768760567, 'volume': 1021, 'openInterest': 5617}"
02/10/2025,2.2973,2.3082,2.2955,2.3067,+0.0249,+1.09%,674,"5,535","{'tradeTime': '2025-02-10', 'openPrice': 2.2973, 'highPrice': 2.3082, 'lowPrice': 2.2955, 'lastPrice': 2.3067, 'priceChange': 0.0249, 'percentChange': 0.010912437549, 'volume': 674, 'openInterest': 5535}"
02/07/2025,2.2792,2.2825,2.2713,2.2818,+0.0170,+0.75%,683,"5,450","{'tradeTime': '2025-02-07', 'openPrice': 2.2792, 'highPrice': 2.2825, 'lowPrice': 2.2713, 'lastPrice': 2.2818, 'priceChange': 0.017, 'percentChange': 0.007506181561, 'volume': 683, 'openInterest': 5450}"
02/06/2025,2.2735,2.2762,2.2536,2.2648,-0.0039,-0.17%,"1,162","5,342","{'tradeTime': '2025-02-06', 'openPrice': 2.2735, 'highPrice': 2.2762, 'lowPrice': 2.2536, 'lastPrice': 2.2648, 'priceChange': -0.0039, 'percentChange': -0.00171904615, 'volume': 1162, 'openInterest': 5342}"
02/05/2025,2.3042,2.3042,2.2676,2.2687,-0.0323,-1.40%,945,"5,310","{'tradeTime': '2025-02-05', 'openPrice': 2.3042, 'highPrice': 2.3042, 'lowPrice': 2.2676, 'lastPrice': 2.2687, 'priceChange': -0.0323, 'percentChange': -0.014037375054, 'volume': 945, 'openInterest': 5310}"
02/04/2025,2.2779,2.3022,2.2555,2.3010,+0.0053,+0.23%,"1,748","5,250","{'tradeTime': '2025-02-04', 'openPrice': 2.2779, 'highPrice': 2.3022, 'lowPrice': 2.2555, 'lastPrice': 2.301, 'priceChange': 0.0053, 'percentChange': 0.002308664024, 'volume': 1748, 'openInterest': 5250}"
02/03/2025,2.3150,2.3243,2.2798,2.2957,+0.0178,+0.78%,"1,999","5,347","{'tradeTime': '2025-02-03', 'openPrice': 2.315, 'highPrice': 2.3243, 'lowPrice': 2.2798, 'lastPrice': 2.2957, 'priceChange': 0.0178, 'percentChange': 0.007814214847, 'volume': 1999, 'openInterest': 5347}"
01/31/2025,2.2923,2.2923,2.2723,2.2779,-0.0039,-0.17%,"1,165","5,092","{'tradeTime': '2025-01-31', 'openPrice': 2.2923, 'highPrice': 2.2923, 'lowPrice': 2.2723, 'lastPrice': 2.2779, 'priceChange': -0.0039, 'percentChange': -0.001709176966, 'volume': 1165, 'openInterest': 5092}"
01/30/2025,2.2655,2.2908,2.2648,2.2818,+0.0078,+0.34%,899,"5,042","{'tradeTime': '2025-01-30', 'openPrice': 2.2655, 'highPrice': 2.2908, 'lowPrice': 2.2648, 'lastPrice': 2.2818, 'priceChange': 0.0078, 'percentChange': 0.003430079156, 'volume': 899, 'openInterest': 5042}"
01/29/2025,2.2672,2.2873,2.2672,2.2740,-0.0098,-0.43%,488,"4,956","{'tradeTime': '2025-01-29', 'openPrice': 2.2672, 'highPrice': 2.2873, 'lowPrice': 2.2672, 'lastPrice': 2.274, 'priceChange': -0.0098, 'percentChange': -0.004291093791, 'volume': 488, 'openInterest': 4956}"
01/28/2025,2.2882,2.2941,2.2733,2.2838,-0.0007,-0.03%,561,"4,913","{'tradeTime': '2025-01-28', 'openPrice': 2.2882, 'highPrice': 2.2941, 'lowPrice': 2.2733, 'lastPrice': 2.2838, 'priceChange': -0.0007, 'percentChange': -0.000306412782, 'volume': 561, 'openInterest': 4913}"
01/27/2025,2.3072,2.3074,2.2692,2.2845,-0.0374,-1.61%,776,"4,953","{'tradeTime': '2025-01-27', 'openPrice': 2.3072, 'highPrice': 2.3074, 'lowPrice': 2.2692, 'lastPrice': 2.2845, 'priceChange': -0.0374, 'percentChange': -0.01610749817, 'volume': 776, 'openInterest': 4953}"
01/24/2025,2.3248,2.3314,2.3098,2.3219,-0.0061,-0.26%,790,"4,933","{'tradeTime': '2025-01-24', 'openPrice': 2.3248, 'highPrice': 2.3314, 'lowPrice': 2.3098, 'lastPrice': 2.3219, 'priceChange': -0.0061, 'percentChange': -0.002620274914, 'volume': 790, 'openInterest': 4933}"
01/23/2025,2.3281,2.3448,2.3208,2.3280,-0.0014,-0.06%,"1,252","4,823","{'tradeTime': '2025-01-23', 'openPrice': 2.3281, 'highPrice': 2.3448, 'lowPrice': 2.3208, 'lastPrice': 2.328, 'priceChange': -0.0014, 'percentChange': -0.000601013136, 'volume': 1252, 'openInterest': 4823}"
01/22/2025,2.3320,2.3432,2.3244,2.3294,-0.0087,-0.37%,"1,144","4,789","{'tradeTime': '2025-01-22', 'openPrice': 2.332, 'highPrice': 2.3432, 'lowPrice': 2.3244, 'lastPrice': 2.3294, 'priceChange': -0.0087, 'percentChange': -0.003720970018, 'volume': 1144, 'openInterest': 4789}"
01/21/2025,2.3394,2.3437,2.3266,2.3381,-0.0222,-0.94%,"1,646","4,784","{'tradeTime': '2025-01-21', 'openPrice': 2.3394, 'highPrice': 2.3437, 'lowPrice': 2.3266, 'lastPrice': 2.3381, 'priceChange': -0.0222, 'percentChange': -0.009405584036, 'volume': 1646, 'openInterest': 4784}"
01/17/2025,2.3619,2.3662,2.3544,2.3603,-0.0037,-0.16%,900,"4,660","{'tradeTime': '2025-01-17', 'openPrice': 2.3619, 'highPrice': 2.3662, 'lowPrice': 2.3544, 'lastPrice': 2.3603, 'priceChange': -0.0037, 'percentChange': -0.001565143824, 'volume': 900, 'openInterest': 4660}"
01/16/2025,2.3774,2.3774,2.3518,2.3640,-0.0133,-0.56%,"1,125","4,700","{'tradeTime': '2025-01-16', 'openPrice': 2.3774, 'highPrice': 2.3774, 'lowPrice': 2.3518, 'lastPrice': 2.364, 'priceChange': -0.0133, 'percentChange': -0.005594582089, 'volume': 1125, 'openInterest': 4700}"
01/15/2025,2.3435,2.3814,2.3435,2.3773,+0.0306,+1.30%,"1,095","4,743","{'tradeTime': '2025-01-15', 'openPrice': 2.3435, 'highPrice': 2.3814, 'lowPrice': 2.3435, 'lastPrice': 2.3773, 'priceChange': 0.0306, 'percentChange': 0.013039587506, 'volume': 1095, 'openInterest': 4743}"
01/14/2025,2.3386,2.3508,2.3348,2.3467,-0.0020,-0.09%,"1,838","4,651","{'tradeTime': '2025-01-14', 'openPrice': 2.3386, 'highPrice': 2.3508, 'lowPrice': 2.3348, 'lastPrice': 2.3467, 'priceChange': -0.002, 'percentChange': -0.000851534892, 'volume': 1838, 'openInterest': 4651}"
01/13/2025,2.3385,2.3492,2.3368,2.3487,+0.0077,+0.33%,"2,091","4,347","{'tradeTime': '2025-01-13', 'openPrice': 2.3385, 'highPrice': 2.3492, 'lowPrice': 2.3368, 'lastPrice': 2.3487, 'priceChange': 0.0077, 'percentChange': 0.003289192653, 'volume': 2091, 'openInterest': 4347}"
01/10/2025,2.3000,2.3452,2.3000,2.3410,+0.0617,+2.71%,"1,397","4,374","{'tradeTime': '2025-01-10', 'openPrice': 2.3, 'highPrice': 2.3452, 'lowPrice': 2.3, 'lastPrice': 2.341, 'priceChange': 0.0617, 'percentChange': 0.027069714386, 'volume': 1397, 'openInterest': 4374}"
01/09/2025,2.2740,2.2881,2.2628,2.2793,+0.0141,+0.62%,786,"4,427","{'tradeTime': '2025-01-09', 'openPrice': 2.274, 'highPrice': 2.2881, 'lowPrice': 2.2628, 'lastPrice': 2.2793, 'priceChange': 0.0141, 'percentChange': 0.006224615928, 'volume': 786, 'openInterest': 4427}"
01/08/2025,2.2751,2.2852,2.2589,2.2652,-0.0150,-0.66%,685,"4,213","{'tradeTime': '2025-01-08', 'openPrice': 2.2751, 'highPrice': 2.2852, 'lowPrice': 2.2589, 'lastPrice': 2.2652, 'priceChange': -0.015, 'percentChange': -0.006578370318, 'volume': 685, 'openInterest': 4213}"
01/07/2025,2.2733,2.2840,2.2668,2.2802,+0.0127,+0.56%,440,"4,325","{'tradeTime': '2025-01-07', 'openPrice': 2.2733, 'highPrice': 2.284, 'lowPrice': 2.2668, 'lastPrice': 2.2802, 'priceChange': 0.0127, 'percentChange': 0.005600882029, 'volume': 440, 'openInterest': 4325}"
01/06/2025,2.2760,2.2988,2.2595,2.2675,+0.0007,+0.03%,904,"4,420","{'tradeTime': '2025-01-06', 'openPrice': 2.276, 'highPrice': 2.2988, 'lowPrice': 2.2595, 'lastPrice': 2.2675, 'priceChange': 0.0007, 'percentChange': 0.000308805364, 'volume': 904, 'openInterest': 4420}"
01/03/2025,2.2635,2.2705,2.2588,2.2668,+0.0010,+0.04%,679,"4,361","{'tradeTime': '2025-01-03', 'openPrice': 2.2635, 'highPrice': 2.2705, 'lowPrice': 2.2588, 'lastPrice': 2.2668, 'priceChange': 0.001, 'percentChange': 0.00044134522, 'volume': 679, 'openInterest': 4361}"
01/02/2025,2.2674,2.2775,2.2655,2.2658,+0.0300,+1.34%,591,"4,359","{'tradeTime': '2025-01-02', 'openPrice': 2.2674, 'highPrice': 2.2775, 'lowPrice': 2.2655, 'lastPrice': 2.2658, 'priceChange': 0.03, 'percentChange': 0.013418015923, 'volume': 591, 'openInterest': 4359}"
12/31/2024,2.2466,2.2466,2.2358,2.2358,+0.0110,+0.49%,418,"4,336","{'tradeTime': '2024-12-31', 'openPrice': 2.2466, 'highPrice': 2.2466, 'lowPrice': 2.2358, 'lastPrice': 2.2358, 'priceChange': 0.011, 'percentChange': 0.004944264653, 'volume': 418, 'openInterest': 4336}"
12/30/2024,2.2209,2.2380,2.2209,2.2248,+0.0268,+1.22%,535,"4,363","{'tradeTime': '2024-12-30', 'openPrice': 2.2209, 'highPrice': 2.238, 'lowPrice': 2.2209, 'lastPrice': 2.2248, 'priceChange': 0.0268, 'percentChange': 0.012192902639, 'volume': 535, 'openInterest': 4363}"
12/27/2024,2.1972,2.2008,2.1942,2.1980,+0.0247,+1.14%,353,"4,496","{'tradeTime': '2024-12-27', 'openPrice': 2.1972, 'highPrice': 2.2008, 'lowPrice': 2.1942, 'lastPrice': 2.198, 'priceChange': 0.0247, 'percentChange': 0.011365204988, 'volume': 353, 'openInterest': 4496}"
12/26/2024,2.2024,2.2024,2.1726,2.1733,-0.0094,-0.43%,166,"4,547","{'tradeTime': '2024-12-26', 'openPrice': 2.2024, 'highPrice': 2.2024, 'lowPrice': 2.1726, 'lastPrice': 2.1733, 'priceChange': -0.0094, 'percentChange': -0.004306592752, 'volume': 166, 'openInterest': 4547}"
12/24/2024,2.1830,2.1952,2.1827,2.1827,+0.0046,+0.21%,88,"4,532","{'tradeTime': '2024-12-24', 'openPrice': 2.183, 'highPrice': 2.1952, 'lowPrice': 2.1827, 'lastPrice': 2.1827, 'priceChange': 0.0046, 'percentChange': 0.002111932418, 'volume': 88, 'openInterest': 4532}"
12/23/2024,2.1796,2.1952,2.1748,2.1781,-0.0089,-0.41%,591,"4,538","{'tradeTime': '2024-12-23', 'openPrice': 2.1796, 'highPrice': 2.1952, 'lowPrice': 2.1748, 'lastPrice': 2.1781, 'priceChange': -0.0089, 'percentChange': -0.0040695016, 'volume': 591, 'openInterest': 4538}"
12/20/2024,2.1772,2.1918,2.1748,2.1870,-0.0060,-0.27%,221,"4,476","{'tradeTime': '2024-12-20', 'openPrice': 2.1772, 'highPrice': 2.1918, 'lowPrice': 2.1748, 'lastPrice': 2.187, 'priceChange': -0.006, 'percentChange': -0.002735978112, 'volume': 221, 'openInterest': 4476}"
12/19/2024,2.2045,2.2190,2.1875,2.1930,-0.0186,-0.84%,684,"4,464","{'tradeTime': '2024-12-19', 'openPrice': 2.2045, 'highPrice': 2.219, 'lowPrice': 2.1875, 'lastPrice': 2.193, 'priceChange': -0.0186, 'percentChange': -0.00841020076, 'volume': 684, 'openInterest': 4464}"
12/18/2024,2.2228,2.2278,2.2068,2.2116,+0.0035,+0.16%,430,"4,447","{'tradeTime': '2024-12-18', 'openPrice': 2.2228, 'highPrice': 2.2278, 'lowPrice': 2.2068, 'lastPrice': 2.2116, 'priceChange': 0.0035, 'percentChange': 0.00158507314, 'volume': 430, 'openInterest': 4447}"
12/17/2024,2.2200,2.2200,2.2008,2.2081,-0.0247,-1.11%,209,"4,364","{'tradeTime': '2024-12-17', 'openPrice': 2.22, 'highPrice': 2.22, 'lowPrice': 2.2008, 'lastPrice': 2.2081, 'priceChange': -0.0247, 'percentChange': -0.011062343246, 'volume': 209, 'openInterest': 4364}"
12/16/2024,2.2345,2.2395,2.2296,2.2328,-0.0104,-0.46%,337,"4,393","{'tradeTime': '2024-12-16', 'openPrice': 2.2345, 'highPrice': 2.2395, 'lowPrice': 2.2296, 'lastPrice': 2.2328, 'priceChange': -0.0104, 'percentChange': -0.004636233951, 'volume': 337, 'openInterest': 4393}"
12/13/2024,2.2267,2.2477,2.2259,2.2432,+0.0214,+0.96%,443,"4,510","{'tradeTime': '2024-12-13', 'openPrice': 2.2267, 'highPrice': 2.2477, 'lowPrice': 2.2259, 'lastPrice': 2.2432, 'priceChange': 0.0214, 'percentChange': 0.009631830048, 'volume': 443, 'openInterest': 4510}"
12/12/2024,2.2095,2.2250,2.1970,2.2218,+0.0071,+0.32%,653,"4,369","{'tradeTime': '2024-12-12', 'openPrice': 2.2095, 'highPrice': 2.225, 'lowPrice': 2.197, 'lastPrice': 2.2218, 'priceChange': 0.0071, 'percentChange': 0.003205851808, 'volume': 653, 'openInterest': 4369}"
12/11/2024,2.2072,2.2151,2.2041,2.2147,+0.0262,+1.20%,802,"4,440","{'tradeTime': '2024-12-11', 'openPrice': 2.2072, 'highPrice': 2.2151, 'lowPrice': 2.2041, 'lastPrice': 2.2147, 'priceChange': 0.0262, 'percentChange': 0.011971670094, 'volume': 802, 'openInterest': 4440}"
12/10/2024,2.1812,2.2005,2.1812,2.1885,-0.0028,-0.13%,403,"4,638","{'tradeTime': '2024-12-10', 'openPrice': 2.1812, 'highPrice': 2.2005, 'lowPrice': 2.1812, 'lastPrice': 2.1885, 'priceChange': -0.0028, 'percentChange': -0.001277780313, 'volume': 403, 'openInterest': 4638}"
12/09/2024,2.1639,2.1974,2.1639,2.1913,+0.0334,+1.55%,580,"4,594","{'tradeTime': '2024-12-09', 'openPrice': 2.1639, 'highPrice': 2.1974, 'lowPrice': 2.1639, 'lastPrice': 2.1913, 'priceChange': 0.0334, 'percentChange': 0.015478011029, 'volume': 580, 'openInterest': 4594}"
12/06/2024,2.1620,2.1629,2.1498,2.1579,-0.0161,-0.74%,777,"4,380","{'tradeTime': '2024-12-06', 'openPrice': 2.162, 'highPrice': 2.1629, 'lowPrice': 2.1498, 'lastPrice': 2.1579, 'priceChange': -0.0161, 'percentChange': -0.007405703772, 'volume': 777, 'openInterest': 4380}"
12/05/2024,2.1941,2.1941,2.1728,2.1740,-0.0071,-0.33%,395,"4,280","{'tradeTime': '2024-12-05', 'openPrice': 2.1941, 'highPrice': 2.1941, 'lowPrice': 2.1728, 'lastPrice': 2.174, 'priceChange': -0.0071, 'percentChange': -0.003255238183, 'volume': 395, 'openInterest': 4280}"
12/04/2024,2.2159,2.2212,2.1797,2.1811,-0.0327,-1.48%,"1,160","4,139","{'tradeTime': '2024-12-04', 'openPrice': 2.2159, 'highPrice': 2.2212, 'lowPrice': 2.1797, 'lastPrice': 2.1811, 'priceChange': -0.0327, 'percentChange': -0.014770982022, 'volume': 1160, 'openInterest': 4139}"
12/03/2024,2.2163,2.2163,2.2138,2.2138,+0.0349,+1.60%,348,"3,983","{'tradeTime': '2024-12-03', 'openPrice': 2.2163, 'highPrice': 2.2163, 'lowPrice': 2.2138, 'lastPrice': 2.2138, 'priceChange': 0.0349, 'percentChange': 0.016017256414, 'volume': 348, 'openInterest': 3983}"
12/02/2024,2.1920,2.2032,2.1777,2.1789,-0.0012,-0.06%,181,"4,005","{'tradeTime': '2024-12-02', 'openPrice': 2.192, 'highPrice': 2.2032, 'lowPrice': 2.1777, 'lastPrice': 2.1789, 'priceChange': -0.0012, 'percentChange': -0.000550433466, 'volume': 181, 'openInterest': 4005}"
11/29/2024,2.2052,2.2132,2.1790,2.1801,-0.0152,-0.69%,174,"3,976","{'tradeTime': '2024-11-29', 'openPrice': 2.2052, 'highPrice': 2.2132, 'lowPrice': 2.179, 'lastPrice': 2.1801, 'priceChange': -0.0152, 'percentChange': -0.006923882841, 'volume': 174, 'openInterest': 3976}"
11/27/2024,2.2165,2.2225,2.1920,2.1953,-0.0248,-1.12%,210,"4,003","{'tradeTime': '2024-11-27', 'openPrice': 2.2165, 'highPrice': 2.2225, 'lowPrice': 2.192, 'lastPrice': 2.1953, 'priceChange': -0.0248, 'percentChange': -0.011170667988, 'volume': 210, 'openInterest': 4003}"
11/26/2024,2.2435,2.2532,2.2123,2.2201,-0.0021,-0.09%,519,"4,036","{'tradeTime': '2024-11-26', 'openPrice': 2.2435, 'highPrice': 2.2532, 'lowPrice': 2.2123, 'lastPrice': 2.2201, 'priceChange': -0.0021, 'percentChange': -0.00094500945, 'volume': 519, 'openInterest': 4036}"
11/25/2024,2.2529,2.2529,2.2147,2.2222,-0.0426,-1.88%,544,"3,972","{'tradeTime': '2024-11-25', 'openPrice': 2.2529, 'highPrice': 2.2529, 'lowPrice': 2.2147, 'lastPrice': 2.2222, 'priceChange': -0.0426, 'percentChange': -0.018809607912, 'volume': 544, 'openInterest': 3972}"
11/22/2024,2.2489,2.2672,2.2488,2.2648,+0.0022,+0.10%,338,"3,878","{'tradeTime': '2024-11-22', 'openPrice': 2.2489, 'highPrice': 2.2672, 'lowPrice': 2.2488, 'lastPrice': 2.2648, 'priceChange': 0.0022, 'percentChange': 0.000972332715, 'volume': 338, 'openInterest': 3878}"
11/21/2024,2.2634,2.2634,2.2489,2.2626,+0.0259,+1.16%,524,"3,932","{'tradeTime': '2024-11-21', 'openPrice': 2.2634, 'highPrice': 2.2634, 'lowPrice': 2.2489, 'lastPrice': 2.2626, 'priceChange': 0.0259, 'percentChange': 0.011579559172, 'volume': 524, 'openInterest': 3932}"
11/20/2024,2.2563,2.2563,2.2367,2.2367,-0.0154,-0.68%,545,"3,886","{'tradeTime': '2024-11-20', 'openPrice': 2.2563, 'highPrice': 2.2563, 'lowPrice': 2.2367, 'lastPrice': 2.2367, 'priceChange': -0.0154, 'percentChange': -0.006838062253, 'volume': 545, 'openInterest': 3886}"
11/19/2024,2.2725,2.2725,2.2486,2.2521,-0.0058,-0.26%,418,"3,791","{'tradeTime': '2024-11-19', 'openPrice': 2.2725, 'highPrice': 2.2725, 'lowPrice': 2.2486, 'lastPrice': 2.2521, 'priceChange': -0.0058, 'percentChange': -0.002568758581, 'volume': 418, 'openInterest': 3791}"
11/18/2024,2.2598,2.2598,2.2579,2.2579,+0.0638,+2.91%,322,"3,736","{'tradeTime': '2024-11-18', 'openPrice': 2.2598, 'highPrice': 2.2598, 'lowPrice': 2.2579, 'lastPrice': 2.2579, 'priceChange': 0.0638, 'percentChange': 0.02907798186, 'volume': 322, 'openInterest': 3736}"
11/15/2024,2.2221,2.2268,2.1941,2.1941,-0.0330,-1.48%,530,"3,725","{'tradeTime': '2024-11-15', 'openPrice': 2.2221, 'highPrice': 2.2268, 'lowPrice': 2.1941, 'lastPrice': 2.1941, 'priceChange': -0.033, 'percentChange': -0.014817475641, 'volume': 530, 'openInterest': 3725}"
11/14/2024,2.2492,2.2497,2.2248,2.2271,-0.0052,-0.23%,634,"3,628","{'tradeTime': '2024-11-14', 'openPrice': 2.2492, 'highPrice': 2.2497, 'lowPrice': 2.2248, 'lastPrice': 2.2271, 'priceChange': -0.0052, 'percentChange': -0.002329436008, 'volume': 634, 'openInterest': 3628}"
11/13/2024,2.2250,2.2432,2.2068,2.2323,+0.0010,+0.04%,717,"3,484","{'tradeTime': '2024-11-13', 'openPrice': 2.225, 'highPrice': 2.2432, 'lowPrice': 2.2068, 'lastPrice': 2.2323, 'priceChange': 0.001, 'percentChange': 0.000448169229, 'volume': 717, 'openInterest': 3484}"
11/12/2024,2.2467,2.2467,2.2312,2.2313,+0.0037,+0.17%,733,"3,426","{'tradeTime': '2024-11-12', 'openPrice': 2.2467, 'highPrice': 2.2467, 'lowPrice': 2.2312, 'lastPrice': 2.2313, 'priceChange': 0.0037, 'percentChange': 0.001660980427, 'volume': 733, 'openInterest': 3426}"
11/11/2024,2.2319,2.2319,2.2250,2.2276,-0.0425,-1.87%,310,"3,340","{'tradeTime': '2024-11-11', 'openPrice': 2.2319, 'highPrice': 2.2319, 'lowPrice': 2.225, 'lastPrice': 2.2276, 'priceChange': -0.0425, 'percentChange': -0.018721642218, 'volume': 310, 'openInterest': 3340}"
11/08/2024,2.2731,2.2731,2.2648,2.2701,-0.0364,-1.58%,354,"3,355","{'tradeTime': '2024-11-08', 'openPrice': 2.2731, 'highPrice': 2.2731, 'lowPrice': 2.2648, 'lastPrice': 2.2701, 'priceChange': -0.0364, 'percentChange': -0.015781487102, 'volume': 354, 'openInterest': 3355}"
11/07/2024,2.2940,2.3092,2.2748,2.3065,+0.0177,+0.77%,351,"3,356","{'tradeTime': '2024-11-07', 'openPrice': 2.294, 'highPrice': 2.3092, 'lowPrice': 2.2748, 'lastPrice': 2.3065, 'priceChange': 0.0177, 'percentChange': 0.007733310031, 'volume': 351, 'openInterest': 3356}"
11/06/2024,2.3040,2.3112,2.2648,2.2888,-0.0199,-0.86%,604,"3,372","{'tradeTime': '2024-11-06', 'openPrice': 2.304, 'highPrice': 2.3112, 'lowPrice': 2.2648, 'lastPrice': 2.2888, 'priceChange': -0.0199, 'percentChange': -0.008619569455, 'volume': 604, 'openInterest': 3372}"
11/05/2024,2.3160,2.3168,2.3080,2.3087,+0.0129,+0.56%,353,"3,367","{'tradeTime': '2024-11-05', 'openPrice': 2.316, 'highPrice': 2.3168, 'lowPrice': 2.308, 'lastPrice': 2.3087, 'priceChange': 0.0129, 'percentChange': 0.005618956355, 'volume': 353, 'openInterest': 3367}"
11/04/2024,2.2965,2.2992,2.2828,2.2958,+0.0414,+1.84%,267,"3,369","{'tradeTime': '2024-11-04', 'openPrice': 2.2965, 'highPrice': 2.2992, 'lowPrice': 2.2828, 'lastPrice': 2.2958, 'priceChange': 0.0414, 'percentChange': 0.018364088006, 'volume': 267, 'openInterest': 3369}"
11/01/2024,2.2738,2.2738,2.2544,2.2544,+0.0040,+0.18%,305,"3,352","{'tradeTime': '2024-11-01', 'openPrice': 2.2738, 'highPrice': 2.2738, 'lowPrice': 2.2544, 'lastPrice': 2.2544, 'priceChange': 0.004, 'percentChange': 0.001777461785, 'volume': 305, 'openInterest': 3352}"
10/31/2024,2.2491,2.2542,2.2491,2.2504,+0.0234,+1.05%,507,"3,367","{'tradeTime': '2024-10-31', 'openPrice': 2.2491, 'highPrice': 2.2542, 'lowPrice': 2.2491, 'lastPrice': 2.2504, 'priceChange': 0.0234, 'percentChange': 0.01050740907, 'volume': 507, 'openInterest': 3367}"
10/30/2024,2.1954,2.2270,2.1954,2.2270,+0.0434,+1.99%,267,"3,370","{'tradeTime': '2024-10-30', 'openPrice': 2.1954, 'highPrice': 2.227, 'lowPrice': 2.1954, 'lastPrice': 2.227, 'priceChange': 0.0434, 'percentChange': 0.019875435061, 'volume': 267, 'openInterest': 3370}"
10/29/2024,2.1875,2.1875,2.1666,2.1836,+0.0027,+0.12%,561,"3,350","{'tradeTime': '2024-10-29', 'openPrice': 2.1875, 'highPrice': 2.1875, 'lowPrice': 2.1666, 'lastPrice': 2.1836, 'priceChange': 0.0027, 'percentChange': 0.001238021001, 'volume': 561, 'openInterest': 3350}"
10/28/2024,2.1950,2.2000,2.1809,2.1809,-0.0945,-4.15%,648,"3,283","{'tradeTime': '2024-10-28', 'openPrice': 2.195, 'highPrice': 2.2, 'lowPrice': 2.1809, 'lastPrice': 2.1809, 'priceChange': -0.0945, 'percentChange': -0.041531159357, 'volume': 648, 'openInterest': 3283}"
10/25/2024,2.2710,2.2839,2.2710,2.2754,+0.0311,+1.39%,698,"3,233","{'tradeTime': '2024-10-25', 'openPrice': 2.271, 'highPrice': 2.2839, 'lowPrice': 2.271, 'lastPrice': 2.2754, 'priceChange': 0.0311, 'percentChange': 0.013857327452, 'volume': 698, 'openInterest': 3233}"
10/24/2024,2.2500,2.2678,2.2400,2.2443,-0.0160,-0.71%,"1,075","3,143","{'tradeTime': '2024-10-24', 'openPrice': 2.25, 'highPrice': 2.2678, 'lowPrice': 2.24, 'lastPrice': 2.2443, 'priceChange': -0.016, 'percentChange': -0.007078706366, 'volume': 1075, 'openInterest': 3143}"
10/23/2024,2.2500,2.2661,2.2500,2.2603,-0.0186,-0.82%,489,"3,049","{'tradeTime': '2024-10-23', 'openPrice': 2.25, 'highPrice': 2.2661, 'lowPrice': 2.25, 'lastPrice': 2.2603, 'priceChange': -0.0186, 'percentChange': -0.008161832463, 'volume': 489, 'openInterest': 3049}"
10/22/2024,2.2514,2.2789,2.2491,2.2789,+0.0429,+1.92%,573,"3,050","{'tradeTime': '2024-10-22', 'openPrice': 2.2514, 'highPrice': 2.2789, 'lowPrice': 2.2491, 'lastPrice': 2.2789, 'priceChange': 0.0429, 'percentChange': 0.019186046512, 'volume': 573, 'openInterest': 3050}"
10/21/2024,2.2370,2.2375,2.2360,2.2360,+0.0284,+1.29%,277,"2,975","{'tradeTime': '2024-10-21', 'openPrice': 2.237, 'highPrice': 2.2375, 'lowPrice': 2.236, 'lastPrice': 2.236, 'priceChange': 0.0284, 'percentChange': 0.012864649393, 'volume': 277, 'openInterest': 2975}"
10/18/2024,2.2255,2.2255,2.2076,2.2076,-0.0346,-1.54%,459,"2,972","{'tradeTime': '2024-10-18', 'openPrice': 2.2255, 'highPrice': 2.2255, 'lowPrice': 2.2076, 'lastPrice': 2.2076, 'priceChange': -0.0346, 'percentChange': -0.015431272857, 'volume': 459, 'openInterest': 2972}"
10/17/2024,2.2290,2.2422,2.2290,2.2422,+0.0105,+0.47%,340,"2,856","{'tradeTime': '2024-10-17', 'openPrice': 2.229, 'highPrice': 2.2422, 'lowPrice': 2.229, 'lastPrice': 2.2422, 'priceChange': 0.0105, 'percentChange': 0.004704933459, 'volume': 340, 'openInterest': 2856}"
10/16/2024,2.2370,2.2390,2.2317,2.2317,-0.0097,-0.43%,692,"2,819","{'tradeTime': '2024-10-16', 'openPrice': 2.237, 'highPrice': 2.239, 'lowPrice': 2.2317, 'lastPrice': 2.2317, 'priceChange': -0.0097, 'percentChange': -0.00432765236, 'volume': 692, 'openInterest': 2819}"
10/15/2024,2.2391,2.2450,2.2342,2.2414,-0.0770,-3.32%,800,"2,766","{'tradeTime': '2024-10-15', 'openPrice': 2.2391, 'highPrice': 2.245, 'lowPrice': 2.2342, 'lastPrice': 2.2414, 'priceChange': -0.077, 'percentChange': -0.033212560386, 'volume': 800, 'openInterest': 2766}"
10/14/2024,2.3500,2.3500,2.2999,2.3184,-0.0444,-1.88%,658,"2,660","{'tradeTime': '2024-10-14', 'openPrice': 2.35, 'highPrice': 2.35, 'lowPrice': 2.2999, 'lastPrice': 2.3184, 'priceChange': -0.0444, 'percentChange': -0.018791264601, 'volume': 658, 'openInterest': 2660}"
10/11/2024,2.3595,2.3700,2.3547,2.3628,-0.0045,-0.19%,355,"2,594","{'tradeTime': '2024-10-11', 'openPrice': 2.3595, 'highPrice': 2.37, 'lowPrice': 2.3547, 'lastPrice': 2.3628, 'priceChange': -0.0045, 'percentChange': -0.001900899759, 'volume': 355, 'openInterest': 2594}"
10/10/2024,2.3643,2.3673,2.3643,2.3673,+0.0562,+2.43%,505,"2,557","{'tradeTime': '2024-10-10', 'openPrice': 2.3643, 'highPrice': 2.3673, 'lowPrice': 2.3643, 'lastPrice': 2.3673, 'priceChange': 0.0562, 'percentChange': 0.024317424603, 'volume': 505, 'openInterest': 2557}"
10/09/2024,2.3025,2.3170,2.3010,2.3111,-0.0234,-1.00%,728,"2,460","{'tradeTime': '2024-10-09', 'openPrice': 2.3025, 'highPrice': 2.317, 'lowPrice': 2.301, 'lastPrice': 2.3111, 'priceChange': -0.0234, 'percentChange': -0.010023559649, 'volume': 728, 'openInterest': 2460}"
10/08/2024,2.3345,2.3345,2.3345,2.3345,-0.0746,-3.10%,"1,454","2,351","{'tradeTime': '2024-10-08', 'openPrice': 2.3345, 'highPrice': 2.3345, 'lowPrice': 2.3345, 'lastPrice': 2.3345, 'priceChange': -0.0746, 'percentChange': -0.030965920883, 'volume': 1454, 'openInterest': 2351}"
10/07/2024,2.3958,2.4091,2.3958,2.4091,+0.0655,+2.79%,"1,727","2,143","{'tradeTime': '2024-10-07', 'openPrice': 2.3958, 'highPrice': 2.4091, 'lowPrice': 2.3958, 'lastPrice': 2.4091, 'priceChange': 0.0655, 'percentChange': 0.027948455368, 'volume': 1727, 'openInterest': 2143}"
10/04/2024,2.3450,2.3595,2.3400,2.3436,+0.0164,+0.70%,"1,773","1,997","{'tradeTime': '2024-10-04', 'openPrice': 2.345, 'highPrice': 2.3595, 'lowPrice': 2.34, 'lastPrice': 2.3436, 'priceChange': 0.0164, 'percentChange': 0.007047095222, 'volume': 1773, 'openInterest': 1997}"
10/03/2024,2.3260,2.3272,2.3260,2.3272,+0.0819,+3.65%,"1,243","1,836","{'tradeTime': '2024-10-03', 'openPrice': 2.326, 'highPrice': 2.3272, 'lowPrice': 2.326, 'lastPrice': 2.3272, 'priceChange': 0.0819, 'percentChange': 0.036476194718, 'volume': 1243, 'openInterest': 1836}"
10/02/2024,2.2425,2.2754,2.2410,2.2453,+0.0061,+0.27%,975,"1,732","{'tradeTime': '2024-10-02', 'openPrice': 2.2425, 'highPrice': 2.2754, 'lowPrice': 2.241, 'lastPrice': 2.2453, 'priceChange': 0.0061, 'percentChange': 0.00272418721, 'volume': 975, 'openInterest': 1732}"
10/01/2024,2.1875,2.2547,2.1875,2.2392,+0.0285,+1.29%,"1,430","1,671","{'tradeTime': '2024-10-01', 'openPrice': 2.1875, 'highPrice': 2.2547, 'lowPrice': 2.1875, 'lastPrice': 2.2392, 'priceChange': 0.0285, 'percentChange': 0.012891844212, 'volume': 1430, 'openInterest': 1671}"
09/30/2024,2.2107,2.2107,2.2107,2.2107,+0.0068,+0.31%,330,"1,535","{'tradeTime': '2024-09-30', 'openPrice': 2.2107, 'highPrice': 2.2107, 'lowPrice': 2.2107, 'lastPrice': 2.2107, 'priceChange': 0.0068, 'percentChange': 0.003085439448, 'volume': 330, 'openInterest': 1535}"
09/27/2024,2.1950,2.2234,2.1900,2.2039,-0.0057,-0.26%,301,"1,526","{'tradeTime': '2024-09-27', 'openPrice': 2.195, 'highPrice': 2.2234, 'lowPrice': 2.19, 'lastPrice': 2.2039, 'priceChange': -0.0057, 'percentChange': -0.002579652426, 'volume': 301, 'openInterest': 1526}"
09/26/2024,2.2125,2.2200,2.2024,2.2096,-0.0221,-0.99%,263,"1,482","{'tradeTime': '2024-09-26', 'openPrice': 2.2125, 'highPrice': 2.22, 'lowPrice': 2.2024, 'lastPrice': 2.2096, 'priceChange': -0.0221, 'percentChange': -0.009902764709, 'volume': 263, 'openInterest': 1482}"
09/25/2024,2.2353,2.2353,2.2317,2.2317,-0.0206,-0.91%,78,"1,505","{'tradeTime': '2024-09-25', 'openPrice': 2.2353, 'highPrice': 2.2353, 'lowPrice': 2.2317, 'lastPrice': 2.2317, 'priceChange': -0.0206, 'percentChange': -0.0091462061, 'volume': 78, 'openInterest': 1505}"
09/24/2024,2.2523,2.2523,2.2523,2.2523,+0.0332,+1.50%,208,"1,504","{'tradeTime': '2024-09-24', 'openPrice': 2.2523, 'highPrice': 2.2523, 'lowPrice': 2.2523, 'lastPrice': 2.2523, 'priceChange': 0.0332, 'percentChange': 0.014961020233, 'volume': 208, 'openInterest': 1504}"
09/23/2024,2.2191,2.2191,2.2191,2.2191,-0.0071,-0.32%,65,"1,461","{'tradeTime': '2024-09-23', 'openPrice': 2.2191, 'highPrice': 2.2191, 'lowPrice': 2.2191, 'lastPrice': 2.2191, 'priceChange': -0.0071, 'percentChange': -0.003189291169, 'volume': 65, 'openInterest': 1461}"
09/20/2024,2.2235,2.2262,2.2235,2.2262,+0.0018,+0.08%,84,"1,462","{'tradeTime': '2024-09-20', 'openPrice': 2.2235, 'highPrice': 2.2262, 'lowPrice': 2.2235, 'lastPrice': 2.2262, 'priceChange': 0.0018, 'percentChange': 0.000809206977, 'volume': 84, 'openInterest': 1462}"
09/19/2024,2.2236,2.2281,2.2195,2.2244,+0.0162,+0.73%,202,"1,458","{'tradeTime': '2024-09-19', 'openPrice': 2.2236, 'highPrice': 2.2281, 'lowPrice': 2.2195, 'lastPrice': 2.2244, 'priceChange': 0.0162, 'percentChange': 0.007336292003, 'volume': 202, 'openInterest': 1458}"
09/18/2024,2.1985,2.2087,2.1985,2.2082,-0.0012,-0.05%,254,"1,449","{'tradeTime': '2024-09-18', 'openPrice': 2.1985, 'highPrice': 2.2087, 'lowPrice': 2.1985, 'lastPrice': 2.2082, 'priceChange': -0.0012, 'percentChange': -0.000543133883, 'volume': 254, 'openInterest': 1449}"
09/17/2024,2.2171,2.2171,2.2094,2.2094,+0.0261,+1.20%,284,"1,434","{'tradeTime': '2024-09-17', 'openPrice': 2.2171, 'highPrice': 2.2171, 'lowPrice': 2.2094, 'lastPrice': 2.2094, 'priceChange': 0.0261, 'percentChange': 0.011954380983, 'volume': 284, 'openInterest': 1434}"
09/16/2024,2.1873,2.1927,2.1833,2.1833,+0.0155,+0.72%,199,"1,352","{'tradeTime': '2024-09-16', 'openPrice': 2.1873, 'highPrice': 2.1927, 'lowPrice': 2.1833, 'lastPrice': 2.1833, 'priceChange': 0.0155, 'percentChange': 0.007150106098, 'volume': 199, 'openInterest': 1352}"
09/13/2024,2.1930,2.1930,2.1678,2.1678,-0.0239,-1.09%,360,"1,337","{'tradeTime': '2024-09-13', 'openPrice': 2.193, 'highPrice': 2.193, 'lowPrice': 2.1678, 'lastPrice': 2.1678, 'priceChange': -0.0239, 'percentChange': -0.010904777114, 'volume': 360, 'openInterest': 1337}"
09/12/2024,2.1738,2.2000,2.1600,2.1917,+0.0269,+1.24%,247,"1,275","{'tradeTime': '2024-09-12', 'openPrice': 2.1738, 'highPrice': 2.2, 'lowPrice': 2.16, 'lastPrice': 2.1917, 'priceChange': 0.0269, 'percentChange': 0.01242609017, 'volume': 247, 'openInterest': 1275}"
09/11/2024,2.1512,2.1675,2.1279,2.1648,+0.0292,+1.37%,342,"1,269","{'tradeTime': '2024-09-11', 'openPrice': 2.1512, 'highPrice': 2.1675, 'lowPrice': 2.1279, 'lastPrice': 2.1648, 'priceChange': 0.0292, 'percentChange': 0.013672972467, 'volume': 342, 'openInterest': 1269}"
09/10/2024,2.1800,2.1900,2.1323,2.1356,-0.0597,-2.72%,506,"1,294","{'tradeTime': '2024-09-10', 'openPrice': 2.18, 'highPrice': 2.19, 'lowPrice': 2.1323, 'lastPrice': 2.1356, 'priceChange': -0.0597, 'percentChange': -0.027194460894, 'volume': 506, 'openInterest': 1294}"
09/09/2024,2.1900,2.1990,2.1900,2.1953,+0.0110,+0.50%,304,"1,270","{'tradeTime': '2024-09-09', 'openPrice': 2.19, 'highPrice': 2.199, 'lowPrice': 2.19, 'lastPrice': 2.1953, 'priceChange': 0.011, 'percentChange': 0.005035938287, 'volume': 304, 'openInterest': 1270}"
09/06/2024,2.2150,2.2150,2.1843,2.1843,-0.0334,-1.51%,318,"1,303","{'tradeTime': '2024-09-06', 'openPrice': 2.215, 'highPrice': 2.215, 'lowPrice': 2.1843, 'lastPrice': 2.1843, 'priceChange': -0.0334, 'percentChange': -0.01506064842, 'volume': 318, 'openInterest': 1303}"
09/05/2024,2.2386,2.2386,2.2168,2.2177,+0.0090,+0.41%,393,"1,325","{'tradeTime': '2024-09-05', 'openPrice': 2.2386, 'highPrice': 2.2386, 'lowPrice': 2.2168, 'lastPrice': 2.2177, 'priceChange': 0.009, 'percentChange': 0.004074795128, 'volume': 393, 'openInterest': 1325}"
09/04/2024,2.2100,2.2150,2.2057,2.2087,-0.0216,-0.97%,665,"1,293","{'tradeTime': '2024-09-04', 'openPrice': 2.21, 'highPrice': 2.215, 'lowPrice': 2.2057, 'lastPrice': 2.2087, 'priceChange': -0.0216, 'percentChange': -0.009684795767, 'volume': 665, 'openInterest': 1293}"
09/03/2024,2.2500,2.2500,2.2281,2.2303,-0.0602,-2.63%,311,"1,234","{'tradeTime': '2024-09-03', 'openPrice': 2.25, 'highPrice': 2.25, 'lowPrice': 2.2281, 'lastPrice': 2.2303, 'priceChange': -0.0602, 'percentChange': -0.026282471076, 'volume': 311, 'openInterest': 1234}"
08/30/2024,2.3064,2.3064,2.2905,2.2905,-0.0352,-1.51%,101,"1,212","{'tradeTime': '2024-08-30', 'openPrice': 2.3064, 'highPrice': 2.3064, 'lowPrice': 2.2905, 'lastPrice': 2.2905, 'priceChange': -0.0352, 'percentChange': -0.015135228103, 'volume': 101, 'openInterest': 1212}"
08/29/2024,2.2812,2.3257,2.2812,2.3257,+0.0389,+1.70%,493,"1,205","{'tradeTime': '2024-08-29', 'openPrice': 2.2812, 'highPrice': 2.3257, 'lowPrice': 2.2812, 'lastPrice': 2.3257, 'priceChange': 0.0389, 'percentChange': 0.017010669932, 'volume': 493, 'openInterest': 1205}"
08/28/2024,2.3146,2.3146,2.2868,2.2868,-0.0417,-1.79%,286,"1,134","{'tradeTime': '2024-08-28', 'openPrice': 2.3146, 'highPrice': 2.3146, 'lowPrice': 2.2868, 'lastPrice': 2.2868, 'priceChange': -0.0417, 'percentChange': -0.017908524801, 'volume': 286, 'openInterest': 1134}"
08/27/2024,2.3285,2.3285,2.3285,2.3285,-0.0336,-1.42%,71,"1,078","{'tradeTime': '2024-08-27', 'openPrice': 2.3285, 'highPrice': 2.3285, 'lowPrice': 2.3285, 'lastPrice': 2.3285, 'priceChange': -0.0336, 'percentChange': -0.014224630625, 'volume': 71, 'openInterest': 1078}"
08/26/2024,2.3650,2.3650,2.3621,2.3621,+0.0408,+1.76%,79,"1,083","{'tradeTime': '2024-08-26', 'openPrice': 2.365, 'highPrice': 2.365, 'lowPrice': 2.3621, 'lastPrice': 2.3621, 'priceChange': 0.0408, 'percentChange': 0.017576358075, 'volume': 79, 'openInterest': 1083}"
08/23/2024,2.3119,2.3213,2.3119,2.3213,+0.0359,+1.57%,95,"1,073","{'tradeTime': '2024-08-23', 'openPrice': 2.3119, 'highPrice': 2.3213, 'lowPrice': 2.3119, 'lastPrice': 2.3213, 'priceChange': 0.0359, 'percentChange': 0.015708409906, 'volume': 95, 'openInterest': 1073}"
08/22/2024,2.2960,2.2961,2.2854,2.2854,+0.0136,+0.60%,187,"1,069","{'tradeTime': '2024-08-22', 'openPrice': 2.296, 'highPrice': 2.2961, 'lowPrice': 2.2854, 'lastPrice': 2.2854, 'priceChange': 0.0136, 'percentChange': 0.005986442469, 'volume': 187, 'openInterest': 1069}"
08/21/2024,2.2861,2.2928,2.2691,2.2718,-0.0163,-0.71%,135,"1,013","{'tradeTime': '2024-08-21', 'openPrice': 2.2861, 'highPrice': 2.2928, 'lowPrice': 2.2691, 'lastPrice': 2.2718, 'priceChange': -0.0163, 'percentChange': -0.007123814519, 'volume': 135, 'openInterest': 1013}"
08/20/2024,2.2950,2.2950,2.2800,2.2881,-0.0138,-0.60%,271,"1,007","{'tradeTime': '2024-08-20', 'openPrice': 2.295, 'highPrice': 2.295, 'lowPrice': 2.28, 'lastPrice': 2.2881, 'priceChange': -0.0138, 'percentChange': -0.005995047569, 'volume': 271, 'openInterest': 1007}"
08/19/2024,2.3014,2.3019,2.3010,2.3019,-0.0427,-1.82%,480,924,"{'tradeTime': '2024-08-19', 'openPrice': 2.3014, 'highPrice': 2.3019, 'lowPrice': 2.301, 'lastPrice': 2.3019, 'priceChange': -0.0427, 'percentChange': -0.018212061759, 'volume': 480, 'openInterest': 924}"
08/16/2024,2.3569,2.3569,2.3435,2.3446,-0.0319,-1.34%,103,852,"{'tradeTime': '2024-08-16', 'openPrice': 2.3569, 'highPrice': 2.3569, 'lowPrice': 2.3435, 'lastPrice': 2.3446, 'priceChange': -0.0319, 'percentChange': -0.013423101199, 'volume': 103, 'openInterest': 852}"
08/15/2024,2.3740,2.3855,2.3740,2.3765,+0.0105,+0.44%,67,840,"{'tradeTime': '2024-08-15', 'openPrice': 2.374, 'highPrice': 2.3855, 'lowPrice': 2.374, 'lastPrice': 2.3765, 'priceChange': 0.0105, 'percentChange': 0.004437869822, 'volume': 67, 'openInterest': 840}"
08/14/2024,2.3815,2.3815,2.3651,2.3660,-0.0162,-0.68%,31,846,"{'tradeTime': '2024-08-14', 'openPrice': 2.3815, 'highPrice': 2.3815, 'lowPrice': 2.3651, 'lastPrice': 2.366, 'priceChange': -0.0162, 'percentChange': -0.006800436571, 'volume': 31, 'openInterest': 846}"
08/13/2024,2.3822,2.3822,2.3822,2.3822,-0.0200,-0.83%,27,842,"{'tradeTime': '2024-08-13', 'openPrice': 2.3822, 'highPrice': 2.3822, 'lowPrice': 2.3822, 'lastPrice': 2.3822, 'priceChange': -0.02, 'percentChange': -0.00832570144, 'volume': 27, 'openInterest': 842}"
08/12/2024,2.4022,2.4022,2.4022,2.4022,+0.0522,+2.22%,23,840,"{'tradeTime': '2024-08-12', 'openPrice': 2.4022, 'highPrice': 2.4022, 'lowPrice': 2.4022, 'lastPrice': 2.4022, 'priceChange': 0.0522, 'percentChange': 0.022212765957, 'volume': 23, 'openInterest': 840}"
08/09/2024,2.3515,2.3515,2.3500,2.3500,-0.0054,-0.23%,176,831,"{'tradeTime': '2024-08-09', 'openPrice': 2.3515, 'highPrice': 2.3515, 'lowPrice': 2.35, 'lastPrice': 2.35, 'priceChange': -0.0054, 'percentChange': -0.002292604229, 'volume': 176, 'openInterest': 831}"
08/08/2024,2.3472,2.3554,2.3470,2.3554,+0.0152,+0.65%,110,808,"{'tradeTime': '2024-08-08', 'openPrice': 2.3472, 'highPrice': 2.3554, 'lowPrice': 2.347, 'lastPrice': 2.3554, 'priceChange': 0.0152, 'percentChange': 0.006495171353, 'volume': 110, 'openInterest': 808}"
08/07/2024,2.3150,2.3402,2.3150,2.3402,+0.0424,+1.85%,91,808,"{'tradeTime': '2024-08-07', 'openPrice': 2.315, 'highPrice': 2.3402, 'lowPrice': 2.315, 'lastPrice': 2.3402, 'priceChange': 0.0424, 'percentChange': 0.018452432762, 'volume': 91, 'openInterest': 808}"
08/06/2024,2.3150,2.3158,2.2975,2.2978,-0.0058,-0.25%,196,798,"{'tradeTime': '2024-08-06', 'openPrice': 2.315, 'highPrice': 2.3158, 'lowPrice': 2.2975, 'lastPrice': 2.2978, 'priceChange': -0.0058, 'percentChange': -0.002517798229, 'volume': 196, 'openInterest': 798}"
08/05/2024,2.3000,2.3151,2.2920,2.3036,-0.0056,-0.24%,259,778,"{'tradeTime': '2024-08-05', 'openPrice': 2.3, 'highPrice': 2.3151, 'lowPrice': 2.292, 'lastPrice': 2.3036, 'priceChange': -0.0056, 'percentChange': -0.00242508228, 'volume': 259, 'openInterest': 778}"
08/02/2024,2.3706,2.3706,2.3092,2.3092,-0.0696,-2.93%,408,744,"{'tradeTime': '2024-08-02', 'openPrice': 2.3706, 'highPrice': 2.3706, 'lowPrice': 2.3092, 'lastPrice': 2.3092, 'priceChange': -0.0696, 'percentChange': -0.029258449638, 'volume': 408, 'openInterest': 744}"
08/01/2024,2.3788,2.3788,2.3788,2.3788,-0.0272,-1.13%,73,730,"{'tradeTime': '2024-08-01', 'openPrice': 2.3788, 'highPrice': 2.3788, 'lowPrice': 2.3788, 'lastPrice': 2.3788, 'priceChange': -0.0272, 'percentChange': -0.011305070657, 'volume': 73, 'openInterest': 730}"
07/31/2024,2.4184,2.4184,2.4060,2.4060,+0.0556,+2.37%,159,734,"{'tradeTime': '2024-07-31', 'openPrice': 2.4184, 'highPrice': 2.4184, 'lowPrice': 2.406, 'lastPrice': 2.406, 'priceChange': 0.0556, 'percentChange': 0.023655547992, 'volume': 159, 'openInterest': 734}"
07/30/2024,2.3570,2.3570,2.3504,2.3504,-0.0195,-0.82%,74,740,"{'tradeTime': '2024-07-30', 'openPrice': 2.357, 'highPrice': 2.357, 'lowPrice': 2.3504, 'lastPrice': 2.3504, 'priceChange': -0.0195, 'percentChange': -0.008228195283, 'volume': 74, 'openInterest': 740}"
07/29/2024,2.3699,2.3699,2.3699,2.3699,-0.0273,-1.14%,88,734,"{'tradeTime': '2024-07-29', 'openPrice': 2.3699, 'highPrice': 2.3699, 'lowPrice': 2.3699, 'lastPrice': 2.3699, 'priceChange': -0.0273, 'percentChange': -0.011388286334, 'volume': 88, 'openInterest': 734}"
07/26/2024,2.3880,2.4020,2.3876,2.3972,-0.0291,-1.20%,64,739,"{'tradeTime': '2024-07-26', 'openPrice': 2.388, 'highPrice': 2.402, 'lowPrice': 2.3876, 'lastPrice': 2.3972, 'priceChange': -0.0291, 'percentChange': -0.011993570457, 'volume': 64, 'openInterest': 739}"
07/25/2024,2.4150,2.4263,2.4071,2.4263,+0.0113,+0.47%,138,737,"{'tradeTime': '2024-07-25', 'openPrice': 2.415, 'highPrice': 2.4263, 'lowPrice': 2.4071, 'lastPrice': 2.4263, 'priceChange': 0.0113, 'percentChange': 0.004679089027, 'volume': 138, 'openInterest': 737}"
07/24/2024,2.4199,2.4222,2.4119,2.4150,+0.0269,+1.13%,79,677,"{'tradeTime': '2024-07-24', 'openPrice': 2.4199, 'highPrice': 2.4222, 'lowPrice': 2.4119, 'lastPrice': 2.415, 'priceChange': 0.0269, 'percentChange': 0.011264184917, 'volume': 79, 'openInterest': 677}"
07/23/2024,2.3950,2.4013,2.3881,2.3881,-0.0243,-1.01%,133,671,"{'tradeTime': '2024-07-23', 'openPrice': 2.395, 'highPrice': 2.4013, 'lowPrice': 2.3881, 'lastPrice': 2.3881, 'priceChange': -0.0243, 'percentChange': -0.010072956392, 'volume': 133, 'openInterest': 671}"
07/22/2024,2.3900,2.4124,2.3900,2.4124,+0.0120,+0.50%,31,657,"{'tradeTime': '2024-07-22', 'openPrice': 2.39, 'highPrice': 2.4124, 'lowPrice': 2.39, 'lastPrice': 2.4124, 'priceChange': 0.012, 'percentChange': 0.004999166806, 'volume': 31, 'openInterest': 657}"
07/19/2024,2.4000,2.4004,2.4000,2.4004,-0.0529,-2.16%,35,654,"{'tradeTime': '2024-07-19', 'openPrice': 2.4, 'highPrice': 2.4004, 'lowPrice': 2.4, 'lastPrice': 2.4004, 'priceChange': -0.0529, 'percentChange': -0.021562792973, 'volume': 35, 'openInterest': 654}"
07/18/2024,2.4533,2.4533,2.4533,2.4533,-0.0043,-0.17%,41,649,"{'tradeTime': '2024-07-18', 'openPrice': 2.4533, 'highPrice': 2.4533, 'lowPrice': 2.4533, 'lastPrice': 2.4533, 'priceChange': -0.0043, 'percentChange': -0.001749674479, 'volume': 41, 'openInterest': 649}"
07/17/2024,2.4576,2.4576,2.4576,2.4576,+0.0180,+0.74%,43,638,"{'tradeTime': '2024-07-17', 'openPrice': 2.4576, 'highPrice': 2.4576, 'lowPrice': 2.4576, 'lastPrice': 2.4576, 'priceChange': 0.018, 'percentChange': 0.007378258731, 'volume': 43, 'openInterest': 638}"
07/16/2024,2.4396,2.4396,2.4396,2.4396,-0.0261,-1.06%,21,631,"{'tradeTime': '2024-07-16', 'openPrice': 2.4396, 'highPrice': 2.4396, 'lowPrice': 2.4396, 'lastPrice': 2.4396, 'priceChange': -0.0261, 'percentChange': -0.010585229347, 'volume': 21, 'openInterest': 631}"
07/15/2024,2.4710,2.4710,2.4657,2.4657,-0.0007,-0.03%,55,630,"{'tradeTime': '2024-07-15', 'openPrice': 2.471, 'highPrice': 2.471, 'lowPrice': 2.4657, 'lastPrice': 2.4657, 'priceChange': -0.0007, 'percentChange': -0.000283814466, 'volume': 55, 'openInterest': 630}"
07/12/2024,2.4791,2.4823,2.4664,2.4664,-0.0057,-0.23%,58,623,"{'tradeTime': '2024-07-12', 'openPrice': 2.4791, 'highPrice': 2.4823, 'lowPrice': 2.4664, 'lastPrice': 2.4664, 'priceChange': -0.0057, 'percentChange': -0.002305731969, 'volume': 58, 'openInterest': 623}"
07/11/2024,2.4721,2.4721,2.4721,2.4721,+0.0015,+0.06%,16,604,"{'tradeTime': '2024-07-11', 'openPrice': 2.4721, 'highPrice': 2.4721, 'lowPrice': 2.4721, 'lastPrice': 2.4721, 'priceChange': 0.0015, 'percentChange': 0.000607139966, 'volume': 16, 'openInterest': 604}"
07/10/2024,2.4706,2.4706,2.4706,2.4706,-0.0084,-0.34%,23,601,"{'tradeTime': '2024-07-10', 'openPrice': 2.4706, 'highPrice': 2.4706, 'lowPrice': 2.4706, 'lastPrice': 2.4706, 'priceChange': -0.0084, 'percentChange': -0.00338846309, 'volume': 23, 'openInterest': 601}"
07/09/2024,2.4900,2.4900,2.4790,2.4790,-0.0357,-1.42%,100,608,"{'tradeTime': '2024-07-09', 'openPrice': 2.49, 'highPrice': 2.49, 'lowPrice': 2.479, 'lastPrice': 2.479, 'priceChange': -0.0357, 'percentChange': -0.014196524436, 'volume': 100, 'openInterest': 608}"
07/08/2024,2.5147,2.5147,2.5147,2.5147,-0.0064,-0.25%,39,574,"{'tradeTime': '2024-07-08', 'openPrice': 2.5147, 'highPrice': 2.5147, 'lowPrice': 2.5147, 'lastPrice': 2.5147, 'priceChange': -0.0064, 'percentChange': -0.002538574432, 'volume': 39, 'openInterest': 574}"
07/05/2024,2.5211,2.5211,2.5211,2.5211,-0.0282,-1.11%,55,572,"{'tradeTime': '2024-07-05', 'openPrice': 2.5211, 'highPrice': 2.5211, 'lowPrice': 2.5211, 'lastPrice': 2.5211, 'priceChange': -0.0282, 'percentChange': -0.011061860118, 'volume': 55, 'openInterest': 572}"
07/03/2024,2.5493,2.5493,2.5493,2.5493,+0.0136,+0.54%,16,562,"{'tradeTime': '2024-07-03', 'openPrice': 2.5493, 'highPrice': 2.5493, 'lowPrice': 2.5493, 'lastPrice': 2.5493, 'priceChange': 0.0136, 'percentChange': 0.005363410498, 'volume': 16, 'openInterest': 562}"
07/02/2024,2.5357,2.5357,2.5357,2.5357,+0.0118,+0.47%,91,560,"{'tradeTime': '2024-07-02', 'openPrice': 2.5357, 'highPrice': 2.5357, 'lowPrice': 2.5357, 'lastPrice': 2.5357, 'priceChange': 0.0118, 'percentChange': 0.004675304093, 'volume': 91, 'openInterest': 560}"
07/01/2024,2.5259,2.5260,2.5239,2.5239,+0.0493,+1.99%,18,572,"{'tradeTime': '2024-07-01', 'openPrice': 2.5259, 'highPrice': 2.526, 'lowPrice': 2.5239, 'lastPrice': 2.5239, 'priceChange': 0.0493, 'percentChange': 0.019922411703, 'volume': 18, 'openInterest': 572}"
06/28/2024,2.4746,2.4746,2.4746,2.4746,-0.0107,-0.43%,15,571,"{'tradeTime': '2024-06-28', 'openPrice': 2.4746, 'highPrice': 2.4746, 'lowPrice': 2.4746, 'lastPrice': 2.4746, 'priceChange': -0.0107, 'percentChange': -0.004305315254, 'volume': 15, 'openInterest': 571}"
06/27/2024,2.4853,2.4853,2.4853,2.4853,+0.0031,+0.12%,30,571,"{'tradeTime': '2024-06-27', 'openPrice': 2.4853, 'highPrice': 2.4853, 'lowPrice': 2.4853, 'lastPrice': 2.4853, 'priceChange': 0.0031, 'percentChange': 0.001248892112, 'volume': 30, 'openInterest': 571}"
06/26/2024,2.4822,2.4822,2.4822,2.4822,+0.0170,+0.69%,120,569,"{'tradeTime': '2024-06-26', 'openPrice': 2.4822, 'highPrice': 2.4822, 'lowPrice': 2.4822, 'lastPrice': 2.4822, 'priceChange': 0.017, 'percentChange': 0.006895992212, 'volume': 120, 'openInterest': 569}"
06/25/2024,2.4730,2.4746,2.4652,2.4652,-0.0088,-0.36%,134,538,"{'tradeTime': '2024-06-25', 'openPrice': 2.473, 'highPrice': 2.4746, 'lowPrice': 2.4652, 'lastPrice': 2.4652, 'priceChange': -0.0088, 'percentChange': -0.003556992724, 'volume': 134, 'openInterest': 538}"
06/24/2024,2.4740,2.4740,2.4740,2.4740,+0.0224,+0.91%,18,523,"{'tradeTime': '2024-06-24', 'openPrice': 2.474, 'highPrice': 2.474, 'lowPrice': 2.474, 'lastPrice': 2.474, 'priceChange': 0.0224, 'percentChange': 0.009136890194, 'volume': 18, 'openInterest': 523}"
06/21/2024,2.4575,2.4575,2.4516,2.4516,-0.0154,-0.62%,28,524,"{'tradeTime': '2024-06-21', 'openPrice': 2.4575, 'highPrice': 2.4575, 'lowPrice': 2.4516, 'lastPrice': 2.4516, 'priceChange': -0.0154, 'percentChange': -0.006242399676, 'volume': 28, 'openInterest': 524}"
06/20/2024,2.4670,2.4670,2.4670,2.4670,+0.0023,+0.09%,50,533,"{'tradeTime': '2024-06-20', 'openPrice': 2.467, 'highPrice': 2.467, 'lowPrice': 2.467, 'lastPrice': 2.467, 'priceChange': 0.0023, 'percentChange': 0.000933176451, 'volume': 50, 'openInterest': 533}"
06/18/2024,2.4525,2.4647,2.4525,2.4647,+0.0331,+1.36%,121,534,"{'tradeTime': '2024-06-18', 'openPrice': 2.4525, 'highPrice': 2.4647, 'lowPrice': 2.4525, 'lastPrice': 2.4647, 'priceChange': 0.0331, 'percentChange': 0.013612436256, 'volume': 121, 'openInterest': 534}"
06/17/2024,2.4316,2.4316,2.4316,2.4316,+0.0068,+0.28%,16,515,"{'tradeTime': '2024-06-17', 'openPrice': 2.4316, 'highPrice': 2.4316, 'lowPrice': 2.4316, 'lastPrice': 2.4316, 'priceChange': 0.0068, 'percentChange': 0.002804354998, 'volume': 16, 'openInterest': 515}"
06/14/2024,2.4248,2.4248,2.4248,2.4248,-0.0161,-0.66%,36,515,"{'tradeTime': '2024-06-14', 'openPrice': 2.4248, 'highPrice': 2.4248, 'lowPrice': 2.4248, 'lastPrice': 2.4248, 'priceChange': -0.0161, 'percentChange': -0.006595927732, 'volume': 36, 'openInterest': 515}"
06/13/2024,2.4409,2.4409,2.4409,2.4409,+0.0224,+0.93%,26,511,"{'tradeTime': '2024-06-13', 'openPrice': 2.4409, 'highPrice': 2.4409, 'lowPrice': 2.4409, 'lastPrice': 2.4409, 'priceChange': 0.0224, 'percentChange': 0.009261939219, 'volume': 26, 'openInterest': 511}"
06/12/2024,2.4400,2.4400,2.4185,2.4185,+0.0093,+0.39%,17,512,"{'tradeTime': '2024-06-12', 'openPrice': 2.44, 'highPrice': 2.44, 'lowPrice': 2.4185, 'lastPrice': 2.4185, 'priceChange': 0.0093, 'percentChange': 0.003860202557, 'volume': 17, 'openInterest': 512}"
06/11/2024,2.4175,2.4175,2.4092,2.4092,unch,unch,31,510,"{'tradeTime': '2024-06-11', 'openPrice': 2.4175, 'highPrice': 2.4175, 'lowPrice': 2.4092, 'lastPrice': 2.4092, 'priceChange': 0, 'percentChange': 0, 'volume': 31, 'openInterest': 510}"
06/10/2024,2.4100,2.4100,2.4092,2.4092,+0.0422,+1.78%,60,501,"{'tradeTime': '2024-06-10', 'openPrice': 2.41, 'highPrice': 2.41, 'lowPrice': 2.4092, 'lastPrice': 2.4092, 'priceChange': 0.0422, 'percentChange': 0.017828474863, 'volume': 60, 'openInterest': 501}"
06/07/2024,2.3670,2.3670,2.3670,2.3670,-0.0027,-0.11%,64,499,"{'tradeTime': '2024-06-07', 'openPrice': 2.367, 'highPrice': 2.367, 'lowPrice': 2.367, 'lastPrice': 2.367, 'priceChange': -0.0027, 'percentChange': -0.001139384732, 'volume': 64, 'openInterest': 499}"
06/06/2024,2.3600,2.3697,2.3600,2.3697,+0.0314,+1.34%,85,468,"{'tradeTime': '2024-06-06', 'openPrice': 2.36, 'highPrice': 2.3697, 'lowPrice': 2.36, 'lastPrice': 2.3697, 'priceChange': 0.0314, 'percentChange': 0.01342855921, 'volume': 85, 'openInterest': 468}"
06/05/2024,2.3383,2.3383,2.3383,2.3383,+0.0038,+0.16%,22,461,"{'tradeTime': '2024-06-05', 'openPrice': 2.3383, 'highPrice': 2.3383, 'lowPrice': 2.3383, 'lastPrice': 2.3383, 'priceChange': 0.0038, 'percentChange': 0.00162775755, 'volume': 22, 'openInterest': 461}"
06/04/2024,2.3500,2.3510,2.3345,2.3345,-0.0212,-0.90%,234,462,"{'tradeTime': '2024-06-04', 'openPrice': 2.35, 'highPrice': 2.351, 'lowPrice': 2.3345, 'lastPrice': 2.3345, 'priceChange': -0.0212, 'percentChange': -0.008999448147, 'volume': 234, 'openInterest': 462}"
06/03/2024,2.3700,2.3700,2.3541,2.3557,-0.0436,-1.82%,182,430,"{'tradeTime': '2024-06-03', 'openPrice': 2.37, 'highPrice': 2.37, 'lowPrice': 2.3541, 'lastPrice': 2.3557, 'priceChange': -0.0436, 'percentChange': -0.018171966824, 'volume': 182, 'openInterest': 430}"
05/31/2024,2.3993,2.3993,2.3993,2.3993,-0.0076,-0.32%,74,428,"{'tradeTime': '2024-05-31', 'openPrice': 2.3993, 'highPrice': 2.3993, 'lowPrice': 2.3993, 'lastPrice': 2.3993, 'priceChange': -0.0076, 'percentChange': -0.003157588599, 'volume': 74, 'openInterest': 428}"
05/30/2024,2.4351,2.4351,2.4069,2.4069,-0.0311,-1.28%,13,434,"{'tradeTime': '2024-05-30', 'openPrice': 2.4351, 'highPrice': 2.4351, 'lowPrice': 2.4069, 'lastPrice': 2.4069, 'priceChange': -0.0311, 'percentChange': -0.01275635767, 'volume': 13, 'openInterest': 434}"
05/29/2024,2.4375,2.4380,2.4374,2.4380,-0.0076,-0.31%,32,437,"{'tradeTime': '2024-05-29', 'openPrice': 2.4375, 'highPrice': 2.438, 'lowPrice': 2.4374, 'lastPrice': 2.438, 'priceChange': -0.0076, 'percentChange': -0.003107621851, 'volume': 32, 'openInterest': 437}"
05/28/2024,2.4456,2.4456,2.4456,2.4456,+0.0426,+1.77%,68,445,"{'tradeTime': '2024-05-28', 'openPrice': 2.4456, 'highPrice': 2.4456, 'lowPrice': 2.4456, 'lastPrice': 2.4456, 'priceChange': 0.0426, 'percentChange': 0.0177278402, 'volume': 68, 'openInterest': 445}"
05/24/2024,2.4030,2.4030,2.4030,2.4030,+0.0095,+0.40%,21,434,"{'tradeTime': '2024-05-24', 'openPrice': 2.403, 'highPrice': 2.403, 'lowPrice': 2.403, 'lastPrice': 2.403, 'priceChange': 0.0095, 'percentChange': 0.003969082933, 'volume': 21, 'openInterest': 434}"
05/23/2024,2.4000,2.4000,2.3935,2.3935,-0.0173,-0.72%,119,442,"{'tradeTime': '2024-05-23', 'openPrice': 2.4, 'highPrice': 2.4, 'lowPrice': 2.3935, 'lastPrice': 2.3935, 'priceChange': -0.0173, 'percentChange': -0.007176041148, 'volume': 119, 'openInterest': 442}"
05/22/2024,2.4108,2.4108,2.4108,2.4108,-0.0200,-0.82%,63,433,"{'tradeTime': '2024-05-22', 'openPrice': 2.4108, 'highPrice': 2.4108, 'lowPrice': 2.4108, 'lastPrice': 2.4108, 'priceChange': -0.02, 'percentChange': -0.008227743953, 'volume': 63, 'openInterest': 433}"
05/21/2024,2.4308,2.4308,2.4308,2.4308,-0.0130,-0.53%,67,432,"{'tradeTime': '2024-05-21', 'openPrice': 2.4308, 'highPrice': 2.4308, 'lowPrice': 2.4308, 'lastPrice': 2.4308, 'priceChange': -0.013, 'percentChange': -0.005319584254, 'volume': 67, 'openInterest': 432}"
05/20/2024,2.4438,2.4438,2.4438,2.4438,+0.0022,+0.09%,49,434,"{'tradeTime': '2024-05-20', 'openPrice': 2.4438, 'highPrice': 2.4438, 'lowPrice': 2.4438, 'lastPrice': 2.4438, 'priceChange': 0.0022, 'percentChange': 0.000901048493, 'volume': 49, 'openInterest': 434}"
05/17/2024,2.4425,2.4440,2.4416,2.4416,+0.0289,+1.20%,28,424,"{'tradeTime': '2024-05-17', 'openPrice': 2.4425, 'highPrice': 2.444, 'lowPrice': 2.4416, 'lastPrice': 2.4416, 'priceChange': 0.0289, 'percentChange': 0.011978281593, 'volume': 28, 'openInterest': 424}"
05/16/2024,2.4127,2.4127,2.4127,2.4127,+0.0087,+0.36%,59,409,"{'tradeTime': '2024-05-16', 'openPrice': 2.4127, 'highPrice': 2.4127, 'lowPrice': 2.4127, 'lastPrice': 2.4127, 'priceChange': 0.0087, 'percentChange': 0.003618968386, 'volume': 59, 'openInterest': 409}"
05/15/2024,2.3953,2.4135,2.3948,2.4040,+0.0057,+0.24%,112,394,"{'tradeTime': '2024-05-15', 'openPrice': 2.3953, 'highPrice': 2.4135, 'lowPrice': 2.3948, 'lastPrice': 2.404, 'priceChange': 0.0057, 'percentChange': 0.002376683484, 'volume': 112, 'openInterest': 394}"
05/14/2024,2.3950,2.3983,2.3943,2.3983,-0.0140,-0.58%,49,392,"{'tradeTime': '2024-05-14', 'openPrice': 2.395, 'highPrice': 2.3983, 'lowPrice': 2.3943, 'lastPrice': 2.3983, 'priceChange': -0.014, 'percentChange': -0.005803589935, 'volume': 49, 'openInterest': 392}"
05/13/2024,2.4123,2.4123,2.4123,2.4123,+0.0128,+0.53%,6,383,"{'tradeTime': '2024-05-13', 'openPrice': 2.4123, 'highPrice': 2.4123, 'lowPrice': 2.4123, 'lastPrice': 2.4123, 'priceChange': 0.0128, 'percentChange': 0.005334444676, 'volume': 6, 'openInterest': 383}"
05/10/2024,2.4050,2.4050,2.3995,2.3995,-0.0196,-0.81%,39,382,"{'tradeTime': '2024-05-10', 'openPrice': 2.405, 'highPrice': 2.405, 'lowPrice': 2.3995, 'lastPrice': 2.3995, 'priceChange': -0.0196, 'percentChange': -0.008102186764, 'volume': 39, 'openInterest': 382}"
05/09/2024,2.4191,2.4191,2.4191,2.4191,-0.0042,-0.17%,44,383,"{'tradeTime': '2024-05-09', 'openPrice': 2.4191, 'highPrice': 2.4191, 'lowPrice': 2.4191, 'lastPrice': 2.4191, 'priceChange': -0.0042, 'percentChange': -0.001733173771, 'volume': 44, 'openInterest': 383}"
05/08/2024,2.4233,2.4233,2.4185,2.4233,-0.0026,-0.11%,101,377,"{'tradeTime': '2024-05-08', 'openPrice': 2.4233, 'highPrice': 2.4233, 'lowPrice': 2.4185, 'lastPrice': 2.4233, 'priceChange': -0.0026, 'percentChange': -0.001071767179, 'volume': 101, 'openInterest': 377}"
05/07/2024,2.4225,2.4259,2.4171,2.4259,-0.0039,-0.16%,76,338,"{'tradeTime': '2024-05-07', 'openPrice': 2.4225, 'highPrice': 2.4259, 'lowPrice': 2.4171, 'lastPrice': 2.4259, 'priceChange': -0.0039, 'percentChange': -0.001605070376, 'volume': 76, 'openInterest': 338}"
05/06/2024,2.4282,2.4300,2.4195,2.4298,+0.0181,+0.75%,135,322,"{'tradeTime': '2024-05-06', 'openPrice': 2.4282, 'highPrice': 2.43, 'lowPrice': 2.4195, 'lastPrice': 2.4298, 'priceChange': 0.0181, 'percentChange': 0.007505079405, 'volume': 135, 'openInterest': 322}"
05/03/2024,2.4125,2.4183,2.4117,2.4117,+0.0050,+0.21%,34,288,"{'tradeTime': '2024-05-03', 'openPrice': 2.4125, 'highPrice': 2.4183, 'lowPrice': 2.4117, 'lastPrice': 2.4117, 'priceChange': 0.005, 'percentChange': 0.002077533552, 'volume': 34, 'openInterest': 288}"
05/02/2024,2.4152,2.4171,2.4067,2.4067,+0.0102,+0.43%,87,279,"{'tradeTime': '2024-05-02', 'openPrice': 2.4152, 'highPrice': 2.4171, 'lowPrice': 2.4067, 'lastPrice': 2.4067, 'priceChange': 0.0102, 'percentChange': 0.004256206968, 'volume': 87, 'openInterest': 279}"
05/01/2024,2.3965,2.3965,2.3965,2.3965,-0.0520,-2.12%,102,280,"{'tradeTime': '2024-05-01', 'openPrice': 2.3965, 'highPrice': 2.3965, 'lowPrice': 2.3965, 'lastPrice': 2.3965, 'priceChange': -0.052, 'percentChange': -0.021237492342, 'volume': 102, 'openInterest': 280}"
04/30/2024,2.4500,2.4500,2.4388,2.4485,-0.0061,-0.25%,20,270,"{'tradeTime': '2024-04-30', 'openPrice': 2.45, 'highPrice': 2.45, 'lowPrice': 2.4388, 'lastPrice': 2.4485, 'priceChange': -0.0061, 'percentChange': -0.00248512996, 'volume': 20, 'openInterest': 270}"
04/29/2024,2.4546,2.4546,2.4546,2.4546,-0.0130,-0.53%,2,267,"{'tradeTime': '2024-04-29', 'openPrice': 2.4546, 'highPrice': 2.4546, 'lowPrice': 2.4546, 'lastPrice': 2.4546, 'priceChange': -0.013, 'percentChange': -0.005268276868, 'volume': 2, 'openInterest': 267}"
04/26/2024,2.4896,2.4896,2.4676,2.4676,+0.0060,+0.24%,45,267,"{'tradeTime': '2024-04-26', 'openPrice': 2.4896, 'highPrice': 2.4896, 'lowPrice': 2.4676, 'lastPrice': 2.4676, 'priceChange': 0.006, 'percentChange': 0.002437439064, 'volume': 45, 'openInterest': 267}"
04/25/2024,2.4389,2.4695,2.4385,2.4616,+0.0087,+0.35%,54,266,"{'tradeTime': '2024-04-25', 'openPrice': 2.4389, 'highPrice': 2.4695, 'lowPrice': 2.4385, 'lastPrice': 2.4616, 'priceChange': 0.0087, 'percentChange': 0.003546822129, 'volume': 54, 'openInterest': 266}"
04/24/2024,2.4517,2.4529,2.4517,2.4529,-0.0082,-0.33%,37,262,"{'tradeTime': '2024-04-24', 'openPrice': 2.4517, 'highPrice': 2.4529, 'lowPrice': 2.4517, 'lastPrice': 2.4529, 'priceChange': -0.0082, 'percentChange': -0.003331843485, 'volume': 37, 'openInterest': 262}"
04/23/2024,2.4457,2.4611,2.4457,2.4611,+0.0180,+0.74%,31,256,"{'tradeTime': '2024-04-23', 'openPrice': 2.4457, 'highPrice': 2.4611, 'lowPrice': 2.4457, 'lastPrice': 2.4611, 'priceChange': 0.018, 'percentChange': 0.007367688592, 'volume': 31, 'openInterest': 256}"
04/22/2024,2.4431,2.4431,2.4431,2.4431,+0.0038,+0.16%,23,254,"{'tradeTime': '2024-04-22', 'openPrice': 2.4431, 'highPrice': 2.4431, 'lowPrice': 2.4431, 'lastPrice': 2.4431, 'priceChange': 0.0038, 'percentChange': 0.001557823966, 'volume': 23, 'openInterest': 254}"
04/19/2024,2.4325,2.4826,2.4325,2.4393,-0.0021,-0.09%,26,241,"{'tradeTime': '2024-04-19', 'openPrice': 2.4325, 'highPrice': 2.4826, 'lowPrice': 2.4325, 'lastPrice': 2.4393, 'priceChange': -0.0021, 'percentChange': -0.000860162202, 'volume': 26, 'openInterest': 241}"
04/18/2024,2.4458,2.4458,2.4414,2.4414,-0.0168,-0.68%,18,239,"{'tradeTime': '2024-04-18', 'openPrice': 2.4458, 'highPrice': 2.4458, 'lowPrice': 2.4414, 'lastPrice': 2.4414, 'priceChange': -0.0168, 'percentChange': -0.006834268977, 'volume': 18, 'openInterest': 239}"
04/17/2024,2.4582,2.4582,2.4582,2.4582,-0.0580,-2.31%,33,240,"{'tradeTime': '2024-04-17', 'openPrice': 2.4582, 'highPrice': 2.4582, 'lowPrice': 2.4582, 'lastPrice': 2.4582, 'priceChange': -0.058, 'percentChange': -0.023050631905, 'volume': 33, 'openInterest': 240}"
04/16/2024,2.5162,2.5162,2.5162,2.5162,+0.0017,+0.07%,5,236,"{'tradeTime': '2024-04-16', 'openPrice': 2.5162, 'highPrice': 2.5162, 'lowPrice': 2.5162, 'lastPrice': 2.5162, 'priceChange': 0.0017, 'percentChange': 0.000676078743, 'volume': 5, 'openInterest': 236}"
04/15/2024,2.5145,2.5145,2.5145,2.5145,-0.0078,-0.31%,1,236,"{'tradeTime': '2024-04-15', 'openPrice': 2.5145, 'highPrice': 2.5145, 'lowPrice': 2.5145, 'lastPrice': 2.5145, 'priceChange': -0.0078, 'percentChange': -0.003092415652, 'volume': 1, 'openInterest': 236}"
04/12/2024,2.5223,2.5223,2.5223,2.5223,+0.0197,+0.79%,8,236,"{'tradeTime': '2024-04-12', 'openPrice': 2.5223, 'highPrice': 2.5223, 'lowPrice': 2.5223, 'lastPrice': 2.5223, 'priceChange': 0.0197, 'percentChange': 0.007871813314, 'volume': 8, 'openInterest': 236}"
04/11/2024,2.5026,2.5026,2.5026,2.5026,-0.0138,-0.55%,49,236,"{'tradeTime': '2024-04-11', 'openPrice': 2.5026, 'highPrice': 2.5026, 'lowPrice': 2.5026, 'lastPrice': 2.5026, 'priceChange': -0.0138, 'percentChange': -0.005484024797, 'volume': 49, 'openInterest': 236}"
04/10/2024,2.5164,2.5164,2.5164,2.5164,+0.0216,+0.87%,76,240,"{'tradeTime': '2024-04-10', 'openPrice': 2.5164, 'highPrice': 2.5164, 'lowPrice': 2.5164, 'lastPrice': 2.5164, 'priceChange': 0.0216, 'percentChange': 0.008658008658, 'volume': 76, 'openInterest': 240}"
04/09/2024,2.4948,2.4948,2.4948,2.4948,-0.0226,-0.90%,53,264,"{'tradeTime': '2024-04-09', 'openPrice': 2.4948, 'highPrice': 2.4948, 'lowPrice': 2.4948, 'lastPrice': 2.4948, 'priceChange': -0.0226, 'percentChange': -0.008977516485, 'volume': 53, 'openInterest': 264}"
04/08/2024,2.5101,2.5287,2.5101,2.5174,-0.0059,-0.23%,63,264,"{'tradeTime': '2024-04-08', 'openPrice': 2.5101, 'highPrice': 2.5287, 'lowPrice': 2.5101, 'lastPrice': 2.5174, 'priceChange': -0.0059, 'percentChange': -0.002338207902, 'volume': 63, 'openInterest': 264}"
04/05/2024,2.5259,2.5260,2.5233,2.5233,+0.0012,+0.05%,22,251,"{'tradeTime': '2024-04-05', 'openPrice': 2.5259, 'highPrice': 2.526, 'lowPrice': 2.5233, 'lastPrice': 2.5233, 'priceChange': 0.0012, 'percentChange': 0.000475793981, 'volume': 22, 'openInterest': 251}"
04/04/2024,2.5221,2.5221,2.5221,2.5221,+0.0073,+0.29%,11,250,"{'tradeTime': '2024-04-04', 'openPrice': 2.5221, 'highPrice': 2.5221, 'lowPrice': 2.5221, 'lastPrice': 2.5221, 'priceChange': 0.0073, 'percentChange': 0.002902815333, 'volume': 11, 'openInterest': 250}"
04/03/2024,2.5148,2.5148,2.5148,2.5148,+0.0112,+0.45%,46,249,"{'tradeTime': '2024-04-03', 'openPrice': 2.5148, 'highPrice': 2.5148, 'lowPrice': 2.5148, 'lastPrice': 2.5148, 'priceChange': 0.0112, 'percentChange': 0.004473558076, 'volume': 46, 'openInterest': 249}"
04/02/2024,2.5036,2.5036,2.5036,2.5036,+0.0326,+1.32%,32,254,"{'tradeTime': '2024-04-02', 'openPrice': 2.5036, 'highPrice': 2.5036, 'lowPrice': 2.5036, 'lastPrice': 2.5036, 'priceChange': 0.0326, 'percentChange': 0.013193039255, 'volume': 32, 'openInterest': 254}"
04/01/2024,2.4710,2.4710,2.4710,2.4710,+0.0068,+0.28%,36,246,"{'tradeTime': '2024-04-01', 'openPrice': 2.471, 'highPrice': 2.471, 'lowPrice': 2.471, 'lastPrice': 2.471, 'priceChange': 0.0068, 'percentChange': 0.002759516273, 'volume': 36, 'openInterest': 246}"
03/28/2024,2.4642,2.4642,2.4642,2.4642,+0.0203,+0.83%,7,248,"{'tradeTime': '2024-03-28', 'openPrice': 2.4642, 'highPrice': 2.4642, 'lowPrice': 2.4642, 'lastPrice': 2.4642, 'priceChange': 0.0203, 'percentChange': 0.008306395515, 'volume': 7, 'openInterest': 248}"
03/27/2024,2.4439,2.4439,2.4439,2.4439,+0.0100,+0.41%,5,248,"{'tradeTime': '2024-03-27', 'openPrice': 2.4439, 'highPrice': 2.4439, 'lowPrice': 2.4439, 'lastPrice': 2.4439, 'priceChange': 0.01, 'percentChange': 0.004108632236, 'volume': 5, 'openInterest': 248}"
03/26/2024,2.4339,2.4339,2.4339,2.4339,-0.0193,-0.79%,94,249,"{'tradeTime': '2024-03-26', 'openPrice': 2.4339, 'highPrice': 2.4339, 'lowPrice': 2.4339, 'lastPrice': 2.4339, 'priceChange': -0.0193, 'percentChange': -0.007867275395, 'volume': 94, 'openInterest': 249}"
03/25/2024,2.4477,2.4532,2.4450,2.4532,+0.0252,+1.04%,18,227,"{'tradeTime': '2024-03-25', 'openPrice': 2.4477, 'highPrice': 2.4532, 'lowPrice': 2.445, 'lastPrice': 2.4532, 'priceChange': 0.0252, 'percentChange': 0.010378912685, 'volume': 18, 'openInterest': 227}"
03/22/2024,2.4280,2.4280,2.4280,2.4280,-0.0187,-0.76%,9,228,"{'tradeTime': '2024-03-22', 'openPrice': 2.428, 'highPrice': 2.428, 'lowPrice': 2.428, 'lastPrice': 2.428, 'priceChange': -0.0187, 'percentChange': -0.007642947644, 'volume': 9, 'openInterest': 228}"
03/21/2024,2.4467,2.4467,2.4467,2.4467,-0.0075,-0.31%,2,229,"{'tradeTime': '2024-03-21', 'openPrice': 2.4467, 'highPrice': 2.4467, 'lowPrice': 2.4467, 'lastPrice': 2.4467, 'priceChange': -0.0075, 'percentChange': -0.003055985657, 'volume': 2, 'openInterest': 229}"
03/20/2024,2.4542,2.4542,2.4542,2.4542,-0.0215,-0.87%,20,227,"{'tradeTime': '2024-03-20', 'openPrice': 2.4542, 'highPrice': 2.4542, 'lowPrice': 2.4542, 'lastPrice': 2.4542, 'priceChange': -0.0215, 'percentChange': -0.008684412489, 'volume': 20, 'openInterest': 227}"
03/19/2024,2.4888,2.4888,2.4757,2.4757,-0.0077,-0.31%,20,226,"{'tradeTime': '2024-03-19', 'openPrice': 2.4888, 'highPrice': 2.4888, 'lowPrice': 2.4757, 'lastPrice': 2.4757, 'priceChange': -0.0077, 'percentChange': -0.003100587904, 'volume': 20, 'openInterest': 226}"
03/18/2024,2.4834,2.4834,2.4834,2.4834,+0.0257,+1.05%,13,225,"{'tradeTime': '2024-03-18', 'openPrice': 2.4834, 'highPrice': 2.4834, 'lowPrice': 2.4834, 'lastPrice': 2.4834, 'priceChange': 0.0257, 'percentChange': 0.010456931277, 'volume': 13, 'openInterest': 225}"
03/15/2024,2.4577,2.4577,2.4577,2.4577,+0.0057,+0.23%,20,228,"{'tradeTime': '2024-03-15', 'openPrice': 2.4577, 'highPrice': 2.4577, 'lowPrice': 2.4577, 'lastPrice': 2.4577, 'priceChange': 0.0057, 'percentChange': 0.002324632953, 'volume': 20, 'openInterest': 228}"
03/14/2024,2.4520,2.4520,2.4520,2.4520,+0.0263,+1.08%,49,227,"{'tradeTime': '2024-03-14', 'openPrice': 2.452, 'highPrice': 2.452, 'lowPrice': 2.452, 'lastPrice': 2.452, 'priceChange': 0.0263, 'percentChange': 0.010842231109, 'volume': 49, 'openInterest': 227}"
03/13/2024,2.4257,2.4257,2.4257,2.4257,+0.0429,+1.80%,45,222,"{'tradeTime': '2024-03-13', 'openPrice': 2.4257, 'highPrice': 2.4257, 'lowPrice': 2.4257, 'lastPrice': 2.4257, 'priceChange': 0.0429, 'percentChange': 0.018004028874, 'volume': 45, 'openInterest': 222}"
03/12/2024,2.3828,2.3828,2.3828,2.3828,-0.0114,-0.48%,3,211,"{'tradeTime': '2024-03-12', 'openPrice': 2.3828, 'highPrice': 2.3828, 'lowPrice': 2.3828, 'lastPrice': 2.3828, 'priceChange': -0.0114, 'percentChange': -0.004761506975, 'volume': 3, 'openInterest': 211}"
03/11/2024,2.3942,2.3942,2.3942,2.3942,+0.0219,+0.92%,3,211,"{'tradeTime': '2024-03-11', 'openPrice': 2.3942, 'highPrice': 2.3942, 'lowPrice': 2.3942, 'lastPrice': 2.3942, 'priceChange': 0.0219, 'percentChange': 0.009231547443, 'volume': 3, 'openInterest': 211}"
03/08/2024,2.3723,2.3723,2.3723,2.3723,-0.0185,-0.77%,0,209,"{'tradeTime': '2024-03-08', 'openPrice': 2.3723, 'highPrice': 2.3723, 'lowPrice': 2.3723, 'lastPrice': 2.3723, 'priceChange': -0.0185, 'percentChange': -0.00773799565, 'volume': 0, 'openInterest': 209}"
03/07/2024,2.3908,2.3908,2.3908,2.3908,+0.0063,+0.26%,13,209,"{'tradeTime': '2024-03-07', 'openPrice': 2.3908, 'highPrice': 2.3908, 'lowPrice': 2.3908, 'lastPrice': 2.3908, 'priceChange': 0.0063, 'percentChange': 0.002642063326, 'volume': 13, 'openInterest': 209}"
03/06/2024,2.3770,2.3845,2.3770,2.3845,+0.0273,+1.16%,7,204,"{'tradeTime': '2024-03-06', 'openPrice': 2.377, 'highPrice': 2.3845, 'lowPrice': 2.377, 'lastPrice': 2.3845, 'priceChange': 0.0273, 'percentChange': 0.011581537417, 'volume': 7, 'openInterest': 204}"
03/05/2024,2.3572,2.3572,2.3572,2.3572,-0.0172,-0.72%,11,205,"{'tradeTime': '2024-03-05', 'openPrice': 2.3572, 'highPrice': 2.3572, 'lowPrice': 2.3572, 'lastPrice': 2.3572, 'priceChange': -0.0172, 'percentChange': -0.00724393531, 'volume': 11, 'openInterest': 205}"
03/04/2024,2.3744,2.3744,2.3744,2.3744,-0.0182,-0.76%,20,206,"{'tradeTime': '2024-03-04', 'openPrice': 2.3744, 'highPrice': 2.3744, 'lowPrice': 2.3744, 'lastPrice': 2.3744, 'priceChange': -0.0182, 'percentChange': -0.007606787595, 'volume': 20, 'openInterest': 206}"
03/01/2024,2.3926,2.3926,2.3926,2.3926,+0.0187,+0.79%,14,197,"{'tradeTime': '2024-03-01', 'openPrice': 2.3926, 'highPrice': 2.3926, 'lowPrice': 2.3926, 'lastPrice': 2.3926, 'priceChange': 0.0187, 'percentChange': 0.007877332659, 'volume': 14, 'openInterest': 197}"
02/29/2024,2.3739,2.3739,2.3739,2.3739,+0.0051,+0.22%,19,196,"{'tradeTime': '2024-02-29', 'openPrice': 2.3739, 'highPrice': 2.3739, 'lowPrice': 2.3739, 'lastPrice': 2.3739, 'priceChange': 0.0051, 'percentChange': 0.002152988855, 'volume': 19, 'openInterest': 196}"
02/28/2024,2.3688,2.3688,2.3688,2.3688,-0.0171,-0.72%,4,194,"{'tradeTime': '2024-02-28', 'openPrice': 2.3688, 'highPrice': 2.3688, 'lowPrice': 2.3688, 'lastPrice': 2.3688, 'priceChange': -0.0171, 'percentChange': -0.007167106752, 'volume': 4, 'openInterest': 194}"
02/27/2024,2.3859,2.3859,2.3859,2.3859,+0.0036,+0.15%,1,194,"{'tradeTime': '2024-02-27', 'openPrice': 2.3859, 'highPrice': 2.3859, 'lowPrice': 2.3859, 'lastPrice': 2.3859, 'priceChange': 0.0036, 'percentChange': 0.001511144692, 'volume': 1, 'openInterest': 194}"
02/26/2024,2.3823,2.3823,2.3823,2.3823,+0.0286,+1.22%,7,193,"{'tradeTime': '2024-02-26', 'openPrice': 2.3823, 'highPrice': 2.3823, 'lowPrice': 2.3823, 'lastPrice': 2.3823, 'priceChange': 0.0286, 'percentChange': 0.012151081276, 'volume': 7, 'openInterest': 193}"
02/23/2024,2.3537,2.3537,2.3537,2.3537,-0.0251,-1.06%,10,193,"{'tradeTime': '2024-02-23', 'openPrice': 2.3537, 'highPrice': 2.3537, 'lowPrice': 2.3537, 'lastPrice': 2.3537, 'priceChange': -0.0251, 'percentChange': -0.010551538591, 'volume': 10, 'openInterest': 193}"
02/22/2024,2.3750,2.3788,2.3750,2.3788,+0.0135,+0.57%,13,192,"{'tradeTime': '2024-02-22', 'openPrice': 2.375, 'highPrice': 2.3788, 'lowPrice': 2.375, 'lastPrice': 2.3788, 'priceChange': 0.0135, 'percentChange': 0.005707521245, 'volume': 13, 'openInterest': 192}"
02/21/2024,2.3653,2.3653,2.3653,2.3653,+0.0054,+0.23%,2,192,"{'tradeTime': '2024-02-21', 'openPrice': 2.3653, 'highPrice': 2.3653, 'lowPrice': 2.3653, 'lastPrice': 2.3653, 'priceChange': 0.0054, 'percentChange': 0.002288232552, 'volume': 2, 'openInterest': 192}"
02/20/2024,2.3599,2.3599,2.3599,2.3599,-0.0356,-1.49%,12,192,"{'tradeTime': '2024-02-20', 'openPrice': 2.3599, 'highPrice': 2.3599, 'lowPrice': 2.3599, 'lastPrice': 2.3599, 'priceChange': -0.0356, 'percentChange': -0.01486119808, 'volume': 12, 'openInterest': 192}"
02/16/2024,2.3775,2.3955,2.3775,2.3955,+0.0139,+0.58%,14,189,"{'tradeTime': '2024-02-16', 'openPrice': 2.3775, 'highPrice': 2.3955, 'lowPrice': 2.3775, 'lastPrice': 2.3955, 'priceChange': 0.0139, 'percentChange': 0.005836412496, 'volume': 14, 'openInterest': 189}"
02/15/2024,2.3816,2.3816,2.3816,2.3816,+0.0139,+0.59%,3,190,"{'tradeTime': '2024-02-15', 'openPrice': 2.3816, 'highPrice': 2.3816, 'lowPrice': 2.3816, 'lastPrice': 2.3816, 'priceChange': 0.0139, 'percentChange': 0.005870676184, 'volume': 3, 'openInterest': 190}"
02/14/2024,2.3775,2.3775,2.3677,2.3677,-0.0269,-1.12%,25,189,"{'tradeTime': '2024-02-14', 'openPrice': 2.3775, 'highPrice': 2.3775, 'lowPrice': 2.3677, 'lastPrice': 2.3677, 'priceChange': -0.0269, 'percentChange': -0.011233608953, 'volume': 25, 'openInterest': 189}"
02/13/2024,2.3946,2.3946,2.3946,2.3946,+0.0047,+0.20%,4,180,"{'tradeTime': '2024-02-13', 'openPrice': 2.3946, 'highPrice': 2.3946, 'lowPrice': 2.3946, 'lastPrice': 2.3946, 'priceChange': 0.0047, 'percentChange': 0.001966609482, 'volume': 4, 'openInterest': 180}"
02/12/2024,2.3899,2.3899,2.3899,2.3899,-0.0145,-0.60%,46,179,"{'tradeTime': '2024-02-12', 'openPrice': 2.3899, 'highPrice': 2.3899, 'lowPrice': 2.3899, 'lastPrice': 2.3899, 'priceChange': -0.0145, 'percentChange': -0.006030610547, 'volume': 46, 'openInterest': 179}"
02/09/2024,2.4044,2.4044,2.4044,2.4044,+0.0191,+0.80%,1,150,"{'tradeTime': '2024-02-09', 'openPrice': 2.4044, 'highPrice': 2.4044, 'lowPrice': 2.4044, 'lastPrice': 2.4044, 'priceChange': 0.0191, 'percentChange': 0.008007378527, 'volume': 1, 'openInterest': 150}"
02/08/2024,2.3853,2.3853,2.3853,2.3853,+0.0196,+0.83%,33,150,"{'tradeTime': '2024-02-08', 'openPrice': 2.3853, 'highPrice': 2.3853, 'lowPrice': 2.3853, 'lastPrice': 2.3853, 'priceChange': 0.0196, 'percentChange': 0.008285074185, 'volume': 33, 'openInterest': 150}"
02/07/2024,2.3657,2.3657,2.3657,2.3657,+0.0145,+0.62%,5,134,"{'tradeTime': '2024-02-07', 'openPrice': 2.3657, 'highPrice': 2.3657, 'lowPrice': 2.3657, 'lastPrice': 2.3657, 'priceChange': 0.0145, 'percentChange': 0.006167063627, 'volume': 5, 'openInterest': 134}"
02/06/2024,2.3512,2.3512,2.3512,2.3512,+0.0008,+0.03%,26,133,"{'tradeTime': '2024-02-06', 'openPrice': 2.3512, 'highPrice': 2.3512, 'lowPrice': 2.3512, 'lastPrice': 2.3512, 'priceChange': 0.0008, 'percentChange': 0.000340367597, 'volume': 26, 'openInterest': 133}"
02/05/2024,2.3504,2.3504,2.3504,2.3504,+0.0314,+1.35%,0,130,"{'tradeTime': '2024-02-05', 'openPrice': 2.3504, 'highPrice': 2.3504, 'lowPrice': 2.3504, 'lastPrice': 2.3504, 'priceChange': 0.0314, 'percentChange': 0.013540319103, 'volume': 0, 'openInterest': 130}"
02/02/2024,2.3190,2.3190,2.3190,2.3190,-0.0267,-1.14%,0,130,"{'tradeTime': '2024-02-02', 'openPrice': 2.319, 'highPrice': 2.319, 'lowPrice': 2.319, 'lastPrice': 2.319, 'priceChange': -0.0267, 'percentChange': -0.011382529735, 'volume': 0, 'openInterest': 130}"
02/01/2024,2.3457,2.3457,2.3457,2.3457,-0.0389,-1.63%,0,130,"{'tradeTime': '2024-02-01', 'openPrice': 2.3457, 'highPrice': 2.3457, 'lowPrice': 2.3457, 'lastPrice': 2.3457, 'priceChange': -0.0389, 'percentChange': -0.016313008471, 'volume': 0, 'openInterest': 130}"
01/31/2024,2.3846,2.3846,2.3846,2.3846,-0.0225,-0.93%,7,130,"{'tradeTime': '2024-01-31', 'openPrice': 2.3846, 'highPrice': 2.3846, 'lowPrice': 2.3846, 'lastPrice': 2.3846, 'priceChange': -0.0225, 'percentChange': -0.009347347431, 'volume': 7, 'openInterest': 130}"
01/30/2024,2.4071,2.4071,2.4071,2.4071,+0.0139,+0.58%,3,126,"{'tradeTime': '2024-01-30', 'openPrice': 2.4071, 'highPrice': 2.4071, 'lowPrice': 2.4071, 'lastPrice': 2.4071, 'priceChange': 0.0139, 'percentChange': 0.005808123015, 'volume': 3, 'openInterest': 126}"
01/29/2024,2.3932,2.3932,2.3932,2.3932,-0.0242,-1.00%,2,125,"{'tradeTime': '2024-01-29', 'openPrice': 2.3932, 'highPrice': 2.3932, 'lowPrice': 2.3932, 'lastPrice': 2.3932, 'priceChange': -0.0242, 'percentChange': -0.010010755357, 'volume': 2, 'openInterest': 125}"
01/26/2024,2.4174,2.4174,2.4174,2.4174,+0.0170,+0.71%,0,124,"{'tradeTime': '2024-01-26', 'openPrice': 2.4174, 'highPrice': 2.4174, 'lowPrice': 2.4174, 'lastPrice': 2.4174, 'priceChange': 0.017, 'percentChange': 0.007082152975, 'volume': 0, 'openInterest': 124}"
01/25/2024,2.3925,2.4004,2.3925,2.4004,+0.0322,+1.36%,17,124,"{'tradeTime': '2024-01-25', 'openPrice': 2.3925, 'highPrice': 2.4004, 'lowPrice': 2.3925, 'lastPrice': 2.4004, 'priceChange': 0.0322, 'percentChange': 0.013596824593, 'volume': 17, 'openInterest': 124}"
01/24/2024,2.3682,2.3682,2.3682,2.3682,-0.0001,unch,0,126,"{'tradeTime': '2024-01-24', 'openPrice': 2.3682, 'highPrice': 2.3682, 'lowPrice': 2.3682, 'lastPrice': 2.3682, 'priceChange': -0.0001, 'percentChange': -4.222438e-05, 'volume': 0, 'openInterest': 126}"
01/23/2024,2.3683,2.3683,2.3683,2.3683,-0.0055,-0.23%,0,126,"{'tradeTime': '2024-01-23', 'openPrice': 2.3683, 'highPrice': 2.3683, 'lowPrice': 2.3683, 'lastPrice': 2.3683, 'priceChange': -0.0055, 'percentChange': -0.002316960148, 'volume': 0, 'openInterest': 126}"
01/22/2024,2.3738,2.3738,2.3738,2.3738,+0.0314,+1.34%,0,126,"{'tradeTime': '2024-01-22', 'openPrice': 2.3738, 'highPrice': 2.3738, 'lowPrice': 2.3738, 'lastPrice': 2.3738, 'priceChange': 0.0314, 'percentChange': 0.013405054645, 'volume': 0, 'openInterest': 126}"
01/19/2024,2.3424,2.3424,2.3424,2.3424,-0.0204,-0.86%,0,126,"{'tradeTime': '2024-01-19', 'openPrice': 2.3424, 'highPrice': 2.3424, 'lowPrice': 2.3424, 'lastPrice': 2.3424, 'priceChange': -0.0204, 'percentChange': -0.008633824276, 'volume': 0, 'openInterest': 126}"
